comment_id,original_comment,detected_aspects,aspect_count,matched_keywords
5048,penyakitnya cuma satu osnya walaupun iklan masih bisa diakalin pake dns uninstall apps iklan atau cusrom buat pengguna instan ga terlalu friendly terus entah suka ada bug di setiap updatenya pengalaman make dari mi i redmi redmi x redmi note poco x isu yang selama ini diraguin orang soal matot apakah udah dibenahin kita lihat aja kedepannya,"Software, Connectivity",2,"apps, kedepannya"
5051,nyimak apa daya masih pakek asus zenfon max pro m,Battery,1,daya
5054,cuma bisa nonton doang hp tetap xiaomi note pro pemakaian sejak no minus cuma lecet pemakain dan ngecas sehari x selain itu aman buka harga pembelian awal rp minat komen,"Price, Battery",2,"ngecas, harga"
5055,sekarang mah udah ga ada harga dirinya bang wkwk,Price,1,harga
5056,rekomed hp allround game bisa kamera bagus,"Camera, Performance",2,"game, kamera"
5065,saran gaess mending poco f atau xiaomi t aku liat review foto mode malam xiaomi t agak kekuningan soalnya,Camera,1,foto
5066,apa ane gk salah denger belum support bypass charging wtf,"Features, Battery",2,"bypass, charging"
5067,bang tanya dong f pro yg mahal chipset masih gen tp kenapa f biasa yg murah dapet gen,Price,1,mahal
5068,bang buatin dong rekomendasi buat beli hp dari harga sejutaan mau beli hp bulan depan budget pas an tapi mau cari yg all in bang,Price,1,harga
5069,aku malah suka makin lebar daripada panjang,Display,1,lebar
5070,kalau mau fokus experience gaming ambil iqoo neo kalau all rounder ambil f kalau pen maen game sambil di charge ada bypass charging iqoo neo kalau pen pake ngegame seadanya boleh ke f sesimpel itu padahal,"Features, Design, Performance, Battery",4,"game, bypass, charging, seadanya"
5073,bang david titip saran kalau bisa soal penentuan buat main game bikin pengnengahnya dong dari game yang biasanya bang david riviewgua bingung enak yg mana tapi kalau bisa bikinin bang biar viewer ada ngerasa ada yang beda dari videonya bang david,Performance,1,game
5075,tambahin riview game nya bang cobain di delta force yang lagi hype,Performance,1,game
5076,masih setia dg nothing phone sudah mau taun pakai aman kamera luar biasa,Camera,1,kamera
5078,hp idaman di harga begini,Price,1,harga
5079,sayang gak ada bypas charging tapi mungkin poco punya filosofi dia tau pasarnya hp gaming tapi dia gak pengen orang orang kecanduan maen hp makanya fitur bypas charging gak ada,"Features, Battery",2,"charging, bypas"
5082,minus nya satu aja bg nih poco klo beli kek gacha ada yang bagus tahan lama dan ada yang bagus tpi tdk tahan lama padahal pemakaian normal itu aja sih soalnya pengalaman aku dan adek ku hp sama tpi adek ku punya sering matot akhirnya ganti iqoo,"Features, Connectivity",2,adek
5083,makin tua tetep suka cari hp spek gaming walaupun bukan buat main game soalnya paling males gonta ganti hp biar masih satset buat dipake sampe tahun lagi,"Audio, Performance",2,"game, gonta"
5087,poco f series ink mirip banget spek xiaomi redmi s dan awal release spek nya ga tanggung tapi kita tau sendiri redmi bahkan note lama mulai nanggung ya namanya juga perusahaan klo makin laris bakal makin mahal era nokia samsung juga nawarin lebih murah skrg samsung paling overpriced,Price,1,mahal
5092,njir kameranya bisa di pakai ngevlog k fps stabil parah iqoo neo gempa bumi dari kamera utama sampai kamera depan,Camera,1,kamera
5094,akhirnya ganti hp juga aku setelah liat ini hp poco f murah kamera stabil sm buat game mantep,"Camera, Price, Performance",3,"game, murah, kamera"
5095,nonton pake f masih boros baterai,Battery,1,baterai
5099,saya pake hp samsung galaxy m mulai dari awal zaman covid dan sampai tahun ini masih saya pakai samsung m nya dengan kapasitas batrai mah niat nya mau upgrade ke poco f gimana ya menurut kalian kalo upgrade dari samsung m ke poco f,Storage,1,kapasitas
5108,bang knapa gk pernah rievew transsion paling unboxing,Audio,1,knapa
5111,yang saya suka tu dari bentuk bazzel layarnya itu cakep banget,Design,1,bentuk
5118,gw dr redmi x ke poco f trus poco f dan smua itu gw puass bgt tanpa mendang mending lagi bisa dibilang gw beli hp price to performa untuk jangka panjang tp f gw blm sampe nih tp gw yakin bkal puas soalnya dr f peningkatan nya bkal kerasa ngt sama kyk dri redmi x ke poco f yg terasa wahh,Performance,1,performa
5119,bang coba tes gamenya pake wuthering waves soalnya game itu lebih berat dari genshin,Performance,1,game
5123,saya lebih suka pada desain nya,Design,1,desain
5129,ntar iklan juga muncul didalam tu,BuildQuality,1,didalam
5131,bang coba main pubg gak semua orang player moba,Performance,1,moba
5133,bang sekali² tes foto di osteria gia pik bang saya staff osteria gia tapi di pik hehehehe,"Camera, Connectivity",2,"foto, pik"
5135,oh ya ada vidio potret ga sih kaya poco x pro,Camera,1,potret
5140,keren bangett,Display,1,bangett
5143,nntn review ini pake poco f the best buat secondary device intinya f worth it dpt harga jt,Price,1,harga
5145,​nufone potongan harga dr tokped beli aja yg tokped plus ntr potongannnya gede bs sampe rban tp saya belinya menit setelah launch gk tau deh skrg segede itu gk diskonnya,Price,1,harga
5153,hp panas batre boros klo udh panas lelet banget hpnya terakhir pake f paling mantap skrg pake f udh mulai kecewa gk mau lg lah bli poco,Battery,1,batre
5157,bener bang david kelas mide range jt an beli yg ram jangan beli dibawah standar itu,Storage,1,ram
5158,tumben reviewnya dibawah menit biasanya suka lama,Audio,1,tumben
5159,speaker mono kah,Audio,1,mono
5160,nah iya penasaran tumben gada dijelasin sama bang david,Audio,1,tumben
5162,ditunggu video abng baru muncul,Camera,1,video
5163,nah ini desain hp yang saya suka tp saya lebih suka yang polosan sih kaya yg opsi warna white hehe,"Design, Storage",2,"opsi, desain"
5171,cam nya ok juga nih,Performance,1,cam
5172,cam nya ok juga nih,Performance,1,cam
5173,hp nya keren cuma udah difase chip bukan segalanya sih wkwk lebih nyari kamera sekarang asli dh game cuma ml,"Camera, Performance",2,"game, kamera"
5175,bang david unboxing pova dong pengen tau baterai mah nya,Battery,1,baterai
5176,mewah emg ni hpdgn hp yg sebegitu murah,Price,1,murah
5177,헣헨헟헔헨헪헜헡 tempat paling masuk akal buat sekarang,Network,1,tempat
5182,gw make hp poco x nfc pemakaian tahun tombol volume hilang udah ganti lcd habis ganti lcd kadang muncul di layar hitam putih bisa nego minat bls komentar gw ajaa,"Connectivity, Audio, Design, Display, Features",5,"hitam, nfc, lcd"
5184,tambah fitur baru tuh bang davidfitur masak telur derajat,Features,1,fitur
5187,lgi nonton pake f tapi iri liat desain f,Design,1,desain
5188,ttp infinix gt proyg lgi otwps proud adg akn kuat buat maen game pc,Performance,1,game
5189,nonton pakek legen pocophone f,"Features, Connectivity",2,pocophone
5191,kalo gw sih ramrom yang harus gede kalo kamera belakangan soalnya gw gak suka fto,"Camera, Network",2,"fto, kamera"
5192,bangitu kameranya kan mp kecil banget dibanding series redmi note yang mp bantu jelasin dong buat abang yang ngerti kamera,Camera,1,kamera
5193,mp gede ngga selalu berarti lebih bagus ada faktor lain kayak sensor kamera yang dipake dan kualitas lensanya iphone pro max aja mp tapi kamera nya jauh jauh lebih bagus dari redmi note yang mp kan,"Display, Camera",2,"kamera, lensanya"
5194,​hanzkuyy iya sihbang poco pake sony ya udah pernah pake poco buat bikin video kemarin dan hasilnya jauh lebih bagusjernih dan stabil dibanding redmi note pro,Camera,1,video
5204,entah knp di hp poco x nfc gw yg dluudh dipakek beberapa tahun blm muncul iklan sama sekalipdahal di forum fb bnyak yg bilang pda dpt iklanapakah karna gw belinya pas hpnya udh rilis tahun yg lalu kah,"Features, Connectivity",2,nfc
5205,bodinya kurang sreg lebih adem liat poco x pro,"Design, BuildQuality",2,bodinya
5206,suka sama bentuk layarnya,Design,1,bentuk
5208,yang nonton pakai f lagi mantau,"Features, Connectivity",2,mantau
5209,speakernya gimana bang kok gk dibahas bagus kah atau malah cempreng,Security,1,cempreng
5211,nonton video ini pake poco f sudah tahun anti lemot mantep poco semoga ada rejeki lagi buat beli poco f seri berikutnya aamiin,Camera,1,video
5212,gw unsubcribe bang bosen lu selalu ngetes performa genshin sama mlbb mulu masa spek tinggi sesalu test game ringan,"Design, Performance",2,"game, ringan"
5213,waduw menang banyak nih poco f apalagi kameranya detail aja udah cakep parah semoga kalo xiaomi t masuk kamera telefoto nya sebagus ini lahh,"Design, Camera",2,"kamera, cakep"
5214,xiaomi seri t pakai mediatek jelek buat game intinya mediatek nya xiaomi grup jelek,Performance,1,game
5215,​umarcellorang bahas kamera kau bahas game banyak yg harus bisa dinilai dari hp bukan cuma performa gaming doang,"Camera, Performance",2,"game, kamera"
5219,hmmm kok saya udah gak tertarik lagi ya sama hp poco terakhir pake poco f rata emang kenceng hp xiaomi dan poco dengan value for money yang oke tapi rasa enak dipakai cuma bertahan tahun aja setepah itu ada aja masalah ya sekarang pake samsung aja walau processor biasa tapi enak dipakai dan kamera cukup bisa diandalkan dibanding poco di harga sekelas,"Camera, Price",2,"kamera, harga"
5221,gak apa ada iklan biar bisa jualan murah dan update lama tapi ya jangan iklan pinjol dan judol juga,"Software, Price",2,"murah, update"
5222,bang cari wallpaper bagus kaya di video dimana bang,Camera,1,video
5224,berarti perbedaannya jauh juga ya sama poco f pro yg stabil bgt tuh liat buat kaum mendang² poco f dan poco f pro walaupun antutu sama tpi performa game beda jauh,Performance,1,game
5228,review merk ssd dari yang ori sampai palsu dari yang murah sampai mahal dari paling laku sampai kurang laku dari yang tahan banting sampai yang sensitif mudah rusak dari kecil sampai yang besar dari yang cepat sampai lelet daaaan yang paling penting adalah yang di rekomendasikan dari segi harga kekuatan kecepatan pokok nya banyak lebih nya lah,"Price, Performance",2,"cepat, harga"
5230,showcase archon pyro,Display,1,showcase
5231,hedeh bisa upgrade ke f ga ya pake f dari aja sampai sekarang jadi daily driver masih blm ada penurunan performa yang signifikan batere aja yg sedikit boros itu jg setelah upgrade ke hyperos,"Software, Performance",2,"penurunan, hyperos"
5234,speaker audio jack nya gmn bang,Audio,1,audio
5236,baterai mha tp tetap durasinya tdk sebaik baterai mha bahkan mha sekalipun di merk sebelah hyperbug emang optimalisasi software nya buruk wajar sih target pasarnya kan bocil yg cari hp gaming murah dgn spek yg penting kencang,"Storage, Software, Price, Battery",4,"baterai, murah, sebaik, software"
5242,ram tb,Storage,1,ram
5245,fyi aku baru beli poco m pro x pro keduanya gak ada iklan yang penting teliti matiin layanan iklan di setup awal sama nonaktifin di tiap aplikasi bawaan gak ribet kok matiinnya utk ukuran pengguna samsung ya mantap poco,"Software, Display",2,"aplikasi, ukuran"
5249,kameranya bagus coy video nya juga layar lebar nge buled bagus multi lancar wah all round sih,"Display, Camera",2,"video, layar"
5252,ini kirakira ada masalah matot gk sih mau ganti hp setelah pake realme pro selama tahun kebutuhan sama pengen hp yang awet mau foto sama ngegame dikit lagi ngelist hp poco f realme pro motorola fusion edge ada yang bisa rekomendasiin thankyou,Camera,1,foto
5254,kalian sadar gak david gak bahas bypass sama sekali kalo gw pikir fitur itu emang gak penting sih yakali mainin hp mulu mata gak perih tuh,Features,1,bypass
5255,bg bahas hp nubia zte a atau a bg harganya paling terjangkau,Price,1,harganya
5257,jangan di kasih tau bang entar habis update di taro iklan kwwkwkwk,Software,1,update
5260,kebanyakan gimmick hp murah tuhh,Price,1,murah
5261,prosesor kenceng antutunya suhunya tembus ° boros juga banyak penyefonk raja poco ini bilang panas bisa membuat performa menurun kepada brand infinix sekarang mereka nelen ludah sendiri,"Display, Performance",2,"performa, antutunya"
5264,desain bocil gaming,Design,1,desain
5267,saran dong agan agan sekalian bismillah mau ganti hp dari realme x pro nyari hp buat sehari² game moba tipis tipis kamera lumayan buat foto² pilihan iqoo neo atau poco f kira² apa yaa,"Design, Camera, Storage, Performance",4,"game, kamera, pilihan, tipis"
5270,itu emang kamera selfie nya klo ngerekam suaranya pindah kiri kanan kiri kanan kah,"Audio, Camera",2,"kamera, suaranya"
5274,soc kenceng bukan hanya utk game klo aq lebih ke pemakaian jngka panjang th seengganya dg soc kenceng ram gede storage lega hp jd ga mngkin lemot,"Storage, Performance",2,"game, lega"
5275,lumayan sih kamera ny masih bisa di andelin,Camera,1,kamera
5277,desain layarnya kaya oppo find x g mantapp,Design,1,desain
5280,speaker cuma kah,Audio,1,speaker
5283,lambat laun seiring bertambah usia yg trpenting di hp bukan lagi ngebut sangar garang dll tp ui yg smoth tanpa iklan jaminan software update baterai yg bersahabat untuk kebutuhan daily klo udh kerja aplikasi yg penting cm wa microsoft dsb in pendapat pribadi jgn d mendang mendingin,"Software, Performance, Battery",3,"bertambah, baterai, aplikasi"
5285,poco f malah ngeri kasih x update os dan tahun security,Software,1,security
5287,lambat laun saya pengen hp yg tahan air dan tahan banting wkwkw,Performance,1,lambat
5288,untungnya sekarang di xiaomi ada semua ui yang udah mulai smooth hp nya juga sat set performa juga enak kamera udah bagus ngecas juga cepet dipake daily juga enak baterai awet ga salah emg pilihan gw ambil xiaomi karna semua ada,"Software, Camera, Storage, Battery, Performance",5,"baterai, kamera, ui, pilihan, performa"
5289,susah sih bikin fps stabil di game berat untuk poco sekarang karna sudah gak dilimiiiit mantap poco bukan gak bisa sebenarnya bisa aja fpsnya stabil tapi harus di limit di suhu tertentu sekarang systemnya secara continue dari awal menaik turunkan fpsnya biar gak terlalu panas gantian limitasi yg agresif di keluaran terdahulu,"Connectivity, Performance",2,"game, agresif"
5299,yang penting kamera bagus untuk rekam video k fps fps oke jujur caperibet bawa iphone dan android,"Software, Camera",2,"android, kamera"
5303,kadang random klik tapi nemu yang pas begini tuh satisfying banget  thanks pulauwin,Network,1,klik
5308,gk tes speaker nya kah bang,Audio,1,speaker
5311,desain kamera kaya gini nih bagus ga usah kamera gimmic kamera seadanya ja asal lensaya bagus modul juga simple jadi bisa pake pake cooler lebar,"Design, Display, Camera",3,"kamera, lebar, desain"
5312,saya awalnya gak mikir panjang jujur langsung beli tapi bentuk cameranya,Design,1,bentuk
5313,yang penting kualitas perekaman bagus,Camera,1,perekaman
5314,klo soal bentuk kamera menurutku lebih aman poco dibanding iqoo,"Design, Camera",2,"kamera, bentuk"
5316,kalau poco f ini sama samsung a buat daily drive bagus mana ya buat kamera jangka panjang,Camera,1,kamera
5318,kalo buat kamera jangka panjang kayaknya lebih bagus samsung a atau vivo v deh,Camera,1,kamera
5320,​vsharaakalo buat fotografi sih gak usah diraguin lagi ya v ini tapi kalo buat video masih bagusan samsung a jadi disesuaikan aja sama kebutuhannya kalo yang versi pronya saya kurang tau bakal masuk atau enggak,Camera,1,video
5329,alhamdulillah dari pakej redmu pro masi bisa kepakek masi nabung mau ganti hp karena merasa internal gb kurang besar semoga bisa keturutan beli hp baru tahun ini aamiin in dong aamiin,Storage,1,internal
5334,jujur ngeliat hp lain di harga jt spek yang dikasih sudah bagus tapi entah kenapa brand samsung tetap melekat di hati ga bisa move on walaupun sudah tau spek yang dikasih ga terlalu wah seperti hp jt lain nya kayanya samsung punya target pasar nya sendiri sekarang malah beralih lagi ke samsung a g,"Display, Price",2,"harga, move"
5336,untuk kamera dan video bagusan mana poco f atau samsung a,Camera,1,kamera
5340,pokoknya kalo buat main game selain hp ip atau samsung recomended sih yg lain udhlah apalagi game open world ga bakal kuat chipset nya,Performance,1,game
5344,di toko ijo harganya dapet dimana dah,Price,1,harganya
5348,dari pake redmi sampe skrng nonton yt bang gadgetinpengen banget ganti hp di tahun skrngtapi apalah daya kerja udh nabung susah gak tau nya abis karena judolgitu terus dari dulucapekk eyy susah kali stop judol ini,Battery,1,daya
5354,pengen banget hp ini bagus bgt harga segitu fiturnya berlimpah banget,Price,1,harga
5357,nonton pakai oppo reno g hp yg kebeli dari awal thn sekarang alhamdulillah masih awet minus cuma ganti tombol on off power yg lain normal,"Audio, Software",2,off
5364,bangsaran kalo mau nyoba game paling berat mungkin bisa menggunakan game wuthering wavebanyak tuh wuthering wave efek dan visualisasi nyasaya pake itel p g yang dimensity harus rata kanan,Performance,1,game
5365,mohon maaf melenceng btw mau nanya nih di sini ada yang sedangpernah pake poco m pro punyaku dulu pernah setelah diupdate security patchhyper os jadi kecerahan layar kadang² terang sendiri padahal berada dalam ruangan redup cahaya solusinya saya atur manual dah kejadian kek gitu sempat bbrpa kali lupa soalnya,"Software, Display",2,"security, layar"
5376,tumben ngk bahas ai nya vid padahal ai nya banyak,Audio,1,tumben
5377,nnton pake poco x pro pengen ganti ke f semoga bisa,"Features, Connectivity",2,nnton
5378,bang benchmark game nya coba pakek wuthering waves dong gamenya berat butuh rendering kenceng juga buat ngetest performance aja genshin masih oke lah,Performance,1,game
5383,bang kalo kamera bagus f apa x pro,Camera,1,kamera
5385,tumben tumbenan kali ini beli hp tanpa liat review gadgetin dulu gas langsung beli pas baru keluar biasanya harus liat review lalu beli karena harganya terlalu gila,"Audio, Price",2,"tumben, harganya"
5387,tim yang ga terlalu suka layar gedealhamdulillah tahun ini bisa kebeli xiaomi walaupun ga masuk ke indonesia,Display,1,layar
5395,ayo poco next seri f tambahin bypass charging mau disebut gimmik inovasi besar pun ga masalah yang penting ada biar makin ga tersaingi,"Features, Battery",2,"bypass, charging"
5404,punya sy redmi note pro dari taon sampe skrg msh lancar jaya lcd jernih,Audio,1,lcd
5405,​​musangr tergantung pemakain aja bg cuman ini memang udah bawaan penyakit dari lahir poco kayak bom waktu tinggal nunggu gilirian aja tapi saya yakin untuk seri poco sekarang harusnya udah diperbaiki dan di optimasisasi,Performance,1,lahir
5409,design layar yg kayak poco ini emg gua suka sih semoga layar yg kayak gini bakal diterapin ya sama brand lain buat di tahun ke depan wkwkw,Display,1,layar
5413,masalah iklan memang aneh sih saya pakai f dari masih miui sampai sekarang hyper os tetap gak ada iklan sedangkan yg lebih mahal ada iklannya,"Software, Price",2,"hyper, mahal"
5414,gua juga masih stay f alhamdulillah ga ada kendala sampai sekarang niatnya mau up ke f tpi kamera unggul f,Camera,1,kamera
5415,pake seri x aja udah enak x pro awet komplit kamera sm chipset aman tp klo dapet dana buat beli f sih lgsg ganti deh semoga bisa dpt rezeki buat ganti ke seri f ini,Camera,1,kamera
5418,w ngarep sekali kalau android ada standar desktop mode sudah muncul banyak hp dengan spek dan harga segini sudah bisa type c ke hdmi hehehehe,"Software, Price, Network",3,"hdmi, android, harga"
5421,samsung bagus di ui sama layar doang sih kalo sektor yang lain ampas kalo dibanding brand lain dirange harganya,"Software, Display, Price",3,"ui, layar, harganya"
5424,​imb dm n kalo teknologi mah sama aja bro kalo belom sampe tahun perbedaannya yg jadi kebutuhan gue bukan sekedar game makanya belom bisa yakin aja pindah ke xiaomi dkk masih lebih prefer cari yg all rounder tapi kamera bagus storage gede aja sih menyesuaikan kebutuhan,"Camera, Storage, Performance",3,"game, kamera, storage"
5425,poco gak cuma main game all rouder life balance iqoo pure game cocok buat lajang yg jam main game dengan fitur bypass,"Features, Design, Performance",3,"game, bypass, life"
5426,katnya hrga jt tp aku cek di mall² harga nya jtan,Price,1,harga
5427,jam main game di pc bg atau konsol,Performance,1,game
5428,​wandragaming beda ram sama rom jadinya mahal,"Storage, Software, Price",3,"rom, ram, mahal"
5429,main game jam ada fitur bypass main game sampe mata buta,"Features, Performance",2,"game, bypass"
5430,gw nonton video ini pake poco x nfc,"Features, Camera, Connectivity",3,"video, nfc"
5437,kenapa poco device kalau terkoneksi dengan tws bluetooth suaranya jelektapi dengan tws yang sama dengan hp samsung galaxy jadi lebih manteb,"Audio, Connectivity",2,"bluetooth, suaranya"
5438,bnr ga sih katanya ada isu dgn instalasi aplikasi lwt playstore slh satu temen gw katany gitu,Software,1,aplikasi
5440,gak ada bypass charging hahaha,"Features, Battery",2,"bypass, charging"
5443,masih nunggu honor pro di indo dapet update software tahun,Software,1,software
5454,sudah co dan ini seperti hape impian di harga jutaan dan yang pasti saya gk ngejar gamingnya tapi pengen punya hape midrange yang looknya mahal tpi gk banyak disunat,Price,1,harga
5457,semahal nya produk xiomi ttp ada iklan nyaaacuma itu si yg sangat disayangkan,"Software, Security, Performance",3,"disayangkan, semahal"
5458,tolong dong bang untuk jangka panjang mending f ini atau a ya kebutuhan daily ngampuss ngegame ringan ringan aja seneng dokumentasi sih skrg wkwkwk,Design,1,ringan
5460,tapi storage cuman gb,Storage,1,storage
5461,​angganugraha storage ampas cmn doank di poco f ku aja udah pakai storage external tb,"Storage, Connectivity",2,external
5463,gw aminin kan cuma jutaan tunggu tahun sdh keburu ngumpul duitnya dan harga sdh turun banyak bang,Price,1,harga
5469,jaringan g kah,Network,1,jaringan
5470,dari tahun pake redmi note udah jalan tahun hari ini baru ganti ke tecno pro g lebih komplit ai nya kamera lebih bagus karna ga pentingin game lebih ke kamera dan udah bisa diajak didarat dan air wkwkw,"Camera, Performance",2,"game, kamera"
5471,uda di kasih pilihan jutaan penyimpanan masih aja tetep setia nungu samsung ngeluarin harga jutaan penyimpanan entah tahun berapa baru keluar,"Storage, Price",2,"penyimpanan, harga"
5475,aku penggemar poco hp aku yang satunya poco f yang aku beli beberapa tahun yang lalu sampai sekarang masih aktif masih tokcer tapi aku kepincut poco f ram aku mau pensiunkan poco f ku mantap poco,Storage,1,ram
5487,andai xiaomi nambahin fitur kamera thermal ir,"Features, Camera",2,"fitur, kamera"
5489,menurut abang untuk segi kamera lebih mending x pro atau f,Camera,1,kamera
5497,support bypass chargenya gak,Features,1,bypass
5502,mm audio jackkk,Audio,1,audio
5503,lah ngetes hp kok pake genshit emang masih jaman wkwk standard sekarang itu bukan genshit lagipakai game lain jangan genshit lagi udah ketinggalan,Performance,1,game
5504,cmiiw bang saran mungkin untuk test high spec perform pake gamenya pakai game lain takutnya genshinnya yg dari sananya kurang optimasi untuk mobile mungkin bisa di test dengan black desert atau wuthering waves saran saja karena pengalaman beberapa player include me genshin juga setelah ada natlan memang agak ngadatngadat mau main pake pcmobile gaming,"Software, Display, Performance",3,"game, perform, cmiiw"
5505,jadi mendingan poco f polos apa f pro kalo kita omongin soal apa yang didapet dengan harga yang kita keluarin,Price,1,harga
5506,wkkw vangke gw nonton malah pakai adek nya f yg beli pas taon awal release kmaren,"Features, Connectivity",2,adek
5511,poco f gt masih aman ga ada yang seri tombol gaming lagi kah poco,Audio,1,tombol
5513,bang kok kopong backdoor nya,BuildQuality,1,backdoor
5515,desainer poco keknya agak agak norak seleranya lebih demen yg putih drpd yg hitam atau ini,"Design, Display",2,hitam
5516,nonton ini pake poco f yg pake custom rom android dan masih ngebut skrg kerezekian cekout poco f alhamdulillah,"Software, Performance",2,"android, ngebut"
5518,o gitu aja mana by pass charging nyaa teme,Battery,1,charging
5519,gak bosen minta agar tim dagetin juga melakukan tes main game wuthering waves di hp yg sedang direview,Performance,1,game
5522,kapan punya hp spek gahar cok,Performance,1,gahar
5523,suara speakernya gimna kok ga direview,Audio,1,suara
5525,masih belum worth it upgrade dari x pro soalnya liat² ga terlalu jauh kek nya nunggu f biar lebih kerasa upgrade,Price,1,worth
5528,bg sesekali hp yang gaming itu bandingin juga antara pake colling fan biar asik,Design,1,sesekali
5531,video stabil tp audionya kurang high ya,Camera,1,video
5536,untuk sekarang itu hp gaming itu udah kurang saya minati karena udah terlalu sibuk kerjaan real gamelebih butuh yg balance performa dapatkamera pun dapatdan yahh kecepatan charger juga penting,Performance,1,performa
5539,real raja gabanyak gimmick naro harga mahal kaya sebelah,Price,1,harga
5541,always on display di poco f bisa always trus tapi di seri atas nyaa gk always,"Display, Connectivity",2,display
5542,pernah komen kayak gini di channel yutube lain berasa hp murah ya aod cuma detik,Price,1,murah
5543,audio nya gimana bang,Audio,1,audio
5551,hape premium tapi harga ramah,"Design, Price",2,"premium, harga"
5553,gak enak pegangnya terlalu lebar,Display,1,lebar
5555,poco x pro gw baru bulan dah g bsa nyari wifi dan bluetooth sampah abis poco gak akan lagi gw beli tu hp kapook untungnya mash ada yg mw terima pdahal tu hp dimanja ga pernah buat main game berat cma buat nonton dan game ringan coc najis tu hp cuihh pergi ke cs nya dikerjaan lama amat bener najissss semangat aja kalian yg poconya baguss,"Connectivity, Design, Performance",3,"bluetooth, coc"
5557,tonton jagat review ngab iqoo hasil cameranya video dan fotonya ampas bet,"Display, Camera",2,"video, fotonya"
5559,nambah dikit atau mending beli sekenan t atau v ajaaslibiar ngk nyesel bab kamera dan ketahanan tapi balik lagi ke selera dan dana,Camera,1,kamera
5563,bang udh lama ngga bahas kamera kameracoba bang review insta ace pro,Camera,1,kamera
5571,bang ga mau coba test pake game wuthering wave melihat reviewer lain pada test pake game itu tidak gi lagi karena mungkin hp jt udah sanggup jalanin game nya,Performance,1,game
