comment_id,original_comment,detected_aspects,aspect_count,matched_keywords
3052,kurang nya cuma speaker nya mono,Audio,1,mono
3053,ml game enteng ya ram gw kok kadang msh lag dan lama masuknya ke ingame,"Design, Software, Storage, Performance",4,"game, ram, enteng, lag"
3060,stabil ya kamera nyaa,Camera,1,kamera
3061,andai ada bypass charging sempurna,"Features, Battery",2,"bypass, charging"
3064,izin kakak abg saya mau tanya tapi sebelum itu saya curhat dulu kemarin habis kemalingan hp vivo tipe t pro g itu dimaling pas saya lagi sholat subuh di masjid dan saya juga tinggal di masjid sebagai marbot nah kebetulan saya sekarang saya kuliah semester akhir yang mana perlu banget hp saya mau tanya hp yg worth it sekarang di harga jt paling spesifikasi yg paling dibutuhkan itu penyimpanan sama kamera aja ga main game jg mohon sarannya bossku,"Storage, Camera, Price, Performance",4,"game, kamera, harga, penyimpanan"
3068,bisa e sim gasih,Network,1,sim
3080,poco f sama xiaomi t worth it mana ya,Price,1,worth
3081,f otw upgrade f biar harganya engga turun,Price,1,harganya
3086,f lebih gahar ketimbang embel pro dan ultra aga aneh tapi nyata,"Design, Performance",2,"gahar, aga"
3087,bagus visualnya ya omsekilas saya hand on f saja mirip mirip megang iphone dari uk layar iphone rata rata pendek melebarkalo android rata rata memanjang keatas kalo seri proultra bulet bulet bosen,"Software, Display",2,"android, layar"
3091,kok lebih kerasa premium poco f dari pada f ultra wkwk,Design,1,premium
3093,pengalaman buruk poco f adik saya poco f foto digallery sering ilang tiba gimana tu kalo f,Camera,1,foto
3094,mungkin ada settingannya om kalo lama auto kehapus mungkin,Network,1,settingannya
3102,keknya tergantung penggunaan deh omsoalnya sampai sekarang x pro saya juga masih normal gada namanya ghost touch matot yang ada ya minus umur di colokan yang mulai error batrai bunting gitu ajadari performa ini x pro juga masih enak karna kalo buat game ndak pernah set mentok kanan,"Connectivity, Performance",2,"game, colokan"
3103,isu lawas sih bang cuman leluhurnya aja x pro f f kalo sekarang sih aman aja banget tergantung user nya sendiri,"Features, Connectivity",2,lawas
3107,bagus sihtapi kurang suka sama model yg bezel tipis begituterlalu ganggu kalo ngegame karena kena pangkal jari jempol suka gerak sendiri,Design,1,model
3109,sudah saatnya asus zenfone z ku ganti,Connectivity,1,zenfone
3111,emang gk ada review suara speaker ny atau gua yg kelewatan ya biasanya selalu ada tes speaker,Audio,1,speaker
3112,masih pake poco f masih nyaman gapengen ipon salah satu bedanya cuma desain sama size hasil camera selebihnya gabutuh desain dan merk dan gilanya sampai hari ini masih nyaman aja ganti cuma tombol volume patah dan karena gamau ikutan trend upgrade gadged u now poco adalah hp china nya ipon versi perfom ga snapdragon ga beli pak btw mantan user redmi after salenya mati parah ama ni series drpd beli new redmi note mending seken poco yg normal,"Audio, Design, Display, Network",4,"selebihnya, ikutan, trend, desain"
3115,ada yg mau game enak tapi minta kamera bagus lawak ada yg beli spek gensi tapi di pake game masih lawak,"Camera, Performance",2,"game, kamera"
3119,alhamdulillah beli adeknya yg rilis tahun kemaren karna udah turun harga yaitu f,Price,1,harga
3122,​abim waduh gw kebetulan ga main codm sorry ya bang tapi gua main beberapa game lain menurut gua sih lancar aman jaya enak juga tapi beberapa gwme berat menurut gua agak cepet panas ya tapi yang gak sepanas itu apalgi kalau dimain diluar ruangan yang kondisi cuaca nya juga lumayan panas gue sempet main roblox juga map nya indo voice yang kata temen gua berat dan diaa cepet banget panasnya wkwkw mungkin saran gue kalau lu ada niat beli hp ini tapi sering game luar ruangan sedia cooler hp kali ya karna jujur agak cepet panas wkwkw cuman ok kok,Performance,1,game
3123,buat batre juga normal lah yang gak cepet banget habis dan gak awet banget pas pemakaian ke gue udah gas main beberapa game dia cuman cas x,"Performance, Battery",2,"game, batre"
3127,gokil sih salah satu hp android yang buat gw terkesima desain oke spek kamera oke spek jeroan juga oke harga pun oke,"Design, Software, Camera, Price",4,"desain, android, kamera, harga"
3129,asli ini video lucu banget wkwk pas main 𝗔𝗟𝗘𝗫𝗜𝗦 barusan next upload harus lebih lucu dari ini ya,Camera,1,video
3131,kalo mentingin kamera lebih baik ambil samsung a samsung lebih bagus harga mirip atau nambah iphone,"Camera, Price",2,"kamera, harga"
3135,internal gb cuma kepake gb masih kurang,Storage,1,internal
3138,ya elah maah ga ada bypass charging,"Features, Battery",2,"bypass, charging"
3140,sebenarnya skrg yg paling jadi tolok ukur ini hp benar kuat apa ga soal perfoma adalah tes di game diablo immortal di bagian pvp battleground bakalan ketahuan kualitas perfomanya,"Connectivity, Performance",2,"game, diablo"
3142,ya ke video lain kek kan ada teddykho atau video lain,Camera,1,video
3143,untuk saya pribadi akan lebih senang jika poco f masih menyediakan audio jack di perangkatnya,Audio,1,audio
3144,aku beli x pro waktu pertama keluar saat ini aku coment pake poco f untuk kamera aku lebih suka x pro jauh lebaynya cahaya kamera x pro bikin aku puas dengan kamera nya,Camera,1,kamera
3145,aku sih lebih pilih yg mahal realme gt gak apa mahal yg penting awet capek pakai poco mau bagus kyk mana pun spek nya selalu aja banyak bug system hp selalu mentok logo data hilang semua capek,"Storage, Software, Price",3,"mahal, system"
3146,akan berasa mahalnya ketika main game life after,"Design, Performance",2,"game, life"
3147,bahas cara atur kamera samsung s untuk setting malam hari dong bang,Camera,1,kamera
3148,kualitas suaranya gimana bang,Audio,1,suaranya
3149,mending ini poco f ato xiaomi t lebih perlu kamera sama memory,Camera,1,kamera
3152,saya kmrin pesan poco f hpnya bgus performanya kencang sesuai dengan apa yg di riview oleh abng tapi ko fast chargingnya tidak sesuai dengan apa yg di riview dari ke itu butuh waktu sejam tidak menit,"Features, Network, Performance",3,"performanya, sejam, chargingnya"
3159,info case poco f yg dipake dalam video bang,Camera,1,video
3163,masih nonton pake redmi walaupun udah pengin ganti tapi stay dulu dah,"Features, Connectivity",2,pengin
3164,poco f di box nya gak ada adapter headphone jack ya,Audio,1,box
3167,gw yg masih pake f p dan x nfc cuman bisa liat dan nunggu poco berfokus ke kamera setara gopixip series,"Features, Camera, Connectivity",3,"kamera, nfc"
3168,sapa yg kesini setelah liat video om bennix,Camera,1,video
3169,review maen game pubg bg dpt fps k dan stabil ngk ya,Performance,1,game
3174,t apa ini buat emak n foto jg,Camera,1,foto
3175,kuncinya hp merek samsungiphonevivo infinixoppoxiaomipocoiq dll harus memberikan spesifikasi hp atau laptop dengan procecor terbaik dan kamera memory dan kelengkapan port terbaik dengan kualitas terbaik yang berkualitas dan harus dengan harga yang murah supaya menguasai pasar perdagangan dunia,"Storage, Camera, Price",3,"port, kamera, harga"
3183,kalo dipikirpikir ya baru kali ini xiaomi baru ngerasain lawan yang bener² worth dulu lawan asus akhirnya asus nyerah main di mid range realme udh jarang produksi hp skrg² aja transsion menggila iqoo,Price,1,worth
3184,komen pake poco x nfc udah tahun masih normal batrai awet semoga bisa upgrade ke poco x pro,"Features, Connectivity",2,nfc
3185,sudah bulan make poco x pro sejauh ini enak dan ternyata kameranya lumayan bagus banyak yg nanya pake hp apa kalau update story,Software,1,update
3197,pegangan skr poco f gt poco x pro dan redmi k ultra harus dijual nih ganti poco f polos worth it banget kayanya,Price,1,worth
3198,dari f f f skrg f pemakaian untuk kerja gambar layout design excel pdf edit² lagu n video kelemahannya case bagian area kamera srg gosong karna kepanasan jadinya kalo mw foto hrs lap² dulu bercak gosong di lensanya,"Display, Camera",2,"foto, lensanya"
3199,uya lagi kaca kameranya menurutku kekurangan poco pegang f dari awal,BuildQuality,1,kaca
3206,sekarang udah jamannya handheld pc kalau emang maunya ngegame,Design,1,maunya
3210,pas nih ky nya buat ganti hp redmi yg sudah th apakah poco f ini ada fitur dual video buat vlogger dan belajar konten kreator perlu dual video depan belakang bisa on bersamaan,"Features, Camera",2,"video, dual"
3214,jeleknya xiaom pocoi yg gw rasain pindah dr samsung kalkulator cobain deh kaya gimana itungannya hadehh jauh sama bawaan samsung tampilan sama fungsi lainnya deh iklan ada dimana harus di setting buat di turn off tombol navigasi yg dibagian bawah ga seenak samsung ukuran sama responnya masa keluar gamettup aplikasi jg susa telpon dr yang ga dikenal dr promo pinjol gabisa langsung di blokir harus buka panggilan terakhir dll gtau nih bkal ad lg ga kedepannya smoga aja bisa diperbaiki sama poco pantes samsung msh unggul dikit,"Audio, Software, Display, Connectivity",4,"kedepannya, off, aplikasi, ukuran"
3215,bang kalo test gaming tambahin game wuthering wave bang soalnya masih blm ada yg bisa jinakin game itu,Performance,1,game
3217,bagus siih tapi tetep masih kangen earphone jack di sisi atas,"Audio, Display",2,"earphone, sisi"
3224,itu ram ama ufsnya numpuk nggk sih soalnya takut aja penyakit pocco kambuh lagi matot gegara kaki ramnya badconect,Storage,1,ram
3227,masih pakai x nfc,"Features, Connectivity",2,nfc
3229,kalau dari samsung a s ke poco f worth it ga ges punya ku sudah kena connector lcd nya eh,"Audio, Price",2,"worth, lcd"
3233,lgi nnton sambil pakai oppo f,"Features, Connectivity",2,nnton
3234,video perekaman sadis mulus nggak getaran apapun gila bener sayang kurang zoom lumrah harga jutaan kalau ada beh sempurna body standard hp tempur depan belakang solid kalau komplit jadi gabungan hp tempursamsung combain iphone xixixi ngeri kali,"Camera, Price, BuildQuality",3,"perekaman, gabungan, harga"
3235,gak berani beli poco soalnya pernah beli pemakayan bbrapa tahun tiba tiba jaringannya hilang sudah di service gak bisa dan katanya sudah penyakit hp poco btw hp poco temen saya hilang juga jaringannya,Performance,1,jaringannya
3238,dari pertama poco m proo rilis sampe sekarang masih blom ganti lagii kendala alhamdulillah gk ada maen game pun lancar ajaa pengen ganti tpi modal masih belum cukup,Performance,1,game
3239,rekomen hp kamera bagus under jt dong minna,Camera,1,kamera
3242,bang mau nanya poco f apa tombol volumenya bergoyang soalnya punya saya baru beli goyang gitu tombol volume nya,Audio,1,tombol
3255,setiap hari dia bertanya tentang 𝐀𝐋𝐄𝐗𝐈𝐒 suara merdu secara tidak sengaja,Audio,1,suara
3261,tahun ini kami merasakan 𝐀𝐋𝐄𝐗𝐈𝐒 suara merdu di luar dugaan,Audio,1,suara
3266,tahun ini kami merasakan 𝐀𝐋𝐄𝐗𝐈𝐒 suara merdu di luar dugaan,Audio,1,suara
3268,rekomen gak f ini untuk gantiin samsung s plus daily usage hanya wa gaming efootball atau fc mobile tidak perlu kamera yang bagus mohon saran nya saya blm pernah pake hp cina,"Camera, Performance",2,"mobile, kamera"
3277,ini hp memang sadis sih ga heran semua reviewer influencer bilang f ini rajanya hp di kelasnya bahkan kakaknya sendiri f pro disikat melibas hphp yg harganya di atasnya f gokil nih xiaomi poco ini namanya sedekah mana garansinya bulan tahun garansi ganti layar x android update th security update frame metal body kaca gila cukkk harga segini jelas pasti awet krn berani ksh garansi th hp lain ga ada yg berani ksh tahun klo mau yg lebih murah dr f tapi value for money dgn spek tgi ya di poco f poco x pro poco x pro,"Software, Display, Price, BuildQuality",4,"frame, android, layar, harga"
3278,tolong kasih saya saran mending poco f atau ip haaaa saya bingung dan lg ngumpulin suara terbanyak,Audio,1,suara
3285,game testnya genshin impact mulu dah,"Display, Performance",2,"game, testnya"
3287,d update donk vid dr jaman jembut test game gensin mulugensin uda ketinggalan jaman engine nya uda ampas ama ml test hok ama wuwa yg laen test game uda update ini gensin trusgame jadul jadi in test,"Software, Performance",2,"game, update"
3294,bg coba vlog sony experia iv sim,Network,1,sim
3296,kok layar hp gue hitam,"Design, Display",2,hitam
3298,performa powerfull desain powerfull silver,"Design, Performance",2,"performa, desain"
3299,s gen gmn ya kira performa nya,Performance,1,performa
3302,awalan ga ada iklan bang yakali aja udah rame yang beli terus update hyper os mucul dah iklan belum di pencet kali iklan nya sama orang poco,Software,1,hyper
3309,setiap hari dia bertanya tentang 𝐀𝐋𝐄𝐗𝐈𝐒 suara merdu secara tidak sengaja,Audio,1,suara
3315,tahun ini kami merasakan 𝐀𝐋𝐄𝐗𝐈𝐒 suara merdu di luar dugaan,Audio,1,suara
3320,coba smartphone gaming agak sedikit tebel tapi baterai lebih badak dan ada kipasnya pasti enak buat gaming,Battery,1,baterai
3321,udah gk ada iklan besok next ada bypass udah sih emang king midrange wkwkwk,Features,1,bypass
3322,poco f ini ada video cinematic nya ga ya bang,Camera,1,video
3324,poco ini masih banyak bug ga ya saya pake f banyak bug euyudh di update masih aja bug nya antara lain wa nya sering ngeblink klo abis kluar dari ig atau tiktoksering kali suara masih nya jadi kaya gak ke tutup sepenuhnya sinyal wifi kaga stabil,"Audio, Software, Network, Connectivity",4,"sinyal, wifi, update, suara"
3327,yang bener fokus game ambil poco yg nyari all rounded a paling aman,Performance,1,game
3329,kamera f vs redmi note pro bagus mana,Camera,1,kamera
3331,itu walpaper shincan apa namanya bang di pencarian tema,Software,1,tema
3333,bang david bang david request hp infinix note x g dong harga juta chipset mediatek dimensity ultimate antutu tembus k di harga dua juta kecil itu gila banget sih,Price,1,harga
3337,perusak harga pasar nih hp hp jtan udh pake naga gen,Price,1,harga
3338,tolong review wireless chargingnya hp ini soalnya di deskripsi penjualannya tertulis wireless charger dijual terpisah berarti support wireless charging kah,"Features, Battery",2,"charging, chargingnya"
3340,tes modern warship rata kanan bang pasti frame drop,BuildQuality,1,frame
3343,dari kamera nih mending x pro apa f,Camera,1,kamera
3345,info hp yang kamera nya bagus harga jutaan,"Camera, Price",2,"kamera, harga"
3352,asli ini video lucu banget wkwk barengan buka 𝗔𝗟𝗘𝗫𝗜𝗦 yang setuju like,Camera,1,video
3353,bang di dekripsi penjualan poco f ini support wireless charging ya kok gk prmh di review fitur ini ya,"Features, Battery",2,"fitur, charging"
3354,asli ini video lucu banget wkwk pas main 𝗔𝗟𝗘𝗫𝗜𝗦 barusan makasih udah upload konten ginian,Camera,1,video
3355,kucing tetangga pun ikutan kaget garagara suara ketawa gua pas nemu ini di 𝗔𝗟𝗘𝗫𝗜𝗦 ini sih wajib trending,Audio,1,ikutan
3371,asli ini video lucu banget wkwk pas main 𝗔𝗟𝗘𝗫𝗜𝗦 barusan next upload harus lebih lucu dari ini ya,Camera,1,video
3374,hpnya apa cepat panas ngak bos,Performance,1,cepat
3379,mending beli mana poco f xiaomi t pro vivo v g keperluan untuk sehari hari nyari kamera yang ad stablizer buat foto bisa bagus gaming paling cmn moba honor of king makasih teman teman,"Camera, Performance",2,"foto, moba"
3381,speaker doang atasnya ngga ada kah,Audio,1,speaker
3389,baru aja unboxing langsung nonton ini pakai poco f emang bener ternyata layar hp nya lebar bgt,Display,1,layar
3394,iya sayang aja ga ada bypass charging karna baterai gua rata kena karna gua heavy user dan masih agresif iklannya di seri ini gua suka banget sama frame metal,"Connectivity, Features, BuildQuality, Battery",4,"agresif, baterai, frame, bypass"
3395,alhamdulillah nonton video ini pake poco f,Camera,1,video
3396,bang david mau kasih saran aja untuk uji performandi game untuk moba coba deh wild rift dan untuk game gacha coba wuthering waves soalnya ke game itu butuh banget performa hp yg mencukupi supaya bisa main,Performance,1,game
3399,tahun depan mgkin bisa dapet di harga jutaan,Price,1,harga
3401,klo bisa foto lebih di jernihin lg di bagusinditerangin lg krn bnyk orng yg hoby selvy,Camera,1,foto
3405,tetep aja semakin dewasa semakin cinta sama iphone karena kamera nya bagus buat mengabadikan momen momen bersama,Camera,1,kamera
3407,cara aktifin finger printny dmna yasoalnya di setting gk ada kunci fingerprint,"Audio, Security",2,"aktifin, fingerprint"
3411,gw masih pake realme pro dari tahun rekomendasi dari chanel ini pemakaian siksa buat kuli game berat seperti emu dll masih lancar dan masih stabil rencana mau upgrade masih liat antara ini dan iqoo,Performance,1,game
3415,​rabsanjanyrajib kalo f biasa sama f pro jauh banget kah beda performa nya,Performance,1,performa
3417,speaker ny belom stereo ya tolong bantu jwb d komen guys,Audio,1,speaker
3418,tumben ga ngecek suara bang,Audio,1,suara
3421,coba tes gaming hp highend keatas pake game wuthering waves bg david,Performance,1,game
3422,kalau ke update os nya iklan lgsung numpukkkk utulah xiomi,Software,1,update
3423,masih setia poco f tp klk ada yg gantii mau update,Software,1,update
3433,asli ini video lucu banget wkwk pas main 𝗔𝗟𝗘𝗫𝗜𝗦 barusan next upload harus lebih lucu dari ini ya,Camera,1,video
3436,tumben biasanya ada part video unboxing review,"Audio, Camera",2,"video, tumben"
3439,kamera tajambatre tahan lamaitu mungkin yang di cari orang zaman sekarang,Camera,1,kamera
3441,bang nanti bikin video review poco f setelah beberapa bulan pemakaian terutama setelah update ke hyperos atau android versi terbaru,"Software, Camera",2,"video, android"
3442,buat main game panas ya bang,Performance,1,game
3444,enak banget kayanya pake game,Performance,1,game
3454,setiap hari dia bertanya tentang 𝐀𝐋𝐄𝐗𝐈𝐒 suara merdu secara tidak sengaja,Audio,1,suara
3464,tahun ini kami merasakan 𝐀𝐋𝐄𝐗𝐈𝐒 suara merdu di luar dugaan,Audio,1,suara
3469,iqoo plastik,BuildQuality,1,plastik
3470,kalau test gamming jangan game itu itu aja lah yang lebih berat kalau genshin mah udah kentang coba mainkan carxstreet pasti drop fps nya,Performance,1,game
3472,nonton pake poco x nfc bingung mau ganti f apa mi t duitnya cuma bisa redmi c,"Features, Connectivity",2,nfc
3473,gausah ganti dl bang nunggu hampir rusak aja eman klo hp masih lancar kamera juga masih cukup ok,Camera,1,kamera
3474,btw sy juga pake poco x nfc juga sampe skrg,"Features, Connectivity",2,nfc
3476,kalo sama rog worth it mana,Price,1,worth
3478,barusan cek harga di shopee xiaomi official storenya dah harga rp bukannya harga setelah juli pun hanya sampai rp ya ada yg tau melonjaknya harga dadakan karena apa yaa salah nya dari mana apa harganya stay di rp kasihan dong orang yg ngarep gajian awal bulan bukan akhir bulan,Price,1,harga
3479,masih setia sama x nfc layar lumut,"Features, Display, Connectivity",3,"layar, nfc"
3480,selamat bergabung di keluarga xiaomi tahun h pake xiaomi renot pake xiaomi redmi a jadi keluarga samsung a seris a s samsung a g setiap mau beli hp pasti nonton gadget in thank you bget udah ngebantu batre a g cepet habis pemakaian hampir thun mau ganti hp poco f masih mikir tapi udah naksir,Battery,1,batre
3488,bang kamera depan sama poco x pro bagus mana,Camera,1,kamera
3489,killer tapi belum ada bypas charging nya miris sih,"Features, Battery",2,"charging, bypas"
3494,hp idaman semoga yg liat video ini bisa kebeli aamiin,Camera,1,video
3496,masih pakai poco x gt dari mulai masih jos belum pernah rusak maupun ganti layar hanya saja baterainya udah mulai ngk tahan,"Audio, Display, Battery",3,"baterainya, layar, maupun"
3497,batri poco x nfcku masih awet bang pdh kadang pakainya kasar entah game sambil cass atau baterei sampe badak emang ini hp,Performance,1,game
3499,komen pakai f warna putih sekian lama pakai realme pro akhirnya upgrade,Design,1,putih
3501,perekaman video kamera depannya kualitas nya jernih banget yaa diselimuti dengan fps juga untuk kamera depan ga terlalu dibutuhkan juga sih perekaman kualitas k,"Design, Camera",2,"kamera, depannya"
3502,serius nanya selain samsung di hp merk lain dgn harga setarasama apa ada tombol peralihan lensa kamera depan belakang atau sebaliknya pada saat perekaman video on biasanya penting dipakai untuk bikin vlog,"Audio, Camera, Price",3,"tombol, kamera, harga"
3505,nama tema ini apa yaa guys klo yg tau,Software,1,tema
3507,semakin ke kedepan ratarata aplikasi makin ngk ngotak si untuk ukuran size nya mangka nya kalau mau beli hp mending sekalian aja beli yg memori internal nya gede sekalian,"Software, Display, Storage",3,"internal, aplikasi, ukuran"
3509,kenapa kebanyakan hp xiaomi dan poco kamera ultrawide nya cuma mp padahal sekarang udah,Camera,1,kamera
3514,bang rekomenin hp buat edit vidio yg ram nya gede dan gak lemot,Storage,1,ram
3516,adu sama ipon s gwejh sini dek,Design,1,ipon
3518,rekomendasi tab harga jt lebi ap ya gan,Price,1,harga
3522,better ini daripada q keknya diharga yang sama,Price,1,diharga
3523,aduu ga ada bypass charging nyaa,"Features, Battery",2,"bypass, charging"
3526,asli ini video lucu banget wkwk pas main 𝗔𝗟𝗘𝗫𝗜𝗦 barusan makasih udah upload konten ginian,Camera,1,video
3531,kucing tetangga pun ikutan kaget garagara suara ketawa gua ditemani 𝗔𝗟𝗘𝗫𝗜𝗦 lanjut upload terus ya bang,Audio,1,ikutan
3541,asli ini video lucu banget wkwk pas main 𝗔𝗟𝗘𝗫𝗜𝗦 barusan next upload harus lebih lucu dari ini ya,Camera,1,video
3544,mantep ambil poco f kmrn setelah liat desain f ini oke metal lebih cakep tp desain kameranya ga suka pdhl pas versi china nya si redmi turbo cakep desainnya,"Design, BuildQuality",2,"metal, cakep"
3547,asli ini video lucu banget wkwk barengan buka 𝗔𝗟𝗘𝗫𝗜𝗦 yang setuju like,Camera,1,video
3551,nonton pake poco x nfc,"Features, Connectivity",2,nfc
3552,bang david mau tanya kalau poco f sudah mendukung dual video di setting kameranya nggak itu kan buat ngevlog perlu juga masalah layar bagi yang usia s penglihatan berkurang ok banget tuh,"Features, Display, Camera",3,"video, layar, dual"
3559,heriyuchiko sesuai harga pak,Price,1,harga
3560,ya kondisi kita sama dari infinix note tapi rasanya lebih worth it poco x pro aja deh soalnya f yg upgrade cuma mesin ama tampilan hp aja dan kecepatan ngecas gak worthit buat nambah juta dari beli x pro,"Price, Battery",2,"worth, ngecas"
3569,tiap poco rilis seri f selalu ngiler pengen beli apalagi plus diskonan di toped sanggup sih beli tp kalo udah kebeli tetep aja gua nya gabisa tambah produktif buat apa yaudah pake yg ada aja toh masih mumpuni buat daily poco f curhat heheh,BuildQuality,1,toh
3573,pertanyaan nyadengan spek sebagus ituketika disejajarkan dgn iphoneyg spek dibawah dan hrga lebih mahal sepertinya dari orgatau mungkin akan pilih iphone pencitraan di indonesia memang segitu pentingnya,Price,1,mahal
3576,lama gak pake android muncul di beranda udah muncul seri poco f aja sekarang padahal dulu terakir masih pakai f desainnya gaming bgt lg co di tokped mi store dpt potongan diskon harga koma digit kecil gaskan aja lah,"Software, Price",2,"android, harga"
3583,coba gaming tes wuthering wave juga bang david biar update yg lebih berat dari genshin,Software,1,update
3584,nonton video ini pake poco x nfc lawas dengan greenline di layar,"Features, Display, Camera, Connectivity",4,"video, layar, lawas"
3587,sekarang msih pakai poco x nfc udah tahun pemakaian mau upgrade ip ip msih bingung,"Features, Connectivity",2,nfc
3591,saran bang kalo mau tes game skrg udh gk jaman genshin sekarang tes nya di game wuthering waves yg grafiknya udh melebihi genshin,Performance,1,game
3592,jadi kalo di wuwa performanya bagus udh pasti semua game performanya bagus jg apalagi genshin game purba,Performance,1,game
3594,masalah panas dan ngegame boros batre masih jadi momok di snap s gen yapadahal batre udah gede semuaga kebayang kalau cuma mahsemoga bisa di perbaiki lewat update sofeware,"Software, Battery",2,"batre, update"
3595,top komen template di video gadgetin nonton doang nggak beli semakin gede semakin ngerasa hp blablabla semoga nanti bisa beli yang ditunggutunggu,Camera,1,video
3596,wkwkwkwk yang anjir kemarin gw maen ke itc kuningan nanya itu barang jt njir di konter biasa di official mi harga normalcuma yang lu pegang vid itu limited tempat di official gw cari kosong ada warna lain,"Design, Price, Network",3,"warna, tempat, harga"
3599,btw mau tanya emg hp xiaomi keluaran baru skrg termasuk poco f udh gaada iklannya ya di android dan hyper os apa ttp ada iklan tp harus disetting lg biar iklannya gaada,Software,1,android
3606,liat pake poco f dilahirkan poco f dianggurin performa msh ok masak upgrade f,Performance,1,performa
3610,untuk game emulator yg ngaruh perfoma di snapdragon atau dimensity,Performance,1,game
3619,bikin video rekomendasi laptop bang sekarang lagi banyak mahasiswa baru nyari laptop,Camera,1,video
3620,gue suka banget sama ni hp se worth itu tapi gak sanggup beli,Price,1,worth
3625,​wilsonvernandy masih lah game nonstop game berat semua,Performance,1,game
3627,baru kali ini sejak jaman poco f suka banget sm desain nya seri f ini desain paling bagus nih ga tanggung,Design,1,desain
3631,waduh gak ada kabel jack nya,Audio,1,jack
3638,hp sekarang poco x pro worth it gak upgrade ke f bang tolong bantu kebimbangan saya,Price,1,worth
3644,klo saya yg udh pernah punya f f dan skr pake f rada tanggung klo ganti ke f jd biasanya loncat satu seri aja klo mau upgrade ganti hp tungguin f aja tar klo kluar meskipun ga tau kpn dgn catatan spec nya memang beda jauh dr f dan harganya msh sesuai budget jg,Price,1,harganya
3645,masih pakai x pro g masih bisa memenuhi kebutuhan dan masih berasa gahar nya mungkin tahun lagi baru ganti hp,Performance,1,gahar
3647,cobain oppo find x ultra bangvivo x ultra ga masuk resmi sih tapi oppo find x ultra top ranking kamera dxomark,Camera,1,kamera
3648,ipon buat sosmed andro buat nggame,Design,1,ipon
3651,tumben iqoo gak kelihatan biasanya pada nonggol,Audio,1,tumben
3655,sayang nya ga ada jack audionya,Audio,1,jack
