author,comment,publishedAt,likeCount
@JagatReview,"Tadi perasaan ada yg di-pin post-nya kok hilang yaaa?
Tapi serius deh.. Di sini emangnya ada yang merasa kami cuma copy video orang lain kah? 😊",2023-03-15T10:52:11Z,561
@bayusadd,haha malu dia tu bang wkwk,2023-03-15T10:54:33Z,60
@tyaspurwapit,Baru mau di reply udah ilang aja tuh komen😂😂😂,2023-03-15T10:54:36Z,34
@abithcbx,"kayanya orang caper deh, yasudah biarin aja udah menghilang. semoga ga bikin gaduh lagi",2023-03-15T10:54:59Z,54
@abithcbx,"​@tyaspurwapit gw udah ngerujak tadi bang, mau ngerujak lagi ilang😔",2023-03-15T10:56:17Z,18
@DariFaith,"Lagipula video jagat itu reviewnya stylenya dari dulu selalu detail, menyertakan data review yang begitu banyak, baik dari skor test maupun grafik fps.

Dan pengambilan videonya juga punya ciri khas tersendiri, terutama di ketika shoot di studio jagat tv.

jargon ""Ada charger nya, ada chargernya, ada chargernya"" ataupun sebaliknya ""tidak ada charger, tidak ada charger, tidak ada charger:("" ala om dedy irvan yang selalu menghibur sejak brand mulai memangkas charger terutama Samsung^^>

juga, review kamera selalu jadi cirikhas dari Kak Chris, jadi sepenuhnya, video ini asalnya dari channel jagat, direkam oleh jagat, dan di edit oleh jagat.

jagat yang asli, yang ada jargon ""Ada chargernya, ada chargernya, ada chargernya""",2023-03-15T10:56:29Z,63
@tomyrobinson4149,Kalau beli hp ini tahun 2026. Masih ok gak yah?,2026-05-24T10:41:33Z,1
@EKOGAMINGCHANNEL,Bisa beli di toko shopee saya gaming store x,2026-06-07T09:03:14Z,0
@dimasagungwicaksono293,"tahun 2023 aku beli second A51 😐 betapa kerenya aku 
dan di 2026 april baru bisa beli A54 second juga miris dengan kehidupanku",2026-05-02T15:41:27Z,0
@indrayanto1131,kalo soal nge review jr bener2 good job bngt sampe ke dalem2 ny di review bagus,2026-03-13T12:18:25Z,0
@Runarel,aku paling suka review disini lengkap dan detail,2026-03-11T01:27:56Z,0
@asepnurkholis9349,"A54 plg compeck file gemgamanya ,kya x xsmax ,enk buat yg gk suka hp bongsor",2026-03-02T14:44:12Z,0
@asepnurkholis9349,"A54 plg compeck file gemgamanya ,kya x xsmax ,enk buat yg gk suka hp bongsor",2026-03-02T14:44:12Z,0
@toniefendi5244,"Maap nih telat, gue beli a54 second. Setelah di reset pabrik kenapa apps kalkulator jam juga tidak tersedia. Apa itu bawaan memang tdk tersedia?",2026-02-08T16:50:57Z,0
@okyagam478,"setelah 2 tahun pemakaian, di cek ulang kok ga nemu fitur wi-fi sharing ya 😅😅",2025-12-18T10:39:10Z,0
@fhydzaa,"Ada bang, harus diaktifkan manual. Buka setting Hotspot -> lanjut buka setting network hotspot (klik network name/password/band) -> setelah setting network hotspot terbuka, di bawah sendiri ada tulisan ""advance"", terus klik -> scroll sampe bawah ketemu deh wifi sharing",2025-12-19T16:33:34Z,0
@gahanaaquatic,Ini support esim gak yah?,2025-11-11T04:33:56Z,0
@raff21saputra,ada info yg jual HP ini di area Yogya?,2025-11-10T19:00:59Z,0
@aulyaisman8218,Soal kamera masih bagus poco x3 nfc...😢😅,2025-08-13T05:49:00Z,0
@BlackSupremacist,YAHH..KETAHUAN PICEƘƘ TINGKAT DEWA COKK!! 🤣🤣,2026-01-08T16:06:48Z,0
@Andikayus,esim bisa gk ya,2025-07-02T13:58:22Z,0
@faizismail2409,Kata kata legend (tidak ada chargernya sebut sampai 3 kali😊),2025-05-20T05:15:12Z,3
@faizismail2409,Nih saya udah make a54 selama 2 tahun okelah masih dari segi apapun👌,2025-05-20T05:14:00Z,3
@xtmilo23,"sama , saya otw 2 thn make a54 , genap 2 thn 1 juni nanti... so far masih enak semuanya kecuali battery yg boros banget😂",2025-05-29T02:15:47Z,2
@faizismail2409,"​@xtmilo23 yakan, bener kurangnya a54 baterai lumayan boros tapi yang lainnya oke banget😅",2025-05-29T02:21:17Z,2
@mirzafaqih666,​@faizismail2409boros nya itu kira2 kuat brp jam??,2025-10-19T00:32:59Z,1
@BlackSupremacist,​@mirzafaqih66615 menit cokk,2026-01-08T16:07:10Z,0
@bagusdwi4539,Soal sinyal gimana bang,2026-01-26T09:54:01Z,1
@anjarsetyawan3553,Klo sekarang apa masih worth it om?,2025-04-03T15:05:18Z,0
@micsg_,baterainya kureng,2025-06-03T23:00:23Z,0
@choirulefendi9162,Ini samsung a54 frame samping plastik apa metal aluminium ya??,2025-02-17T14:28:36Z,0
@freetesting166,9:36 njir itu wifi nya apaan om 😂,2025-02-10T14:26:21Z,0
@rktv8085,Exynos auto skip,2025-01-06T02:51:13Z,0
@MentalLemah,Skipp aja ga guna juga lu wkwk,2025-02-15T16:55:10Z,0
@muhamadaiditya6813,"Update terbaru. 
Ni hp nonton ytb aja panas njir
Soal baterai, saya compare dengan mi12lite, masih lbh boros smsung a54. Untuk lainya saya bilang cukup",2025-01-03T06:50:25Z,0
@MentalLemah,Ga mau panas jangan dipake,2025-02-08T06:26:27Z,0
@DonghuaInDoNeSiA712,masih sangat overprice,2024-12-21T08:39:31Z,0
@AbdulRizal-c2q,Aku liat do shoope kok cuma harga 5 jutaan,2024-12-15T20:11:41Z,0
@kimjonk9479,"baru nonton 2 hari besok otw beli samsung a54 rom258gb dpt diskon 4.3  ditiktok,charger beli 178 rupiah.mewah rasnya and sport aja rasa makenya sih..wenak tenan pakenya.",2024-11-16T22:02:35Z,0
@mariyanto8208,"Sdah 1 tahun make hp nya, tapi sampai sekarang masih suka nonton vedio nya 😁",2024-11-13T15:00:49Z,0
@pistachioou,Untuk video A54 stabil ga? Atau masih ada kerasa gempa?,2024-11-30T01:56:07Z,0
@mariyanto8208,"@pistachioou  stabil bang, kecuali yang 60 fps stabilizer nya mati",2024-11-30T12:46:01Z,0
@amwatchstuff,Nonton pake a54 beli second pemakaian 5 bulan mulus masih on garansi.memori 8/256 3.8 juta so far so good,2024-11-02T05:36:07Z,1
@maesitapuspaningrum6521,Beli dimana kalo boleh tau,2024-11-02T13:48:38Z,0
@aryantoyogi6670,"Alhamdulillah nonton video ini pake a54 warna violet,,beli 4 bulan lalu dg harga 5jt,,kepala chargernya 200rb",2024-09-25T14:12:11Z,0
@denikmarcelino,Belinya dimana ka,2024-10-17T03:53:01Z,0
@aryantoyogi6670,@denikmarcelino beli di surabaya kak.. nitip temen.. didaerah sya harganya masih 6jt,2024-10-17T04:01:18Z,0
@fikribagassaputra1561,Kok di gua wifi sharing nya ga bisa,2024-09-07T08:16:20Z,0
@NiningNing-z4u,Om.apa bedanya Samsung yg dari malasya.dan indo,2024-09-06T06:12:46Z,0
@yogiadiastama461,"Bang @JagatReview mw tanya,hp saya a54, saya masuk kolam renang pribadi krn menolong anak mw tenggelam, kedalaman air 1 meter, ga sampai 1 menit.

Hp saya layarnya mati, dibawa ke samsung center ga garansi krn masuk air (padahal masih garansi statusnya).

Jadi kl beli hp samsung itu yg ip rating 68 69 sd 1000 bla bla bla itu kl dibawa berenang dan kebetulan airnya masuk menyebabkan hp kita rusak itu ga digaransi ya?

Ngapain di kasih ip rating²an ya.

Mohon pencerahannya",2024-08-11T01:24:36Z,0
@i0n9621,Setau gw ip68 ada maksimal durasi dan kedalaman.,2024-08-25T20:49:05Z,0
@anulslur,"Kenapa hp samsung pasti suka wifi tiba tiba pentung sendiri padahal lainya gak plis jawab yang tau, terima kasih",2024-07-19T14:12:22Z,0
@JihanAzmi,Duh gess... Bantu dong. Gw jadi bingung. Buat konten video. A54 atau A52s wkwkwk. Sumpah butuh pencerahan,2024-06-23T06:28:11Z,1
@Rc.97,Jadi ambil apa nih ?,2024-07-22T11:01:32Z,0
@JihanAzmi,@Rc.97 A55 wkwk,2024-07-22T12:24:20Z,0
@Rc.97,@JihanAzmi dapet harga berapa,2024-07-22T12:39:19Z,0
@JihanAzmi,@Rc.97 aku beli di samsung offic LAZADA waktu itu 4.7k karna dapet diskon. Dan gratis ongkir. Cuman iya ternyata gak dapet kepala charger wkwkwk. Beli di toko lain ada yng bundling sama kepala charger. Tp aku khawatir nipu wkwkwkwk. Jadi beli di offc store samsung di LAZADA. Haha,2024-07-22T12:45:16Z,0
@JihanAzmi,"@Rc.97 sorry salah jadi kena 4.879.000 wkwkwk
Belinya malem2 jm 1 an.",2024-07-22T12:48:47Z,1
@gananglinang6642,"Nonton ini pakai samsung m12
Karena samsung a54 5g nya masih di pusat sortir DC jakarta😂",2024-06-17T03:54:24Z,1
@triagungsusilo4559,Udh sampe,2024-08-09T23:43:23Z,0
@nmaxcitama,Saya pakai A54 😂 emang keren gilaaaa video foto games cuma batrai saja wajib mode gelap biar awet,2024-06-07T01:49:08Z,0
@ahermawan-id,Langsung ke kris 😂,2024-06-01T10:18:58Z,0
@mohammadzakariayusri7994,A54 1080p 60fps masa gak stabil sih,2024-05-24T12:47:19Z,0
@sultandantachanel9428,"Gua puaaz pame hape segalax a54 ini.  .apalgi gua bukan gamers.. cm butuh batre awet,camera sessor sony layar cadaaas ..  pass",2024-05-21T12:14:22Z,0
@kzidnirakatrael9243,"untuk samsung a54 yang 4k 30fps  stabilazernya tidak aktif itu pasti masalah software.soalnya saya user samsung a54 setelah dapat update software,4knya baru bisa stabil.",2024-05-13T02:55:41Z,1
@zulladonara3492,Brarti masalahnya di update software ya. Soalnya mau beli😍,2024-07-19T10:34:02Z,0
@wendimulyana96,Uji gaming duluin pubg bang jangan genshin terus,2024-05-10T12:18:08Z,0
@DwiYoyo-gs4lw,"Suhu 46 derajat itu apakah ketika maen game saja atau ketika sosmed juga. 
Saya ada rencana mau ambil hp ini krn ukuran layarnya yg gak gede. 
Pemakaian saya sehari2 lebih sering untuk sosmed dan streaming video kaya youtube aja. 
Jarang sekali maen game. 
Apakah suhu sama juga ketika saya menggukan fitur2 yg saya sebutkan td?",2024-04-30T08:42:05Z,0
@blackflag6470,"Kagak, HP gak pake kerja berat tiba-tiba suhu 46c ya reject berarti",2024-05-07T10:40:02Z,1
@E_Chanel-lu8hf,"Bang kalau hp samsunh A54 bisa ga kita pakai Moc Warles?
soalnya ga ada lubang untuk headsednya.
minta petunjuknya ya...
trima kasih.",2024-04-29T03:46:30Z,0
@andreassumardi9597,Pake 60 fps emang ga bisa stabil ya stabilize nya?,2024-04-18T14:38:20Z,0
@imamm9414,Samsung tuh bkin pede aja klo kmna2 pke hp ini,2024-04-08T05:14:40Z,0
@wngstn5102,Sorry banget tapi baru pake vc beberapa menit suhunya udah panas banget sedangkan hp gw yang vivo y12s gw pake 24 jam sambil di cas juga panasnya ga kaya hp samsung ini. Terus si samsung ga punya pitur screensoot panjang kaya vivo gw.  Jadi gw ngerasa nyesel dikit beli hp 6jt ini 😅,2024-03-20T01:42:54Z,0
@a_afidz,Screenshot tinggal tekan tombol power+vol down secara bersamaan,2025-03-24T20:41:24Z,0
@ojisaripudin31,Om A54 support esim gak ya.?,2024-03-18T08:14:21Z,1
@bararasya,Chanel youtube review HP paling pas emang Jagat Review ini✨🥰,2024-03-17T00:23:07Z,0
@alpirentinbagasrahardjo5318,Untuk dari segi kamera menurut team jagat lebih bagus samsung a54 atau poco x6 pro?,2024-03-17T00:04:37Z,0
@muhammadafdhal1517,Jenis rom apa ufs 3.1 kah?,2024-03-14T07:03:54Z,0
@chiciliu,Masih pake A7 2018 hee,2024-03-08T17:08:36Z,0
@Wikizzzu,"Bro hape ini abis lu review dijual gak? gue mau beli. soalnya kepepet. hape gue rusakk, kal bisa harganya agak turunin dikit",2024-02-20T05:13:48Z,0
@DavidMiller-rt7ld,Saya ada A54 masih baru segel 5.1jt mau?,2024-02-28T12:43:38Z,0
@Wikizzzu,"@DavidMiller-rt7ld udah beli gue bro, A54 baru",2024-03-05T14:55:50Z,0
@silverground3670,"​@Wikizzzumantap gk bro? rencana mau upgrade dari Redmi Note 9 Pro saya, Dapat harga berapa?",2024-03-06T13:37:56Z,0
@Wikizzzu,"sampe hari ini masih oke sih bro. Pemakaian main game lancar (ML, PUBGM), untuk kamera oke juga, apalagi ada terbantu dengan fitur stabilisasi video. 2 Minggu lalu beli di harga 5,6 jt yang 8/128 gb bang@silverground3670",2024-03-07T14:18:09Z,0
@aliputra0428,mantap,2024-02-19T15:22:29Z,0
@masaldin27masaldin27,samsung a24 ku nyelem air 2 kali aman2 aja padahal masuk lebih dari 10 menit didalem air😂😂 sayangnya hp jatuh dijalan hilang selamanya 😂😂,2024-02-18T15:06:27Z,0
@sitimuflianti1008,"Aku baru beli kemaren mungkin pemakaian baru 4 hari tapi ko baterainya cepat habis, ini gimana yah?
Apa karna kepala charger yg gak ori atau gimana?
Padahal aplikasi yg gak digunain udah dihapus",2024-02-18T08:33:03Z,0
@HafizhSetiawan-t9g,"Tungguin aja nanti dapat update dari Samsung baru bisa normal Samsung sekarang seperti itu untuk hp barunya bro gak kayak dulu, yg penting jangan di jual soalnya update nya Samsung lama daripada vendor yg lain😅",2024-03-09T13:56:21Z,0
@danitrimujianto1037,Gk bsa wireless charging ya?,2024-02-09T12:49:01Z,0
@kunyimasp19,Kenapa ya kok hp baru 1 hari a54 batrenya boros bangt,2024-02-03T16:37:09Z,0
@s99ss9,Bro perbandingan samsung A54 5g dengan Xiomi 13 T lebih unggul mana bro ? Terus kalau samsung A 54 5g kalau lagi rekam kamera depan bisa langsung pindah ke kamera belakang gak bang ? Thanks 🙏,2024-02-03T15:03:11Z,0
@alifutama3621,Baru ngeuh kalo a74 ga ada ya,2024-02-01T01:44:08Z,0
@Criminal301,SAMSUNG A74 review Bang JR Tv,2024-01-24T13:00:56Z,0
@HaySip,"yg punya a54 ngerasa boros banget gak si battrynya?. pagi 100%
sianh 50%
gak di pake ngapa ngapain
jaringan gak ada
musikam offline",2024-01-18T10:09:07Z,0
@iim6072,Lebih baik mana dengan apa Samsung galaxy a73?,2024-01-17T05:24:56Z,0
@arifbukankaleng283,Pake hendsetnya nyolokinnya dimana itu,2024-01-15T11:07:00Z,0
@andrecnnl5656,Kan ada headset port type c,2024-01-18T13:17:54Z,0
@g.b9466,"Bang, untuk kipas yang digunakan saat uji coba game & suhu namanya apa ya?? Dan bisa dibeli dimana ya???  Saya tertarik buat beli karena hp saya juga Samsung Galaxy A54 5G 🙏     *apalagi kalo lagi mau main game + nonton biar suhu nya aman-aman aja bang... 🙏",2024-01-14T03:53:25Z,0
@wxhyuaji,"Update per 10 Januari 2024, pubgm di Samsung A54 udh bisa smooth extreme",2024-01-10T11:46:17Z,0
@rakamuhammadhirawan8904,"Spertinya penerus A55 nnti mngkin akan ksulitan mengulangi kesuksesan dr A54 ini. karna spek chip nya msih exynos, kmungkinan konfigurasi kamera jg msih sama, dan yg naik paling ngulik exynosnya sih yg collab sm AMD srta desain yg msih akan mirip sm seri S nya",2024-01-09T19:38:41Z,0
@quistyoktavia7150,Jagatreview itu bagi saya rekomendasi banget sebelum beli hp baru😁👍🏻 nonton2 video review hp - hp nya yg mau di beli dan plus minus dari hp nya itu sendiri. 👍🏻👍🏻 sukses selalu buat jagat review,2024-01-09T13:46:56Z,0
@Chefkonoha,"Gua beli a54 agak kecewa,hasil photonya over saturated , warna banyak miss dan gak konsisten",2024-01-07T15:18:05Z,0
@asephermawan2194,"Mengecewalan bgt, OIS tidak ada dgn benar funsigx, OIS gimic",2024-01-06T10:50:57Z,0
@tukangtahu615,Sampe skrg masih isu gak bang?,2024-10-24T12:13:08Z,0
@camuakcamuak2589,Chager nya ngak ada. Chager keluaran lansung dari hp sangat bagus ... Itu aja yang kenak,2024-01-03T11:22:30Z,0
@hengkysoesanto1590,makasih bang...tp intinya masih menang mana dgn A52s???,2024-01-02T00:06:32Z,1
@penikmatgame821,Sehat selalu om dedy,2023-12-31T23:47:25Z,1
@ragettthehe,Baru sadar nama wifinya ganyu wangy,2023-12-25T06:55:26Z,0
@rahmadian-noor1696,Itu kabelnya c to c atau usb to c?,2023-12-20T03:34:44Z,0
@rifqyfauzan1385,"a54 rawan green line atau green screen kahh?semoga dijawab🙏🏽,bingung mau beli buat pemakaian harian jarang nge game atau ada rekomendasi hp lain yg harga 5-6 jutaan?mohon infonya 🙏🏽",2023-12-19T14:57:04Z,0
@FAZLIFPI,yg rawan garis yg amoled yg ad x x ny,2023-12-29T00:52:09Z,1
@orangjauh9730,"ini masih super amoled om, bukan dynamic amoled seharusnya aman"" aja sih",2024-01-03T14:55:17Z,1
@ronikusumah8210,"Om Ded, cara aktifkan bypass charging gimana? Ini tga bisa tampil tombolnya.",2023-12-14T12:18:39Z,0
@just0iyanks,a54 di indo ada esimnya ga..?,2023-12-14T07:08:51Z,0
@Rielians-j2j,pakai UFS tipe berapa om dedy?,2023-12-14T05:47:19Z,0
@raehanmaulana8892,3.1,2024-01-15T09:37:23Z,0
@CitraRudyanto,A54 ini ada nfc untuk isi saldo e-toll dll kah?,2023-12-13T12:04:50Z,0
@rmthidayat3629,Ada samping kamera,2023-12-17T04:35:23Z,1
@CitraRudyanto,@rmthidayat3629 thanks inponya puh 🙏,2023-12-17T06:09:32Z,1
@wirawinayaka,"Baru minang A54, stabilisasi 4k nya idah fixed belum ya.?",2023-12-09T22:17:37Z,0
@ZOYA_607,"Samsung A54 sama Vivo V29 bagus yang mana bang?,help",2023-12-06T18:13:56Z,0
@tioutomo93,"Kalo udah ada sony imx gak usah diragukan lagi dah ingat di redmi note 5 pro design biasa,tapi kamera dan perekaman 4K steady",2023-12-02T16:22:45Z,0
@andisuryanto2815,"Bang jagat riview, abang pakai kipas apa itu..saya baru lihat yg model bgitu.",2023-12-02T12:20:03Z,0
@Rappz31,"Bantu jawab
Merk Darkflash, cuman lupa nama fannya ;)",2023-12-08T08:24:22Z,0
@andisuryanto2815,@Rappz31 mksh bnyk info ny,2023-12-08T08:45:51Z,0
@andisuryanto2815,"Jd bagus mana, A54, M54, M34? Kalau di kompare gimana?",2023-12-02T12:07:31Z,0
@LifeisWonderfull9999,A54 lah. Cuma batere kalah lumayan sama M54.,2023-12-03T12:25:03Z,0
@whizyp,[UPDATE] di bulan November kemarin ternyata isu stabilisasi video di 4k30fps sama ultrawide 4k30fps sudah bisa aktif.,2023-12-02T05:37:51Z,0
@SndFishing,"Saya baru pakai 2 minggu buat pendamping iphone xr kebutuhannya buat bikin konten sosmed sederhana dan  buat jualan online buka gobiz grabfood gofood.
Kekurangannya
1.Menurut saya samsung a54 batreinya boros, perasaan kurleb aja sama ip xr jadul saya
2. Ini paling ngeselin sih face id nya ya alllaaaaaahhh lemot banget nda bisa satset sekali usap langsung cling kebuka,  lagi2 ini saya bandingkan dengan ip xr jadul saya ya yg hanya spersekian detik usap langsung satset 
Kelebihannya yg saya suka 
1. Ya kameranya boleh lah lumayan bisa di andelin dan paling suka ada fitur hapus objectnya yg instant asik mempermudah kalau mau edit2
2. Tahan air dah jadi gak kawatir hehehe
Yah untuk smentara itu dulu karna udah 10thn gak pernah pakai android jadi agak kagok 
Biasa kalau ip bisa pakai 1 tangan geser swipe pindah sana sini 😂👍
Atau ada gak yg mau ngajarin saya siapa tau ada trick2 yg keren pakai android 😊",2023-11-28T05:50:32Z,0
@rakadanendra5501,"cari tau dulu face id di a54 lemot karena apa , cari tau dulu kenapa xr face id cepet 
liat dulu hardware nya untuk face id gimana ya",2023-11-28T18:04:25Z,1
@alitadya,A54 boros? SoT mu dapet berapa?,2023-12-17T07:59:58Z,1
@vanddarmawan9302,"Masih stay di A50 untuk user daily dari awal rilis nyampe skg 😂 ... Paling demen soal body yg slim disaat A series yg skg yg kebayakan tebel & bongsor. Kekurangan yah masalah daya tahan batre aja sih, wajar lah udh brp thn juga. Sama backdoor yg udh copot, tapi ga masalah karena dipakaiin case yg transparan 😂",2023-11-26T14:06:09Z,0
@johan1703kmn,Yah kalo sebagai user A52s kalo mau upgrade mendingan nambah dikit ke S21FE....😅😅😅,2023-11-26T10:38:09Z,0
@jukriganteng9780,bang klo untuk sehari hari bagusan samsung galaxy A54  atau A73?,2023-11-25T08:41:39Z,1
@elfasyacleo4314,"Kelemahan setelah 4 bulan pakai : 
Diluar ruangan / outdoor anget mendekati panas mau buka apk apapun.
Jika dibawah matahari kalo kita amati layar ada bercak sensor sidik jari.
Boros baterai.",2023-11-22T00:23:23Z,1
@AnnaLuna-h1s,Ampun ...samsung...harga segitu gkada chargernya gkada chhargernya gkada chargernya....kaya berat bnget ngasih charger..harreuhhhhhh,2023-11-18T01:49:23Z,0
@HOO_LEE_SHEET-90,"terbaik dari mana coba panas bukan main ni A54 5g...mending samsung A73 5g lebih sempurna dan kece terbaik..body ngak kayak A54 kaca mudah panas ,tebal dan sisi besi...sekali jatuh auto modar...samsung 2023 fail habis...sini gua mau jujur samsung tahun 2021-2022 terbaik daripada samsung 2023",2023-11-10T23:45:04Z,2
@lukmanlinda9539,"Masih bingung kenapa merk samsung hilangkan charger sm headphone jack
Mohon pencerahannga",2023-11-07T09:37:30Z,0
@RakaFathyaHermawan,Menekan Harga HP Agar Bisa Lebih Murah,2023-11-07T15:44:53Z,1
@ShadowbannedAccount,"Ini itu kayak PS5 yang harganya $500, tapi mau beli controller harganya $50. Jadi, ini itu membuat harga HP nya terlihat murah, tapi bisa bikin Samsung jual charger ya dengan harga lebih mahal.",2023-11-18T15:10:05Z,0
@anggidini8783,punya suami saya A54 mati total cuma kena air hujan disaku celana jadi yang pasti pasti aja ke brend sebelah,2023-11-07T08:05:36Z,1
@Viennese2nd,"Gatau kenapa, kalo HP kena air ujan pas dijalan dalem kantong itu rusak rata-rata. Gw punya temen hp dia lumayan mahal (lupa apa) ada rating IP68nya dan simsalabim... air masuk ke speaker dan sember speakernya.",2023-11-08T14:43:07Z,0
@AerSpa11.-,Hmm,2024-05-06T13:08:10Z,0
@NoviYanti-zc2yc,"Mending samsung a54 5G apa ip 11,btw aku pke a32 4G mau ganti antara itu please jawab pusing plih nya🗣",2023-11-06T13:37:29Z,0
@faishalal-syafiq335,Ane benci HP panas.. kenapa harus pake Exynos sih!!! 😢,2023-11-06T03:06:25Z,3
@Koalanalysis,"Exynos kan buatan Samsung juga, jadi lebih cuan🗿",2023-11-06T08:38:47Z,2
@bulkmc2795,"A54 5g vs xiomi 13T, buat game sama kamera recomend mana om",2023-11-01T11:14:20Z,0
@S3M105,Kalo game sepertinya 13T kalo kamera A54,2023-11-28T21:52:42Z,2
@rianresaldi6670,Gabisa bypass charging?,2023-10-29T04:25:24Z,0
@FakranMukh,"Lucu si ini a54, lebih bagusan kamera ultra wide nya di dinamic range, tp over all lebih bagusan a52s malah klo diliat liat .. 4K EIS masih nyala di a52 tp malah di a54 mati .. aduh aneh 😂😂😂",2023-10-26T12:07:04Z,0
@ramdani5435,Frame nya terbuat dari apa kok gak di jelaskan????,2023-10-25T10:36:40Z,0
@ace_abcdefgh,plastik,2023-10-31T12:06:57Z,0
@ramdani5435,Frame nta terbuat dari ap,2023-10-25T10:29:25Z,0
@muhammadraka2710,Bang mau nanya kalau di a54 saya gaada fitur bypass charging nya itu kenapa ya mohon bantuannya,2023-10-22T05:42:00Z,0
@rizalagmas925,A54 vs s20fe lebih worth it mana ya?,2023-10-22T02:04:20Z,1
@ace_abcdefgh,s21fe atau sekalian s23fe,2023-10-31T12:07:25Z,0
@rizalagmas925,@ace_abcdefgh makasih bang,2023-10-31T13:40:47Z,0
@Cantikabilla-ko5rw,Backdor bisa mangap gak ini,2023-10-20T05:13:41Z,0
@zamzamautogarage294,"Serasa nostalgia sama samsung A5 2016 🎉

Langsung beli 🎉",2023-10-19T04:00:59Z,0
@SedulureMoonton,kepala chrger yg bagus brpa wath,2023-10-19T01:33:55Z,0
@BIMAGALEK,bagus banget hp ini,2023-10-18T11:00:02Z,0
@edwinsahrilsp8251,Harga Mahal Chipset Kentang itulah Samsung 🖕🏿🥱✌️☕😋😎,2023-10-17T05:48:31Z,0
@romeooppo90,❤❤❤❤❤❤❤❤❤,2023-10-16T14:37:25Z,0
@dany-ki3sy,RANK B,2023-10-16T06:02:35Z,0
@paridarased4464,sama ya belu di arab juga gk ada..buat casaanya,2023-10-14T11:27:12Z,0
@qifuatdzulqornain6793,A55 kpn keluar bang😅,2023-10-12T16:56:43Z,0
@muhasrulsetiawan09,"Hasil video nya kaya kurang ya. Opsi laen, klo buat harian non gaming, S21fe di kisaran hrga itu videonya mantul",2023-10-11T17:36:40Z,0
@CahyaGumilarsyah,"Makasih banyak pencerahanya pa dosen..
Saatnya meninggalkan A 52 s
Tapi sayang A52s bagus juga hahaa 
Yukk bisa yukk bismillah A54
Ehh ntr malah keluar A54s lagi ? 😅😅😅",2023-10-09T02:46:41Z,0
@JagatReview,Ga ada A53s kan  thn lalu?,2023-10-09T02:55:00Z,0
@verlynanggeleny6365,"​@JagatReviewom, a52s dgn a54 lebih ok mana dr kesimpulannya?",2023-10-15T09:32:00Z,0
@Viennese2nd,@verlynanggeleny6365 kalo masi punya A52s mah pegang aja dulu sampe akhir support softwarenya.,2023-11-08T14:44:08Z,0
@duqiyahyachannel7719,Mantab memang samsung a54. Alhamdulillah saya sudah merasakan performanya,2023-10-08T15:00:53Z,0
@ace_abcdefgh,tp aneh anget bgt hpnya. ga di apa2in aja anget buka pengaturan dan liat2 menu,2023-10-31T12:08:31Z,0
@ncekmiat767,Samsung good jobbb...,2023-10-08T10:30:40Z,0
@Anantadelta,A54 atau iPhone 11?,2023-10-06T16:42:18Z,0
@dinoMalang,"Jadi bingung beli A54 atau Xiaomi 13 T, bagusan mana foto & video",2023-10-05T15:28:28Z,0
@imamariefbudiman1377,Sot brpa bang,2023-10-01T14:36:03Z,0
@edgarjuntak,7-8 jam.,2023-10-02T19:04:57Z,0
@MikeDoozie,ganyu difoto rek,2023-10-01T07:14:22Z,0
@tazkyarrahbini9594,Bimbang pilih ini atau ip 12,2023-09-26T15:22:30Z,0
@MarYones,ip12 klo gua,2023-09-29T09:22:45Z,0
@edgarjuntak,"jelas ip 12 lah wkwkwk.
asal baru dan resmi.",2023-10-02T19:05:11Z,0
@gegammer6016,"IP 12 bagus tapi klo lu baru pertama jadi user Apple nanti bakal kegoda tuk beli accesoris lainnya Apple sih
Belum lagi klo lingkunganlu banyak user selain applenya pasti akan beli accesoris tambahan dan lain nya",2023-10-05T12:51:01Z,0
@edgarjuntak,@gegammer6016 aksesoris tambahan nya apa2 aja emang?,2023-10-05T16:39:26Z,0
@mhidaydayat5378,Udh 6 bulan aja Si A54,2023-09-26T10:48:32Z,0
@aryindie4689,"Ini kalau border layarnya rata cakep sih, cuma dagu tanos jadi agak kurang.",2023-09-24T06:21:55Z,0
@edgarjuntak,"setelah make cakep loh bezelnya.
karna simetris.",2023-10-02T19:05:33Z,0
@aryindie4689,@edgarjuntakkok kayak dagu bawah tebel gitu ya dari video,2023-10-02T20:55:04Z,0
@edgarjuntak,"@aryindie4689 engga kok.
saya udh make soalnya.
setelah make kek bener2 ga ngeh ada bezel malah karna bezelnya mirip atas bawah kiri kanan.",2023-10-02T21:36:54Z,0
@gegammer6016,Bjir dagu tanos😂,2023-10-05T12:51:35Z,0
@aryindie4689,@edgarjuntak Buat saya kurang simetris sih. Keliatan banget.,2023-10-06T02:19:33Z,0
@Rizkiaqa,"Sebenarnya, Samsung mampu gak ya membuat setiap serie baru lebih baik dari seri sebelumnya dari segala sisi. 
A54 vs A52s camera dan videonya menang kalah di bagian tertentu. Gak bisa gitu ya A54 menang semua. Apa samsung gak bisa membuat itu atau memang sengaja dibuat seperti itu ya...hmmm",2023-09-20T13:38:53Z,0
@edgarjuntak,"memang sengaja.
trick marketing.",2023-10-02T19:06:10Z,0
@gegammer6016,"Ingetgan produk Samsung ada turunannya dan rada jarang ngeluarin satu tipe hape di satu pekan/bulannya 
Jadi iya itu bisa dibilang trik Samsung biar produknya sama sama laku",2023-10-05T12:53:29Z,1
@frozi62,Mau upgrade dri a52s bingug 🤣,2023-09-17T11:22:47Z,0
@edgarjuntak,ya jgn atuh kalo dr a52s.,2023-10-02T19:06:20Z,0
@BardockRB,"Ngincer banget hp ini, tapi nunggu dulu sampe tahun depan biar harganya agak turun 😂",2023-09-16T20:48:02Z,2
@yohantech3278,"Masih dilema, untuk penggunaan jangka panjang lebih rekomen ip 11 apa samsung A54 5G ini ya? Soal baterai saya gak terlalu dipikirin yang penting peforma jos untuk beberapa tahun kedepan",2023-09-13T14:46:38Z,0
@edgarjuntak,"kalo ga main game, ambil a54.
main game ambil 11 baru dan resmi.",2023-10-02T19:10:42Z,0
@aqzoabasir6875,"alumni A52s pindah ksini klo ngincer performa sama kamera gabakal nyesel sih, cum yg jadi masalah fitur pause usb delivery nya kok gua gadapet ",2023-09-09T20:47:52Z,0
@swmmotorsport7707,Bisa dual sim ya om?,2023-09-08T06:37:16Z,0
@edgarjuntak,yoi,2023-10-02T19:10:47Z,0
@ratihprimayanti8311,"Bang boleh tanya..
Lebih rekomendasi Samsung a54 apa Oppo Reno10 5g..
Please bales ya bang mau ganti hp bimbang..
Budget 5-6jutaan aja bang..aku udah follow bang...
Terimakasih",2023-09-04T06:52:56Z,0
@edgarjuntak,masih perlu saya jawab?,2023-10-02T19:10:58Z,0
