author,comment,publishedAt,likeCount
@ahmadpasha2022,Bang masukkan nya samsung A54 vs samsung A73 pilih mana ya buat recommend saya pribadi ?,2023-03-23T17:02:26Z,1
@muhammadismailsimatupang2769,"Seperti biasa, selalu mendetail sampai kerak bumi, top markotop jagat review",2023-03-23T14:46:31Z,2
@fahriagung8014,A34 5g blom ada om,2023-03-23T14:36:42Z,0
@themondrockllex5827,Bang tlong d jwb. Samsung galaxy M54 5G kapan rilis d indo?,2023-03-23T14:31:00Z,0
@farhanm6250,"Baru beli tdi sore, wlopun bezel tebel mnurutku ngga ganggu sih nyaman2 aja cuman ps awal buka dus brasa jelek wkwk. Pas dicoba awal2 buat instal aplikasi sama pembaruan dan sosmed lumayan pnas tpi ps udh diupdate software nya jadi mendingan cuma anget biasa, kamera bagus bgt. Mnurutku butuh wktu kali ya biar kliatan apakah exynos di a54 berhasil atau tidak. Soal frame itu brasa metal, bukan plastik, nah anehnya body blakangnya yg katanya kaca berasa plastik ps dipegang wkwk",2023-03-23T13:36:11Z,1
@Khaerul0,Terima kasih Pak,2023-03-23T12:40:57Z,0
@Nero312,Exynos otomat setrika,2023-03-23T12:23:05Z,0
@Kecimpring05,Kyk ada yg janggal ya ?,2023-03-23T08:07:48Z,0
@syamilrizqyr.a4442,mending mana sama A 52s?,2023-03-23T07:15:53Z,0
@willychandra1133,Boleh compare xiaomi 12t vs samsung a54,2023-03-23T05:59:12Z,0
@rudiale,"Komparasi kamera A52s & A54 jelas yg seri sebelumnya sudah mengalami pembaruan update software, yg A54 masih akan jalan karena hp baru pasti nanti akan lebih bagus disegala halnya",2023-03-23T05:39:07Z,12
@bastiankma,bang compare dong a54 sama a73,2023-03-23T05:38:02Z,0
@doniromdoni5891,"Ko klo urusan stabilizer video, mending xiaomi 12 lite ya?, tapi kamera samsung gak ragu..deeuuh bingung",2023-03-23T01:32:07Z,0
@jadilahkehendakmu,Hidup A52s 😆🤟,2023-03-23T01:20:13Z,0
@isacbs416,Nanti review A34 bandingin sama A54 ya om ded!,2023-03-23T00:25:56Z,0
@arrizqipramadhana8912,A34 om,2023-03-22T23:05:48Z,0
@igustigedesuryatmaja9174,"Yang suka ngegame jauh"" deh dri hp ini 😂",2023-03-22T22:27:18Z,0
@deandreade4174,Akhirnya kebeli yg ini. Mantep sih ini a54,2023-03-22T19:04:37Z,0
@hengkysoesanto1590,a52s memamg mana woiiiiiiiooooooooo,2023-03-22T18:49:11Z,1
@ahmadamirudin2448,"Berharap ada A74, tpi keknya gabakal di launching si",2023-03-22T17:16:46Z,0
@novaliony9055,masih bimbang banget ini atau s21 fe :',2023-03-22T17:12:44Z,0
@farhanm6250,"Klo cek yutuber luar, disarankan ambil s21 fe aja kak",2023-03-23T02:57:45Z,0
@exsmoker23,"Harusnya tiap 2 generasi A biasanya bakal ada opsi S nya , misal A50s , A52s, semoga ada A54s biar sekalian Upgrade.",2023-03-22T16:27:49Z,5
@natsumeyashi3383,harusnya ada karena seri bawahnya ada a04s (punya ibu saya),2023-08-12T13:10:25Z,0
@exsmoker23,Kira2 klo dari A52s Berasa nga ya Upgradenya 🤔,2023-03-22T16:21:39Z,0
@sunriselovers179,"Baru minang yg violet hari ini buat secondary hp.. cakep sih, gorilla glassnya bikin kesan mewah apalagi pake case bening jd nyaingin ip 13 pro as primary hp😁",2023-03-22T15:36:30Z,0
@Azwargani92,total waktu ngecasnya berapa lama ya dari 0 sampai 100?,2023-03-22T18:00:53Z,0
@sunriselovers179,@Azwargani92 maaf belum pernah coba dari 0.. terakhir cas dari 14%-100% butuh 1 jam lebih..,2023-03-24T01:28:19Z,0
@joseprdn225,Untuk insta story vidio nya gimana goyang gak,2023-03-22T12:17:51Z,0
@Azwargani92,Upp,2023-03-22T18:01:19Z,0
@prastyaganteng6467,"Salfok ama nama wifinya, ganyu wangy😂",2023-03-22T09:09:14Z,0
@ikhsanoctav,penasaran sama review A34 5G nya ommmm.di segerakan 🙏🙏🙏,2023-03-22T08:43:28Z,0
@romerpc0145,"Bang Review HP-HP dengan Frame Metal dong dari yang paling murah sampe yang mahal, BISA?? BISA DONG.... #JagatReview gituloh",2023-03-22T08:28:07Z,0
@bastiankma,bang compare dong a54 sama a73,2023-03-22T07:44:33Z,0
@antoniustedja8978,Sayang exynoss 😂😂,2023-03-22T06:09:21Z,0
@maherandakarisma915,Worth it gak sih ganti hp dari samsung a52s ke samsung a54,2023-03-22T05:55:15Z,1
@ehanmujahidin6116,Gk,2023-03-22T07:46:20Z,0
@igustigedesuryatmaja9174,Ga,2023-03-22T11:42:51Z,0
@stvrgzz,berarti kalau buat headset kabel udh gabisa pke yah? kalau mau pke apakah sambungan kabelnya ada?,2023-03-22T03:26:09Z,0
@igustigedesuryatmaja9174,Bisa tp hrs beli adapter nya,2023-03-22T11:43:17Z,0
@ariz_ownie,"Sekedar masukan, 
untuk review sekalian test untuk WIFI 5GHz nya dong JR, khususnya di chanel vHT80 nya.
sampai saat ini soalnya saya masih menemukan bugs di A33 5G untuk vHT80 nya, gak maksimal (terkadang gagal connect/ terhubung tapi tidak ada internet) dan speed mentok rate 86Mb yg seharusnya bisa nyampe 300Mb lebih. 
Thanks sebelumnya, sukses terus JR.",2023-03-22T02:59:54Z,0
@nanikagustin6006,Bingung nih kok pengen beli pas pertama liat langsung liat reviu nya,2023-03-22T01:55:07Z,1
@aryczzzz,Saya pake A50s dari tahun 2019 dan bukan tipikal orang yg suka gonta ganti hp kalau belum rusak tapi semenjak A54 keluar jadi pengen banget upgrade hp,2023-03-22T01:35:42Z,0
@somemoron3865,A 34 mana bang?,2023-03-22T01:14:47Z,0
@cadaz7777,Review a 34 nya  mana nih belum nongol2..,2023-03-22T01:11:05Z,0
@achmadmustofa4980,Bahas A34 donk om,2023-03-21T23:00:15Z,0
@deviliaputri7032,Mending ini apa Vivo V27 5G ya?,2023-03-21T21:46:59Z,0
@dederahmadheno5888,Beli charger nya dimana bg ?,2023-03-21T20:01:15Z,0
@RenXi93,Semoga bisa upgrade ke hp ini. Aamiin..,2023-03-21T19:48:31Z,1
@smartpeople767,Merasa nyesel baru ambil a53,2023-03-21T19:05:03Z,0
@pakdhechannel385,"Waah,, jadi minat banget Om, belinya dimana ya",2023-03-21T18:57:51Z,0
@yosiaenggark.3690,4k itu UHD ya kalo di samsung?,2023-03-21T17:31:29Z,0
@kevinfruits7057,rekomendasi ini apa S21 FE,2023-03-21T17:10:31Z,0
@Udaferi-sh,"Izin nanya bg.bg lebih mending mana ya bg antara Oppo Reno 8T 5g, Xiomi 12 T 5g atau Samsung A54 ini bg🙏🙏

Mau tau mana yg baik sebagai pedoman untuk ingin ganti smartphone 🙏🙏😅",2023-03-21T17:08:59Z,1
@露娜姐姐,"Buat game gapake bingung lgsg vs ambil 12t, kalo untuk pemakaian medsos, foto, bisa lgsg ambil a54 dg harga setaa 12t.
Kalo oppo blm ada minat pake oppo. Produknya kadang susah ditebak, kadang bisa juelek, bisa buagus😢😮",2023-03-24T06:59:30Z,0
@berrilabiyan1408,"Tp hp sy A53 kucemplungin air saat berenang hny 1meter dan itu pun saya pegang daan 1menit aku cemplungin langsung MATI TOTAL ,, aku garansikan ke Samsung CENTER di TOLAAK ,, padahal masih garansi ,,gima cobaa bang",2023-03-21T16:37:18Z,0
@aiyadanal,"setau saya memang gak termasuk garansi kalau kemasukan air , koreksi kalau salah hehe😅",2023-03-21T22:07:39Z,0
@lvxix9686,"Namanya juga Sumsang, fitur anti air ya cuma buat Gimmick az biar keliatan wow, kalo Soal Garansi Sumsang memang terkenal si Paling auto kesalahan user sejak kasus layar cacat Yg sering light saber, pasti di suruh bayar 🤣🤣🤣",2023-03-23T05:07:14Z,0
@dianapudiana,"Review nya kenapa lengkap amat om 
Sampe kagum sendiri.  
Ngga nemu di creator lain 😊",2023-03-21T13:16:39Z,2
@lutfibakhtiyar5907,Frame nya plastik atau metal?,2023-03-21T13:08:32Z,0
@barllinstock6868,Bang . Rivew Samsung A34 juga terus bandingin,2023-03-21T11:08:26Z,0
@alfiannurhakim9521,Galaxy A54 beneran pake jenis penyimpanan UFS 3.1?,2023-03-21T10:56:18Z,0
@desalarangansidoarjo997,"Biasanya : ada chargernya x3 om
Sekarang jadi. : tidak ada chargernya x3

Ciri khas om ded 😀",2023-03-21T10:49:12Z,0
@jokoutomo5771,"Gua suka brand samsung, tapi ada 1 hal yg bikin gua gak bisa terima yaitu casnya, yg lain sudah 30wat keatas samsung masih 15-25wat",2023-03-21T10:26:43Z,0
@aiyadanal,Demi kesehatan baterai bang,2023-03-21T22:08:15Z,0
@johanjohan7605,Rencana mau ambil a73.setelah keluar a54 jadinya beralih ke a54.masi sempat nabung dl lah.kira2 thn depan baru ambil a54,2023-03-21T09:48:10Z,0
@NAGixBL,Hp only 😂😂😂,2023-03-21T08:24:02Z,0
@re-fix9678,👌👌👍👍,2023-03-21T05:20:05Z,0
@Lord.Dewa.,"Bezel nya menebal ga sih dibanding A51, A52 dan A53?",2023-03-21T04:34:55Z,0
@igustigedesuryatmaja9174,Menebal,2023-03-22T11:44:58Z,0
@backupscm,"Bezzelnya kenapa makin tebel, jadi kaya hp murahan",2023-03-21T04:25:30Z,0
@firja5145,gaya bicara om ini mirip dekan fakultas aku di UIN Aceh 😂🙏🏻,2023-03-21T03:19:26Z,0
@nathanaelsandy9144,kipas buat HPnya ada linknya om?,2023-03-21T01:44:32Z,0
@pamansemesta,"Minta rekomendasi dong bang, ambil Samsung A73 5G atau A54 5G?
Makasih",2023-03-21T01:11:09Z,0
@athenaevolutions971,"Klo buat main game realme 10 udh enk bnget cipset helio G99 ngebut.
Main ml rata kanan ultra. Dan slma 1bulan pemakaian ttp enk no kendala.",2023-03-21T00:34:19Z,0
@amarsyahalihasibuan4926,"Mudah-mudahan beberapa bulan stlh rilis samsung A54, samsung A74 juga akan rilis sebagai penerus samsung A73 dari tahun sebelumnya.  Chipset terbaru snapdragon 870 / snapdragon 7 gen 1,  kamera tetap 108 MP,  super amoled plus,  refresh rate 130 Hz,  5G, ukuran layar tetap 6,7 inchi,  baterai 5200 MAH, berat HP 178 g.",2023-03-20T23:07:08Z,3
@HassleKate,"A7 series udah ga lanjut lagi bang, karna deketan harganya sama seri FE",2023-03-27T08:34:18Z,0
@sudimaryanto5498,"A 53 5G itu hp yang aku punya saat jni ..setelah setahun Ku beli masih sangat nyaman  ..saat nonton A 54 5g ...keinginan buat beli susah di tahan .
Makin juara samsung series A .",2023-03-20T23:02:25Z,2
@yogisadjar3720,Mending a54ini atau xiaomi 12T yaa? Lagi bingung antara keduanya,2023-03-20T19:46:43Z,0
@igustigedesuryatmaja9174,12t sih.,2023-03-22T11:45:46Z,0
@ismailgojang492,"Jujur ya, HP samsung dan Iphone, tdk berguna Bagi pelaut.
Jaringan Susah, beda dengan Hp cina
Hp cina Bagus dapat Jaringan dan internetan.
Samsung dan Iphon, dapat Gaya doang.",2023-03-20T17:40:34Z,1
@bangkekkartun8757,Design mirip ip xr lebih lebar,2023-03-20T17:26:48Z,0
@ScArY-c7r,"Harga mahal
Charger gak ada apapun terpisah Samsung jadi seperti iPhone dikit""buat ramah lingkungan

🥵🤡
Beli mahal""spek badut pelit lagi",2023-03-20T17:04:18Z,0
@Fajar.Sundawy,Alhamdulillah komen pake Samsung A54,2023-03-20T15:48:13Z,0
@Pakekotanitv,Gw sdh beli a73  lumayan mantap..,2023-03-20T14:57:35Z,0
@sentrixxc7145,Mau beli hp ini tolong saranin za..A54 at V25pro...sy suka buat vidio konten,2023-03-20T14:35:50Z,0
@RankingkongClip,bisa ga si model tes kameranya diganti cwe hehe,2023-03-20T11:50:13Z,0
@Gembul_boy,kalau hp samsung A54 5G sama  ZERO 5G 2023 bagusan yang mana ya ?,2023-03-20T11:19:54Z,0
@fardannovanto9473,"jelas A54, klo infinix focus game aja tpi aspek lain kalah semua sm A54",2023-03-28T09:51:00Z,0
@nurulfadhila3327,menanti reviu A34,2023-03-20T11:11:20Z,0
@gedefreddywulanwarman6537,"Apakah titik GPS stabil TDK pindah pindah, biasanya kalo GPS map google sebelum nya selalu TDK stay di lokasi.",2023-03-20T10:05:23Z,0
@TSuWiY,Mau nanya framenya masih plastik atau udah metal ya?,2023-03-20T09:41:18Z,0
@rozaiahsayangku777,Ini baru samsung yang aku suka mengingatkan samsung galaxy A5 2017,2023-03-20T09:40:07Z,0
@alwisadad3941,Kalo untuk kamera a14 5g Vs M 23 bagusan mana ya bang?? Bingung mau milih mana??,2023-03-20T08:47:42Z,0
@m3yca,Saya pengguna M23 awal² kamera depan kerasa banget kuning² gt tapi setelah update 2 kali kamera nya bagus malah detail bangetttt,2023-08-01T10:04:35Z,0
@seputar_oli,Ditunggu review Samsung A34 bang!,2023-03-20T08:44:33Z,0
@jakedoit5380,"Yang bikin saya penasran itu gini... Kalau kita pakai HP dengan layar GORILLA GLASS 5 sebetulnya apa masih perlu screen protector sih??? BENERAN TANYA PENDAPAT KAWAN2. Saya sebelumnya pakai S10+ dan sekarang pakai A54. Nah, kalau kita pakai screen protector kok pikir saya : 1. Bukannya GORILLA GLASS ini memang terus di improve untuk semakin kuat 2. Kalau kita selama pakai HP pakai sp artinta kita tidak menikmati maksimal sebuah layar HP 3. Dan, kalau kita kemudian menjualnya artinya selama kita pakai kita ini gak menikmati karya asli teknologi Gorilla Glass. Mohon petunjuk/ koreksi/ pendapat teman2",2023-03-20T07:28:06Z,0
@CHRIZZ108,"Ya wajib pake screen protector lah, sekelas Gorilla Glass Victus 2 aja masih bisa lecet",2023-03-20T07:45:12Z,0
@jakedoit5380,"@CHRIZZ108 Ooo... gtu ya. Soalnya saya mikirnya, kan banyak tes2 GORILLA GLASS 5 dibaret2 pake obeng baik2 aja berarti klo cuma masuk kantong/ tas gtu gak akan baret sedikitpun",2023-03-20T07:50:13Z,0
@lvxix9686,"Pengalaman pake HP yg Gorilla Glass 5 di layar depan & body belakang nya sih oke, jatuh dari atas kepala waktu lepas tas selempang jatoh dari tas ke lantai parkiran semen aman sih sama sekali gak pecah & gak ada retak sama sekali cuma ya tetap masih bisa kegores tipis tipis yg halus, intinya ya Gorilla glass itu kaca yg lebih tahan banting az tetap bisa ke gores & pecah suatu saat nanti, jadi kalau mau aman ya tetap pasangin Tempered glass lagi, murah paling 50-100k daripada ganti layar yg jutaan kan",2023-03-23T05:16:53Z,0
@StellarX696,6juta ngk bisa ultra skip,2023-03-20T07:12:25Z,0
@edotenseinojutsu3639,Layarnya belum gorilla glass 5 ya.. kok di Gsm arena gk ada keteranganya...,2023-03-20T06:27:12Z,0
@anggriseptianwijaya,"Om, frame nya terbuat dari apa ya?
Sama video bisa dual recording ga?",2023-03-20T06:20:35Z,0
@ansarmirza1364,Plis buatin a 54 vs a 73 galau ni mau beli yg mana...?,2023-03-20T05:44:16Z,0
@gulammirza2270,Jadi penasaran  dgn yg a 34,2023-03-20T05:35:50Z,0
@abcd-lw1wj,Dagu nya tebel bangetttt A54 beda sm A73 hampir simetris..,2023-03-20T05:35:03Z,0
@pesmerga1507,Nonton review A54 5G dari JR pake Samsung A50S...,2023-03-20T05:31:33Z,0
@waterlionlee3418,"Beli offline susah banget cari yg greenlime weh, kesel banget 😢",2023-03-20T05:22:22Z,0
@wiratamadean5994,"Om ded, kapan review Galaxy A34 nya?",2023-03-20T04:10:23Z,0
@arissoerachman7144,"Permisi , tolong samsung A34 nya di review juga bang 🎉 , kalau performa saya rasa keduanya sudah tinggi namun bagaimana denagn kamera ? terutama perbandingan foto dan video antara a34 dan a54 nya  , terimakasih",2023-03-20T03:14:29Z,0
@cahbagus7663,"YA JELAS VIVO V27 5G Yg bakalan rilis nanti lebih bagus, JAUH LEBIH BAGUS! 
Jangan dlu beli ini yg mau ganti HP.",2023-03-20T02:47:18Z,0
@igustigedesuryatmaja5513,"Masing"" ada kekurangan dan kelebihannya",2023-03-20T23:14:38Z,0
@sanahsanah86,"charger mana?   
lagi ok klo ada chargernya.👌",2023-03-20T01:56:21Z,0
@darzennn,bang tolong bandingin samsung A54 sama samsung A73,2023-03-20T00:46:10Z,0
@ndb4312,Daripada beli merk sebelah yang layar nya lengkung tapi perekaman 1080p 30 fps yang patah patah wkwkwk,2023-03-20T00:38:01Z,0
@nmrkmrmh7553,Ini sm s21 fe bagus mana ya,2023-03-19T23:43:43Z,0
@AHAS_SIP,Mantap reviewnya,2023-03-19T19:20:55Z,0
@salmonds6855,kira kira yang a34 ada earphone jacknya ga ya?,2023-03-19T18:07:17Z,0
@primarenaldi,A series kembali ke tahun 2016-2018👏👏,2023-03-19T16:40:01Z,0
@muhammadiqbal-jj1zm,"Jagat Review, mau tanya donk..kalau di samsung A54 ini kita putar video resolusi 2k (1440p) bisa mutar ga ya?",2023-03-19T15:57:31Z,0
@yusufmario1946,"Saya user a52s, video 4k wide nya bisa  andalkan utk aktivitas dilapangan.",2023-03-19T15:41:50Z,0
@aikaislamita1243,Malasnya samsung cepwt banget panasnya,2023-03-19T15:01:01Z,0
@mutiajayajaya5796,Dknlntmnslnt,2023-03-19T14:29:23Z,0
@markusrose9269,"tidak ada charger nya
tidak ada charger nya
tidak ada charger nya...",2023-03-19T13:06:17Z,0
@wmikhsan,"ga ada headphone jack, sedangkan tws yg bagus mic nya biasanya mahal2 juga, klo tws 300rb an yg bagus suaranya aja tapi untuk mic nya kaya ga maximal. patut jadi pertimbangan juga",2023-03-19T12:45:32Z,1
@fajarprasetyoadi4534,jika ada samsung a54 maka harus ada seri a24 sama a74 semoga 2 smartphone tersebut risin tahun depan atau klo enggak tahun ini juga kaya seri2 yg rilis tahun lalu,2023-03-19T12:44:13Z,0
@igustigedesuryatmaja5513,Bukannya seri A7x sdh dimatikan ya?,2023-03-20T23:15:54Z,0
@fajarprasetyoadi4534,@igustigedesuryatmaja5513 mending tunggu konfirmasi resmi dari pihak samsung soal masa depan seri a7x info yg beredar saat ini masih rumor sama spekulasi saja,2023-03-21T11:32:37Z,0
@hajaraswad171,Ditunggu video review Samsung a34,2023-03-19T12:36:52Z,0
@viralusia9574,Android sekarang rata2 gede2 kaya talenan,2023-03-19T12:30:25Z,0
@namakufikri7014,Mending Xiaomi 12t bahh,2023-03-19T12:03:45Z,0
@ryohato5763,"PUBG (standar bawaan)
A52S 5G : SMOOTH-EXTREME 👍
A54 5G : SMOOTH-HIGH 🤭
😂😂😂",2023-03-19T11:33:23Z,0
@faizjohn942,"Lihat Genshin bos, jangan Pubg,  Genshin aja peformanya mendekati A52s, mungkin setelah update software bakal sama peformanya",2023-04-19T17:07:14Z,0
@pornets,"Bener2 bagus nih a54, 2 bulan lalu baru aja beliin a53 buat ortu 😂😂, yah sedikit menyesal, harga sama pdhl...",2023-03-19T09:47:08Z,0
@rimahsakura,Kak cobain dong perbedaan kamera dan rekaman video Vivo V27 5G dengan samsung A54 5G.masih bingung mau yang mana🙂🙏,2023-03-19T09:29:22Z,2
@amamiya284,mending sumsang kak ketibang oviv,2024-02-06T16:53:27Z,0
@ericadiewibowo,12T ?,2023-03-19T09:25:35Z,0
@UTSobarnawijaya,a 54,2023-03-19T09:07:05Z,0
@AepSaepudin-xz8zl,Bang a54 sudah support NFC blm?,2023-03-19T09:04:08Z,0
@macanputih1351,"Kameranya di sunat
Dri yg sebelumnya 4 kamera sekarang jadi 3😂",2023-03-19T08:13:08Z,0
@eaaepro,Ada microsd gk om? Kalo dipake IG story gmn om? Ty,2023-03-19T07:16:25Z,0
@pocoyonamina,kalau perbaikan update software masa depan a54 sangat cerah wkwkwkwk fiture2 barunya bikin gak nyesel ilang charger,2023-03-19T05:51:37Z,0
@RamaDhaniChannel,gua yakin pasti update terus dan kekurangan kekurangan skarang bakal ditutupi 1 per 1 dari masalah grafik game sampai stabilisasi video,2023-04-25T08:57:30Z,0
@daichiicraft9363,"Bangg cobain a34 wkwk gw nekat beli meskipun belom ada yg review detail, tapi tadi gw coba main genshin 33mnt lancar cuman anget dikit, cuman kameranya biasa aja atau saya aja yg gabisa setingnya hehe pertamakali pake samsung",2023-03-19T05:41:12Z,0
@daichiicraft9363,"Dan itu belum aktifin alternate game nya, kalo diaktifin mungkin jadi lebih kerasa suhunya",2023-03-19T05:43:03Z,0
@fajartribuana4133,Jadi penasaran secara performa A54 bisa ngalahin A52s ga ya?,2023-03-19T05:37:19Z,0
@L_U_elyu,"Hmm.. Lebih Ke Hampir seimbang aja. Tapi jangan Salfok sama Antutunya doank ya. Karena kita itu beli hape gak sekedar beli antutu doank, Banyak aspek yang Menurut kita sendiri Butuh atau gak.",2023-03-19T06:11:54Z,0
@sandihermana4873,Smartphone lain bawa harga 6jtaan mungkin kah dri oppo atau relme yg kmampuan perekaman video nya cma mentok di 1080p 30fps audio dri rekam nya ampass😅🤣,2023-03-19T05:34:25Z,0
@aguskurniawan3558,Bang tolong bandingin samsung galaxy a54 5G sama xiaomi redmi 12 lite 5G🙏,2023-03-19T05:23:32Z,0
@melkiorsimbar8412,@Jagat Review..bang kalau dibandingkan dengan A 73 mana yg lebih baik,2023-03-19T04:31:27Z,0
@anggaputralpprojects4986,"Tertarik nih hp😄
Tapi harganya 😢
Belum bisa beli",2023-03-19T02:42:56Z,0
@mohammadrizal4351,"Om mending beli ini atau beli s21 second kalau gak salah liat dari harga kurang lebih sama, tolong pencerahan nya 🙏",2023-03-19T02:37:41Z,0
@heruhayrosin6914,Chipset nya 🤣,2023-03-19T02:08:25Z,0
@djoenadisinggih8586,Kalau di bawah 778 g chipset nya. Berarti kalah sama samyang A52 S. ... Tambah turun,2023-03-19T02:06:27Z,0
@L_U_elyu,"Dibilangin Jangan Cuma Antutu doank, Lihat aspek lain Kocag... Lu beli ""Antutunya doank"" atau Apa???",2023-03-19T06:13:07Z,0
@nibraofficial2767,Duhhh jadi bingung nihh mau beli iPhone 11 atau samsung a54😭,2023-03-19T00:45:48Z,0
@pipibakpao380,Harga segitu dapet ny Exynos 😅😅😅,2023-03-19T00:35:19Z,0
@randypratama18,ga masalah. 778 di samsung jg ga bagus,2023-03-19T01:35:23Z,0
@L_U_elyu,​@randypratama18bukan gak bagus tapi lebih tepatnya ditahan aja. Ya Kalau mau Gaming 778G sih Realme GT master aja dah.,2023-03-19T06:13:38Z,0
@randypratama18,@L_U_elyu ditahan2 ya ga bagus lah gmn sih 😂,2023-03-19T10:26:44Z,0
@L_U_elyu,"@randypratama18 Lah di Samsung ditahan karena Samsung emang biasanya Gak fokus di performa segmen Midrange, biar awet hapenya. Klo lu mau gaming tinggal ke Realme aja atau gak Xiaomi Udh simpel. Klo lu tetep Pengen gaming di Samsung ya Matiin aja Fitur GOS nya.",2023-03-19T10:39:53Z,0
@randypratama18,"@L_U_elyu ya ditahannya itu yg bikin game ga bagus. ada gos atw kagak, pake plugin sgala macem, ga ngaruh byk org dilimit dari tweak system nya kok. mau pke snpadragon model apapaun klo sama2 dilimit ya ttep aja. mknya gw bilang mnding exynos aja toh sama2 dilimit ga bakal keluar performa aslinya.",2023-03-19T11:09:10Z,0
@nabilaseptiwulandari5576,Kalo sama a73 bagusan mana? Saya ga main game dan lebih suka kamera,2023-03-19T00:17:31Z,0
@djagadanggoro270,minta pendapat lebih worth it untuk game yang mana antara a54 atau a52s?,2023-03-18T23:54:58Z,0
@randypratama18,"gaming beli xiaomi aja, samsung ga ada yg enak di hrg sgini",2023-03-19T01:36:03Z,0
@L_U_elyu,Lu mau gaming nyantai atau mau gaming Maksimal? Kalau mau gaming maksimal ambil ROG aja,2023-03-19T06:14:13Z,0
@indypraditya,Review A34 dong,2023-03-18T23:35:24Z,0
@josh123ijo,Kalo ga liat harga..mending a54 ato a74 ato s21fe ?,2023-03-18T22:05:07Z,0
@bagindacibbrayy218,nonton pake a54 nyimak🤗,2023-03-18T21:24:25Z,0
@manusianokturnal,"Alhamdulillah, selamat atas hp barumu 👏",2023-03-19T09:35:53Z,0
@hengkysoesanto1590,ko dedi kalau sama A52s over all bagus mana? thanks,2023-03-18T20:48:06Z,1
@beatrixavrora2700,Compare sama A73 dong bang✨,2023-03-18T18:36:26Z,1
@ipariyantitangerang4557,"Pengguna A50s nih 😂 udah dari Des 2019,udah pengen ganti kemarin sempet mikir mau ganti ke S21 FE,tp lihat ini jd galaaaauuuu 😂😅",2023-03-18T18:23:20Z,1
@luthfiafif4,Request Review SAMSUNG GALAXY A34 omm,2023-03-18T18:10:22Z,0
@luthfiafif4,"Aduh om , Seketika begitu liat Samsung FLAGSHIP make EXYnos dilema bgt dah. Pengalaman dulu selalu buruk kalo make EXYno:((",2023-03-18T18:09:40Z,0
@randypratama18,"exynos midrange biasanya bagus2 aja buat daily, ga seboros flagship",2023-03-19T01:37:14Z,1
@luthfiafif4,series S21FE aja overheat udh berasa kek setrikaan 😅🙏,2023-03-19T17:32:22Z,0
@cleootm8788,"Iphone 11 sama samsung a54, rekomendasi mana frend ?",2023-03-18T17:48:10Z,0
@preetttt3173,"Semua org pada sibuk beli Axx lah atau Sxx lah
Lah saya masih pake a10s sejak 2019 masih aman² dan nyaman sih buat sehari-hari wkwk. Masih segel belum pernah bongkar pula
Saran gaes kalo buat pemakaian jangka panjang+maen game ringan kek ML/PUBG mending ambil a54 ini atau langsung loncat ke seri S aja ya?
Secara dana udah siap sih karna emg pengen upgrade langsung aja ke yg tinggi😂",2023-03-18T17:16:47Z,0
@mikrojihad,kalo di compate sama xiaomi 12t gimana om? lebih worth it mana? terutama head to head kamera nya?,2023-03-18T16:48:30Z,0
@randypratama18,"fokus gaming 12t, allrounded a54. kamera jauh lebih bagus a54",2023-03-19T01:37:55Z,0
@ryukazh.gaming,Mending mana sama xiaomi 12T yak?,2023-03-18T15:57:55Z,1
@alterego1030,Bantu saran dong suhu. A54 ini atau s21fe?,2023-03-18T14:55:32Z,0
@randypratama18,sama2 exynos krg maksimal mnding a54 lebih murah ini,2023-03-19T01:38:56Z,0
@ariefalen,Framenya bahan apa???,2023-03-18T14:19:24Z,0
@myhobbiesmycollections4364,Diadu sm mi 12 lite..,2023-03-18T14:17:10Z,0
@gorics8681,"Midrange samsung harganya bisa 1,3 sd 1,5 x midrange merk lain 😂",2023-03-18T14:14:25Z,0
@bayusetaba,VS sama ViVo T1 pro....,2023-03-18T14:13:45Z,0
@Ragilddone,harganya beda jauh,2023-03-19T07:06:31Z,0
@bayusetaba,"iya om, tp secara performa bagus mana om mengingat spesifikasi chipsetnya hampir sama...?klo menurut saya seh lebih pilih vivo T1 pro.",2023-03-20T06:24:38Z,0
@y0tta13yte,"om, bahas A34 nya juga dunk",2023-03-18T14:02:24Z,0
@intermie.goreng,Sayang hybrid.....,2023-03-18T13:59:20Z,0
@Hi-vi5nz,Tidak ada charger nya x3🗿,2023-03-18T13:54:06Z,0
@menasnovian,frame metal/plastik ya,2023-03-18T13:29:39Z,0
@menasnovian,"@Animation TV mungkin ya, reviewer utd idn bilang frame plastik soalnya",2023-03-18T22:11:59Z,0
@Ragilddone,"plastik,karena gak ada garis antenq",2023-03-19T07:08:16Z,0
@AbbieFhle,NFC ada gk sih,2023-03-18T13:06:26Z,0
@adrianekaramadhani,"exynos 1280 aja blm bisa ultra di mobile legend, sampe skrng blm ada cuy",2023-03-18T12:56:31Z,0
@Mamang_sera,Review A34 juga bang 😊😊😊,2023-03-18T12:14:43Z,0
@bungsupamungkas8438,Mau nanya mending beli poco f4 flagship killer atau beli Samsung galaxy a54 mid-range terbaik?,2023-03-18T12:12:19Z,0
@randypratama18,klo gaming jd kewajiban f4 aja. kamera jg lumayan klo f4,2023-03-19T01:41:46Z,0
@Ragilddone,12t aja,2023-03-19T07:08:44Z,0
@KakaMarsGim,"Untuk gim FIFA Mobile grafisnya sudah bisa mentok ke ultra om???
Post effectnya mentok tinggi?",2023-03-18T11:24:15Z,1
@anggessmith5527,"Aduuhh masih aja kecepatan charging cuma 25 watt, kompetitornya udah 120 Watt tuh",2023-03-18T10:59:05Z,0
@rezaanwari7036,"Bosen banget pake Xiaomi A1 udah ganti LCD 3 kali, liat samsung yang ini rasanya pingin langsung beli, semoga bisa kebeli tahun ini, semangat nabung.",2023-03-18T10:49:27Z,0
@fznfadillah,"Om, kasih review networking nya juga dong. Speed test di jaringan 4G dan 5G nya. Speedtest ini juga berpengaruh thd performa gaming, streaming, dll. Thank you.",2023-03-18T10:27:48Z,0
@arganthard,"mohon jawab kawan2.. otw lagi beli soalnya
mending s21 fe atau a54?
thanks alot",2023-03-18T10:13:27Z,0
@igustigedesuryatmaja9174,S21 fe,2023-03-18T13:07:06Z,0
@randypratama18,"duit nyampe s21fe ya 21 fe aja
kcuali bujet cm 6jt mentok ya a54 jg oke😊",2023-03-19T01:42:44Z,0
@abcd-lw1wj,"Refresh rate adaptip udh bukan makanan flagsip lagi😢,di mid juga bs....",2023-03-18T09:11:20Z,0
@janitranaabih3081,bagusan beli a m54 atau s20fe sd ya?,2023-03-18T08:54:11Z,0
@randypratama18,klo ga prlu wireles carging & embel2 s-series ya mnding a54 lebih baru sokongan software lebih panjang,2023-03-19T01:44:23Z,0
@anggorostrife012,"Suka sama bezelnya, layar flat nya, tapi 6 juta, dompet gua flat",2023-03-18T08:43:33Z,0
@ayodyatsania,"Bang review samsung a34 5g udah keluar tuh...😃,penasaran performa dimensity 1080 disamsung",2023-03-18T08:29:36Z,0
@fuadfadilah3906,"untuk pemakaian harian + foto dan video + tidak untuk gaming, cukup ambil a34 aja atau a54 yaaa?",2023-03-18T08:16:08Z,0
