author,comment,publishedAt,likeCount
@gids9917,@Atabapo_senso imx682 om,2023-03-15T13:06:20Z,6
@Atabapo_senso,@gids9917 berarti a54 lbh di atas dikit ya,2023-03-15T13:30:48Z,2
@nauvalprasetya8178,"Menurut saya lebih baik kamera A54 ketimbang A52s, untuk saat ini. Apalagi klo iya ada update software untuk atasi sedikit kendala kameranya, weehh perfect..",2023-03-15T13:31:32Z,19
@gids9917,"@Atabapo_senso iya secara sensor dan optimasinya bagus. Ibaratnya secara harga dan apa yg didapet, menurut saya masih sesuai.",2023-03-15T13:40:51Z,3
@ibalbuble,tim A52S 5G hehe,2023-03-15T12:54:39Z,1
@IlyasJefriAndrian,"ditunggu review A34.,. 🥺",2023-03-15T12:53:32Z,0
@kodokmati123,"Sayangnya gak di compare sama A53
Untuk pengujian kamera karena banyak update software untuk kamera.",2023-03-15T12:53:11Z,0
@croakerfield_,Thx infonya sangat bermanfaat.,2023-03-15T12:52:28Z,0
@madesudana366,"Semoga nanti video 4k nya dapet update jadi stabil ya, soalnya a52s dulu awal2 juga gak stabil trus dapet update software",2023-03-15T12:51:48Z,0
@derrypramudya6047,Jadi stabil gak bang 4k sama 1080p 60fps nya?,2023-03-15T16:48:01Z,0
@Ricky_Ali_Idrus,"Udah masuk masa mentok inovasi, boring dah, bentuk gitu2 aja prosesor dah mentok gitu2 aja, desain gitu2 aja gak ada inovasi,,, jadi malas beli hape baru",2023-03-15T12:51:32Z,0
@johnfantau7407,nunggu m54,2023-03-15T12:51:31Z,0
@HonkStore,"Kok layar nya gtu ya.. bazelnya kok makin tebel dr seri"" terdahulu...",2023-03-15T12:51:21Z,0
@rizqirofii2543,a34 nya kapan bang reviewnya ?,2023-03-15T12:51:11Z,0
@radityavision229,Kalau di hp entry level gada game booster setting kah bang?,2023-03-15T12:51:06Z,0
@walfikriafrinaldi3663,Ada samsung dex nya pak?,2023-03-15T12:50:14Z,0
@yancyt,Layar nya gua suka termasuk Compact d jaman sekarang 6.4..,2023-03-15T12:49:55Z,0
@ronnieleite2153,"Ini nilai plus buat gw, benci banget hape gede² hehehe",2023-03-15T13:20:16Z,0
@yancyt,@ronnieleite2153 ya sekarang hp layar nya dh segede2 gan nth knpa GK buat 6.atau 6.2 gtu😁,2023-03-15T15:05:10Z,0
@naufalfadliamzar8364,"Ukuran compact tapi cukup berat, 202 gram",2023-03-15T18:22:07Z,0
@ronnieleite2153,"@yancyt bener bro, berat di kantong dan di tangan",2023-03-17T16:14:46Z,0
@AASMLBB,"Yang bikin mundur Berat Body nya dan performa maen game yang kurang...😀
Masih menanti Vivo V27",2023-03-15T12:48:55Z,1
@dhiopratama5,"Emng mantap kalo udh riviw, bagian detail body hp ny pun bisa di expose secara detail, bagus biar pada tau hp yg mau dibeli desain nya kek gmna depan belakang samping""nya 😍",2023-03-15T12:47:51Z,1
@rulianto7787,"hari ini muncul di gsmarena, hari ini juga rilis videonya, gokil.",2023-03-15T12:46:31Z,1
@abdulfatahas6254,mending sm 54 dripada ip 11,2023-03-15T12:46:24Z,0
@fika9988,Jdi kesimpulannya gimana pak ???,2023-03-15T12:46:11Z,0
@kigaming1813,S22 FE kapan release om?,2023-03-15T12:46:07Z,0
@supervodka9,cipset sm kyk a52s/m52 hadeh.. tp ini eksinos🤣,2023-03-15T12:46:04Z,0
@mohamadbayu7116,realme 10 pro+ menangiss melihat samsung ini hahaha,2023-03-15T12:45:19Z,0
@imammm6258,"Bezel nya makin tebel aja, ketularan a14",2023-03-15T12:44:30Z,0
@adyaja4782,tidak ada charger nya 😭,2023-03-15T12:44:11Z,0
@賢二アディアン,"Klo mendekati 778G yaa berarti masih unggul 778G yg A52s kemarin dong?🤣 jujur letak flashnya ga banget, kek Samsung yg seri murah itu.",2023-03-15T12:43:59Z,0
@mrbobgamingmemes9558,Letak flash gak penting untuk dibahas yang penting kualitas hpnya gimana,2023-03-15T23:36:46Z,0
@rismaafriliany5601,Apakah s21+ masih worth it?,2023-03-15T12:43:48Z,0
@wahyujw3888,a73 vs a54 mending mana om?,2023-03-15T12:42:47Z,0
@dapaadzuar8754,Bagusan ini apa a73?,2023-03-15T12:42:32Z,0
@naufalfadliamzar8364,A73,2023-03-15T18:24:39Z,0
@dadiramlan,bagusan a54 ato a73 ya untuk rekam video,2023-03-15T12:42:28Z,0
@Pe_De,Exynos skip dah 😂,2023-03-15T12:42:07Z,0
@excelgrande1634,Wow samsung tapi pkek lensa Sony... Nice,2023-03-15T12:42:06Z,0
@dayathidayat8448,Akhirnya A54 udh hadir pada jagat review,2023-03-15T12:41:55Z,0
@rizkifebriyanto9177,Chanel keren indonesia belum ada yg punya beliu sudah ngereview paling pertama,2023-03-15T12:41:31Z,0
@aiurshoon1855,A54 mic nya bagusss,2023-03-15T12:41:02Z,0
@semangatpemberani,"saat smartphone lain pakai layar melengkung / bezel yg tipis, A54 bezel-nya tambah tebel.  Seriusan tanya  nih, untuk smartphone allrounder mending A54 atau S21 FE (terlepas beda kelas) ?",2023-03-15T12:40:51Z,0
@bobbyleoananda7722,G tebel..itu karna beselnya simetris jadi keliatan tebel. Sama aja kyk a53,2023-03-15T12:45:37Z,1
@semangatpemberani,"@bobbyleoananda7722 mosok sih, keliatan lbh tebel bezelnya  A54 🤔",2023-03-15T12:57:48Z,0
@sandessinabang8434,Seperti biasa charging samsung mentok di 25 watt. Lama nungguin penuhnya. Minimal 33 watt lah jaman skrng,2023-03-15T12:40:38Z,0
@stephenkurniawan6912,"Kyk kurang ya chipsetnya wkwkw. Mending A73 kemana"" 🤣",2023-03-15T12:39:51Z,0
@itney____3768,"Makasih dosen gadget, hari ini saya dapat 4 SKS 👍",2023-03-15T12:39:43Z,0
@anafza17,Hp midrange terlaris samsung kudu full weapon,2023-03-15T12:39:11Z,0
@bobbyleoananda7722,Orang kok g move on2 sma A52s.. padahal menang prosesor aja. Klo menurut gue a54 ini bener2 all rounder,2023-03-15T12:38:54Z,0
@gids9917,"Setuju, saya user A52s tp harus diakui A54 dibikin bagus merata di semua aspek. Lensa kamera Sony pula dan bs optimized kemampuannya. Pengalaman pake A52s perbaikan dr waktu ke waktu membaik seiring adanya software update.
Dan dr segi pricing, ini sebenernya masuk akal apalagi utk merk Samsung yg update OS dan security patchnya panjang bgt.
Top sih ini. A53 yg rd fail kayak dibikin comeback lg dengan A54.",2023-03-15T12:49:57Z,0
@kakang.anjar95,"Seenggaknya samsung udah perbaiki kesalahan besar dari A53, yaitu soal performa A53 yang jauh lebih loyo daripada A52s padahal harganya sama, di A54 ini performa kembali ngegas sesuai dengan kelas harganya.",2023-03-15T13:02:14Z,0
@bobbyleoananda7722,@kakang.anjar95 seneng banget udah balik kaca meskipun frame nya blum metal..karna klo gue sik fokus ke design. Klo chipset g terlalu karna penggunaan casual. Bakalan beli sik kykna,2023-03-15T13:06:17Z,0
@bobbyleoananda7722,@gids9917 iya kak..harganya pun sama kyk a52s dan a53 kok yg 256 waktu launching..,2023-03-15T13:07:06Z,0
@gids9917,"@bobbyleoananda7722 betul, malah lebih rendah 100k dr A53 utk 8/256.
Di tengah harga2 komponen yg serba naik, Samsung bs pertahanin bahkan turunin harga produk di generasi barunya.",2023-03-15T13:12:58Z,0
@luthfirafa7930,Bang samsung a74 nya apa kabar,2023-03-15T12:38:13Z,0
@adityadimasptra,skip kalau bukan snapdragon hehehe,2023-03-15T12:38:10Z,0
@handoko6485,"Bagus ini Hp, Masuk List Lebaran lah, jika belum ada hp yg baru 😁",2023-03-15T12:38:03Z,0
@Sudyog,Kecewanya kenapa exynos:(,2023-03-15T12:36:23Z,0
@AndySimarmata,akankah di seri genap ini ada seri 's' seperti biasanya?,2023-03-15T12:34:35Z,0
@suroiyasetefani6708,Uwaaa.. masuk wishlist,2023-03-15T12:34:28Z,0
@yudihermawanhermawan1596,A54 kamera nya lebih natural,2023-03-15T12:34:25Z,0
@eza_aditya,Pengen beli samsung tp masih ragu rawan lcd shadownya,2023-03-15T12:34:02Z,0
@tamamfajar537,"Om mau tanya, harga segitu mending beli ini apa Xiaomi 12T ya ???",2023-03-15T12:33:29Z,0
@yudihermawanhermawan1596,Soal kamera Samsung jangan di ragukan lagi,2023-03-15T12:33:28Z,0
@anggaspecial2978,Masih kurang percaya dengan exynos,2023-03-15T12:32:15Z,0
@ryanyoutubepremium,A34 dong om ded,2023-03-15T12:31:25Z,0
@allimran9177,Bagus diversusin a73 nih om ded😁,2023-03-15T12:30:36Z,0
@hikaruschneider,itu kipasny merek apa om? kok bisa ad yg melebar seukuran body hp gitu?,2023-03-15T12:29:43Z,0
@bimokupas2-nb3ny,Exinoss? Skip mending A73,2023-03-15T12:28:49Z,0
@mbah87eko80,Sdh kah masuk indonesia???,2023-03-15T12:27:54Z,0
@agungsudrajat8784,jatuh hati langsung sama desain nya,2023-03-15T12:27:52Z,0
@purupuru520,"Mohon bantu gan rencana mau ambil GT neo 3 yg adem dan kenceng tapi minus dikit di kamera (lowlight mantep abis) dan nggk ad slot micro Sd, begitu liat A54 jadi bingung, minus A54 di harga 6jt an tpi chipset nya nggk stabil dan panas (hp Klo udh panas bisa masalah ke yg lain)",2023-03-15T12:27:36Z,0
@eza_aditya,"Lebih sering ngegame, performa gahar, charge kenceng ambil Neo 3

Lebih prefer kamera, software, security, tahan air, all rounder gitulah ya ambil A54",2023-03-15T12:33:01Z,0
@rizkyputra639,Baru beli A53 sebulan sudah rilis  A54🙃,2023-03-15T12:27:28Z,0
@rra2931,Masih berharap ada hp mid range yang bisa menyaingi Vivo t1 pro selain poco f4 karena gua denger banyak kasus hp poco tiba tiba mati,2023-03-15T12:26:59Z,2
@hdchannel1940,Kalo sekarang sulit chipset pada naik ada yg ghoib 🤣,2023-03-15T14:25:55Z,0
@naufalfadliamzar8364,"Poco yg banyak mati itu X3 Pro skip aja jgn beli produk itu, kalo F4 aman2 aja sh",2023-03-15T18:05:38Z,0
@mrbobgamingmemes9558,"Gw pake poco f1 smapai baterai rusak gak sampai matot juga , tergantung makenya waras apa nggak,",2023-03-15T23:35:35Z,0
@muhammadfahmi1858,"Maaf OOT. Bang Alva Jonathan udah ""lulus"" dari tim JagatReviewTV yah? Kenapa ignya masih ada di kolom deskripsi video ini yah?",2023-03-15T12:26:59Z,0
@yopie-9904,saya rencana mau beli antara ini sama s21 fe mending mana yah bang,2023-03-15T12:26:48Z,0
@BeYotuber,6 jutaan bisa dapat Asus Zenfone 9,2023-03-15T12:26:07Z,0
@Bayu_Jambo,"apakah worth it pindah dari a52s ke a54?
terlepas dari desain..",2023-03-15T12:25:45Z,0
@ronnieleite2153,"Menurut gw:







Ga worth. Hape 3 tahun ke belakang upgrade nya minor aja Bang (berlaku hampir di semua merk hape). Kecuali sekalian naik kelas ke Flagship baru sangat worth it.",2023-03-15T13:36:58Z,0
@naufalfadliamzar8364,Stay sih ngga ada upgrade yg signifikan,2023-03-15T17:55:35Z,0
@adiyputra94,Samsung a52s tetap juara midrange dari tahun 2021 sampai saat ini...sampai sekarang masih sulit membuat midrange gokil seperti a52s dan penerusnya cuma banyak penambahan aja gak ada peningkatan yang signifikan di kelas midrange.,2023-03-15T12:25:37Z,9
@ronnieleite2153,Setuju banget. mau upgrade di kelas yg sama (A5x) menurutku untuk 2/3 tahun ni ga worth it. Gitu juga di merk² lain. Mau upgrade ya sekalian naik level ke flagship biar kerasa bedanya,2023-03-15T13:16:06Z,0
@putrarr3824,"Betul, tapi kl upgrade dari J7Pro sih layak sperti saya wkwkwk",2024-11-14T02:08:09Z,0
@FatirRohman-o4m,Ttp KLH desain nya dan ukuran,2025-03-04T09:01:35Z,0
@dinosaputrasports3628,"Terimakasih jagat review, good job Samsung ❤❤",2023-03-15T12:25:17Z,0
@andrianpratama4307,Sama s21 fe gmn min,2023-03-15T12:25:11Z,0
@pemzz3853,"Apakah M52 ku sudah waktunya ganti?😅
Secara gk tau kenapa gua pake Genshin lowest 60 suhunya tembus 50°🥵, Btw itu genshin versi playstore di hp gua",2023-03-15T12:24:35Z,0
@tukangcatesbatu,Ngerasa bersyukur banget alhamdulillah pegang A52s 😂,2023-03-15T12:24:25Z,7
@Faaldey,"ibarat stat game , a52s 10 point statnya di up di STR yang lain ga dibagi , sedangkan ini dibagi rata , emg ini jadi minus sih buat gamer cm buat pemakaian sehari2 malah kadi plus",2023-03-24T10:08:50Z,1
@Mr_rdt,Nonton pke a73 5g,2023-03-15T12:22:57Z,0
@fads1,Salah fokus sama nama wifinya 😀,2023-03-15T12:22:53Z,0
@muhammadnurrozak9749,Produk Samsung semuanya terbaik 😂,2023-03-15T12:22:04Z,0
@arifkempul1165,Samsung Nge - GAS teruuusssss !!!!!!,2023-03-15T12:22:03Z,1
@rezzaesaputra1836,"Tetep a52s snapdragon 778G, masih dapet charger, masih ada audio jack, layar 120hz, ip67 juga",2023-03-15T12:21:55Z,5
@nonename1193,"50 50 lah seimbang, yg punya a52s mending up ke flagship, miris a53 nya .wkwk",2023-03-15T15:20:58Z,0
@mfais567,"Jack 3,5mm = lubang kebahagian,🤣",2023-03-15T17:42:00Z,1
@Xejo_,Exinos = Panas,2023-03-15T12:21:28Z,2
@Fluffie_offc,👍,2023-03-15T12:21:10Z,0
@Gnadad,Nungguin hp ini kalo udah sekend ajaas,2023-03-15T12:21:07Z,0
@aiurshoon1855,Kenapa sihh kok gaada charger terus yaa,2023-03-15T12:21:04Z,0
@wahids4354,"Bisa nih nyaingin vivo t1 5g, tapi sayang gak ada CHARGER",2023-03-15T12:20:32Z,0
@naufalfadliamzar8364,Harganya beda jauh tapi 😁,2023-03-15T18:06:15Z,0
@arisalfakri1506,Kapan bisa dibeli nih HP ?,2023-03-15T12:19:08Z,0
@hf8465,Ya harus meningkatlah om. Kalo gak ditngkat ya sama aj balik ke a53 5g🤣,2023-03-15T12:18:10Z,0
@rizkyhendrianto6563,kamera megapix ok turun tp sensornya naik dr sampel kelihatan bagus tajem ditambah looks depannya sexy melengkung tipis mskipun bezel tebel tinggal nunggu peformnya sih!,2023-03-15T12:17:44Z,0
@akagami.9383,Mas sumsang 🗿🤣🤣,2023-03-15T12:17:15Z,1
@nggoping9964,Udah bisa wireless charging belum ya teman2 ?,2023-03-15T12:16:53Z,0
@naufalfadliamzar8364,Belum ada wireless charging,2023-03-15T18:10:57Z,0
@Arifai_L-i2d,Yg ditunggu tunggu !,2023-03-15T12:16:47Z,0
@zidan6900,"Suka banget sama pengujian kamera oleh Chris, sangaaatt mendetail dan lengkap informasinya. Sangaaatt mantep 👍👍👍",2023-03-15T12:16:25Z,6
@zidan6900,Hal2 kecil aja bisa ketahuan sama chris. Brand auto ketar ketir kalau nyembunyiin sesuatu 😂,2023-03-15T12:17:28Z,3
@mrkipik6607,"Samsung a34 pakai dimensity 1080 lebih gahar dari exynos 1380 atau bahkan sd 778 ya bang?
Antutu nya tinggi bgt",2023-03-15T12:14:54Z,2
@muhsofiyan,Masih nonton di seri A 52 5G 😅...,2023-03-15T12:14:25Z,0
@ol.lddl_z,versus samsung galaxy s21 fe gimana ya ??,2023-03-15T12:14:04Z,0
@LENSABIRUPRADA,"ini lagi nabung buat beli s23 yg biasa, eh muncul a54, apa gua beli ini aja ya😂",2023-03-15T12:13:34Z,0
@hafidzahhumaira1580,Sangat cocok sekali.dgn gua.,2023-03-15T12:13:09Z,0
@dailyabundanceshorts,udah ada informasi pembelian & promo bundlingnya?,2023-03-15T12:12:53Z,0
@adrilovebrid262,Udh keluar di pasaran blm atau kapan:),2023-03-15T12:12:37Z,0
@mma3297,Sayang banget sih kalau video 1080p 60fpsnya EISnya ga aktif,2023-03-15T12:12:17Z,0
@sandoynelson,"Harga segini masuk mid-range?? Bgi gw ini high-range, wkwkwk",2023-03-15T12:11:50Z,0
@toto8665,"Untuk kamera, layar, body, dsb. Dah gak diragukan lagi lah ya, dah berasa flagship.. sayang di chipset doang sih kalo untuk gw.. kalo aja pake snap 870 atau dimensity 8100, ATAU kalo bisa pake 8 gen 1 baru mulai tertarik.. soalnya hp 778g aja udah pada mulai turun harga di 4-5 jutaan, dan gw rasa performa chipset nya masih lebih bagus 778g.. minimal 7 gen 1 atau 2 dah wkwkwk",2023-03-15T12:11:18Z,2
@sierra9609,"Xiaomi 12T dong, ada 120W Charger 🗿",2023-03-15T12:17:51Z,1
@anaskhoiri3653,One UI udah jadi mikir buat milih samsung apalagi orang yang produktif bakal pilik kamera apalagi 4Knya bikin jadi pertimbangan,2023-03-15T12:25:00Z,1
@toto8665,"@sierra9609 Xiaomi 12T iya sih bang secara performa jauh lebih kenceng, tapi untuk fitur, kamera, body A54 ini jauh lebih bagus.. jadi tergantung pemakaian aja, kalo mw performa untuk game dan gak pentingi kamera bisa pilih Xiaomi 12T, tapi kalau cuma buat pemakaian sehari2 kayak foto2, video2, nonton streaming, bisa pilih A54 ini.. nah yg gw pinginin performanya seperti 12T tapi dengan fitur kamera dan body seperti A54 dengan harga 6-7 jutaan...

Nah kayak ""dahlah kasih aja chipset 12T ke hp ini, pasti perfect di mid range killer""",2023-03-15T12:36:57Z,1
@toto8665,"Sejauh ini yg gw temuin ada di Xiaomi 12 dan Realme GT2 pro, performa sangat bagus 8 gen 1, kamera, body, dan fitur juga mumpuni, cuma sayang harganya masih di 8 jutaan dan juga itu hp keluaran tahun kemarin, berharap sih di 2023 ini ada hp yg sebagus itu tapi punya harga masih di 6-7 jtaan..  mentok2 ya harus nabung lagi, dan beli sekalian yg flagship😭😓",2023-03-15T12:41:53Z,2
@sierra9609,"@toto8665 ini 12T cuma dipake foto"" biasa sama kadang"" game doang sih
udah lumayan, bisa lah bertahan minimal 5thn (upgrade dari max pro m1 tahun 2017 😅)",2023-03-15T12:50:18Z,0
@suroso990-sc7fq,"Emang bagus sih samsung, tp rada was² mau beli samsung apalagi pernah pakai seri S beberapa kali dan penyakitnya sama layarnya shadow 😭
Pengalaman dari S 9-10",2023-03-15T12:10:36Z,0
@nazilahmarwiyah-ok9os,Dari video ini justru membuktikan bahwa a52s masih relevan sekali untuk dibeli dengan harga yang sudah turun byk,2023-03-15T12:10:28Z,1
@zidan6900,Hati2 backdoor renggang,2023-03-15T12:38:22Z,0
@mfais567,"@zidan6900 backdoor renggang bisa diperbaiki, klo hardware ga bisa😂",2023-03-15T17:46:59Z,0
@armandimban,Semoga samsung A54 ada update software untuk kestabilan video full HD 60 fps dan 4K (aktif EIS),2023-03-15T12:10:14Z,2
@zulham_fn3128,"Susah gk bakalan bs stabil klo urusan Software khusus kamera, itu sdh urusan Hardware nya di dlm brarti memang EISnya tdk aktif, cuma andelin embel"" OIS, coba anda bandingkan aja dgn MI 11T yg keluaran 2021 wlopun kameranya resolusi nya gk merata bs smpe 4K30fps khusus UW dan Depan dan tanpa embel"" OIS, tpi kamera video pada MI 11T mau yg Utama, UW, Depan semua Stabil parah, trus masih bs tetap aktifin fitur HDR utk video nya dan tetap smooth, lalu kamera yg org"" Bnyak anggap remeh yg Macronya, di MI 11T Tele Makro nya bahkan bs di pke bwat rekam video, di kelas harga sgini msih blm bnyak hp"" Andorid mid end bs stabil kek gini",2023-03-15T13:28:47Z,0
@ayuratna2726,Sekilas tampilannya mirip bgt sm s23 😢 sbg pengguna s23 cukup sedih sih,2023-03-15T12:10:14Z,0
@rahmalutfiatunnisa1953,"Sabar 
Aku pake samsung s22+

Malah di kata pake samsung s21fe sama orang",2023-03-15T12:42:24Z,0
@beelzebub.4427,"bosen miui dan yang udah biasa turbo charge 67watt mao migrasi ke samsung 25watt, pas ngecas berasa bat gak ya-_ kalo mao stay di miui up ke mi12t si😴",2023-03-15T12:09:27Z,0
@rhn2112,"Murah, dibanding brand sebelah yg pakai naga 695 di harga 6 jutaan",2023-03-15T12:09:24Z,1
@rahmalutfiatunnisa1953,"Wkwkwkwkw
Fakta banget",2023-03-15T12:40:12Z,0
@gandyoya3467,Hp mahal gak ada cargernya 😂🤣,2023-03-15T12:09:01Z,0
@andikapratama9475,"Hpnya salah satu yg terbaik diharganya, cuma chipset kurang bagus dan tidak dikasih charger.",2023-03-15T12:07:57Z,0
@bobbyleoananda7722,Performanya aja mendekati 778g ..g bagus dmn,2023-03-15T12:51:03Z,0
@reynaldi0215,"pak jagat review vivo v27, please...",2023-03-15T12:07:55Z,1
@kreatorDisabilitasTunaNetra,"Hhuuuuuuuuuuuuuuuuuuuu lagi lagi dan lagi itu kamera makro sampah di pasang lagi di situ 😭😭😭 kebanyakan orang minta lensa telephoto agar lebih berguna., Malah di kasih kamera sampah seperti itu 🙄🙄🙄🙄
Jadi makin sayang sama A72 ku ini soalnya ada lensa telefoto tiga kali optik ❤️ hasil foto dan video yang lebih nyaman di mata dan kualitas zoom lebih baik 😇😇😇",2023-03-15T12:06:50Z,1
@Stvnhaa,"Mantappp kalau om Ded sudah bersabda ini calon mid-range terbaik tahun ini, bungkus dah 1, warna violet nya kayaknya cakep",2023-03-15T12:06:31Z,1
@sariiiyok,apakah s21 fe akan lebih worth??,2023-03-15T12:06:17Z,0
@rahmalutfiatunnisa1953,"Boros tuh hp batrai samsung s21 fe
Lebih baik ambil samsung A73 atau s20fe itu pun kalo masih ada",2023-03-15T12:44:46Z,0
@bagassumunarjati4486,"menurut opimi saya, seri a50an paling terbaik sejauh ini masih dipegang seri a52s",2023-03-15T12:06:08Z,1
@royahmad582,Btl,2023-03-15T19:02:04Z,0
@taufikhidayat7194,Jelek amat bentuknya 😂,2023-03-15T12:06:01Z,0
@ahmedtok1866,Bazel sama bingkainya hmmm.. kelihatan sprti hp jadul 😔,2023-03-15T12:05:56Z,0
@silveron19,Knp ya display output tidak bisa di hp mid? A8+ (2018) punya ku bisa. Ada yang bisa jelaskan?,2023-03-15T12:05:33Z,1
@hasanhaiq,"sebagai pengguna POCO X3 NFC jujur gw resah sih.. soalnya nyari penggantinya belum nemu lawan yg sepadan, bahkan gw udah siapin modal 2x lipat dari harga ini hape tapi belum ada nih duh resah bgt gw.",2023-03-15T12:05:32Z,0
@Maseeme,"Buat apa ada 4K 30 kalo ujung²nya ga kepake? Pertanyaannya siapa yang mau make 4k 30 tapi kga stabil? Kebanyakan orang lebih milih pake 1080 60/30 fps tapi stabil timbang pake 4k tapi ga stabil.

Newbie mau bertanya, apakah ada yang mau oake 4k 30 dengan kualitas video yang ga stabil untuk daily atau buat konten gitu? Kalo ada coba jawab dan jelaskan kenapanya.",2023-03-15T12:05:22Z,1
@vreyza,"Pakai tripod lah, emang semua konten perlu sambil jalan-jalan",2023-03-15T12:07:17Z,2
@Maseeme,@vreyza lah kan divideo compare a52 sama a54 pake tripod bwang.,2023-03-15T12:40:05Z,0
@Maseeme,@vreyza kan kebanyakan konten sambil jalan,2023-03-15T12:40:22Z,0
@Maseeme,"@vreyza hp lu ada 4k? Lu pake ga? Gw tanya ke user yang pake aja bang, kalo ga pake ga relevan jawabannya.",2023-03-15T12:41:23Z,0
@vreyza,"@Maseeme tripod buat ditaro doang maksudnya, bukan dibawa jalan.

hp gw kaga ada 4k, hp dari 5 tahun lalu mentoknya di 1080p itupun burik, tapi sering gw pake bikin konten yg kaga sambil jalan2.

Jadi apakah 4k tanpa stabilisasi kepake buat gw? Iya kepake, nanti pas gw udah punya hpnya.",2023-03-15T13:37:20Z,0
@andrear8540,keren bgtsih ini,2023-03-15T12:05:21Z,0
@kemontolpol,M I C R O S D 👌🏼,2023-03-15T12:05:08Z,0
@botshopee8141,"Exynos, skip",2023-03-15T12:04:41Z,0
@mandraguna1239,Info kipas pendingin hp nya dong om 👀,2023-03-15T12:04:23Z,0
@ridwan_tricks,1:50 Lemes Coy🤣,2023-03-15T12:04:17Z,0
@tosmaster9888,Sudah mahal tebel lagi.. HP atau bata pea,2023-03-15T12:03:35Z,0
@Razz34579,"design nya sih yg upgrade banget, cakep amat, kegoda buat upgrade dari a52s, wkwkwk",2023-03-15T12:03:20Z,0
@surotosuroto4717,Nunggu  Samsung yg A74 5G,2023-03-15T12:03:17Z,0
@kemalnugraha190,"A73 user disini, saya bersyukur A73 masih jauh lebih bagus, buktikan sendiri, enak banget pake A73",2023-03-15T12:03:17Z,1
@sahatasido9811,"Hadirr 👋🏻 
Asli enak bgt pake A73 secara udah chipset snapdragon 778G",2023-03-15T13:37:27Z,1
@prince_rv,a73 rilis tahun brp? harga pasaran sekarang brp?,2023-03-15T13:37:29Z,0
@kemalnugraha190,"@prince_rv April 2022, harganya sekarang 7,7 juta klo beli di Samsung experience store di mall2, kalo di marketplace ada yg jual 6,8 jutaan",2023-03-15T16:30:41Z,0
@akasyahm__,Lah di sy ko cuma item doang videonya,2023-03-15T12:03:13Z,0
@mvdrix902,"Mau tanya, kipas yg dipake gaming itu merknya apa?!",2023-03-15T12:02:49Z,0
@van0076,"Kipas angin wadesta bisa nempel di dinding, bisa berdiri, bisa di mana aja",2023-03-16T08:58:49Z,0
@maoukontoru,"Kalo untuk Harga 6,5an mungkin masih Terbaik ambil Mi12T yg dari spek sudah sangadd Mumpuni hehe :)",2023-03-15T12:02:47Z,4
@toto8665,"Tergantung sih bang, kalo incer performa ambil mi 12T, tapi kalo incer kamera, body, layar, fitur yang lebih mendekati ke flagship, bisa ambil ini hp.. gw juga rada serek sih sama chipsetnya A54 ini, padahal kalo pake S870 atau D8100, atau minimal 7 gen 1 atau 2.. mungkin bakal gw ambil ini HP, tapi dengan kemampuan chipset kek gini, kayaknya cuma buat dipakai normal keseharian doang kayak foto2, video2, nonton streaming.. tapi klo buat game2 berat masih belum kuat, klo game ringan mungkin masih bisa wkwkw",2023-03-15T12:23:12Z,1
@maoukontoru,"@toto8665 nah makanya itu bang ane kamera paling buat foto vidio pas jalan"" ga sesering dan daily ngagame yg sering juga dan layar pun udh oke enak makanya harga segitu prefer Mi12T, kalo pake D8100 bisa"" harga 7 an lebih , mungkin kalo SD870 bisalah 6,5an",2023-03-15T12:44:09Z,0
@toto8665,"@maoukontoru nah iya, kalaupun harganya 7jt tapi chipsetnya diganti D8100 kayaknya masih worth it banget ini hp.. kayak tanggung banget napa, hp pake S778g aja udah pada turun harga di 4-5jtaan, dan performanya pun gw rasa bagusan 778g dibanding ini.. soalnya gw juga rada skeptis sama soc Exynos, iya sih ini chipset stabil, tapi performanya suka dilimit parah, dan lumayan panas juga (chipset2 buatan Samsung entah kenapa selalu suhunya tinggi2).. jadi kalo Samsung bilang ""Chipset ini setara dengan chipset ini"" suka gak percaya, dan kenyataannya suka tidak karena performanya yg selalu dilimit.. udah dilimit tapi masih panas kan kocak",2023-03-15T12:54:20Z,0
@maoukontoru,"@toto8665 wkwk nanggung makanyaa di soc nya ,harga segitu soc nya rentang harga 5 jt an",2023-03-15T13:10:27Z,0
@muhamaddwikyt4992,"Kalau Redmi note 12 pro plus 5G udah keluar di indo,
Mending A54 ini atau rednote 12 pro plus ?",2023-03-15T12:02:43Z,0
@van0076,"Kalu mau bandingin mending samsung a54 lah, dari pada resmi 12pro, tapi kalu kamu pencinta xiomi, gw saranin xiomi 12T dia bagus banget di kelas harga 6jtan",2023-03-16T08:56:52Z,0
@hopypeony5529,Bagusan ini atau s21 fe yaaa?,2023-03-15T12:02:01Z,0
@okkie719,A34 nya ditunggu pak,2023-03-15T12:01:35Z,0
@yudhosandy,masih sedih sebagai pengguna a53 gabisa play youtube 4k:'),2023-03-15T12:01:32Z,0
@namhyeongkimmm,"Saran : klo review ponsel dengan accelerometer dan gyroscope, tolong masukkan game Pokemon GO sebagai game untuk di benchmark karena game tsb cukup akurat.",2023-03-15T12:01:19Z,0
@mrbobgamingmemes9558,Yang main jarang banget sekarang,2023-03-15T23:27:08Z,0
@namhyeongkimmm,"@mrbobgamingmemes9558 Ya tapi sepertinya itu game memang cocok sih buat tes accelerometer dan gyroscope, sekalipun memang dah jarang yg main.",2023-03-16T07:37:06Z,0
@mrbobgamingmemes9558,@namhyeongkimmm bukannya acceleromater bisa di tes di game balapan ? Gyroscope mah di tes di game fps atau tps bisa,2023-03-16T09:33:20Z,0
@harryagungf26,Review dan conclusionnya selalu bisa dijadikan pertimbangan ketika pas lagi pengen cari hape baru. Mantaappp JAGAT REVIEW semangat dan sukses selalu channelnya.,2023-03-15T12:01:11Z,4
@lu-knight9800,"Kayanya A52s bisa jadi kesalahan terbaik yang pernah samsung bikin, baik buat konsumen, tapi jadi batu sandungan yang tinggi buat perkembangan seri A5 nya samsung",2023-03-15T12:01:07Z,1
@zidan6900,"S20 fe, m23 juga. S20 fe 3 tahun berturut-turut loh masuk video rekomendasi jagat review, total masuk 6 video rekomendasi. Rekor banget itu, a52s ga bisa lawan",2023-03-15T12:40:24Z,0
@lu-knight9800,"@zidan6900 s20fe rilis nya 2020 klo a52s 5g 2021, ya kali mau masuk rekomendasi 3 tahun berturut-turut, ditambah s20fe itu secara segment pasar dan harga ya udh beda banget, jadi ga bisa dibandingin",2023-03-15T12:47:12Z,0
