author,comment,publishedAt,likeCount
@andiyoshitaka880,"saya harap ada lini poco yang lebih ngasih kestabilan daripada melulu soal performa, spek bisa diturunin dikit tapi super stabil dari segi performa, kamera bahkan suhu hp nya sendiri.",2025-06-27T04:57:58Z,2
@ReyNZ_0,"Lah, poco kan di fokusin xiaomi buat performa. Kalau gk ya cari yang xiaomi lah bang😂",2025-06-27T05:16:23Z,0
@Kevin-ky8fn,"Dulu ada di poco X5 pro tapi ya begitu fansnya doyan spek rata kanan urusan fps naik turun, suhu panas bodo amat dengan senjata andalan semua masalah bisa diselesaikan pakai cooler 😂🤣

Itulah kenapa saya lebih prefer ambil iqoo Z9, saudara ambil X6 pro duluan lalu saya tanya daily aja bisa hangat akhirnya mutusin ambil Z9 karena HP sebelumnya GT me dan sudah nyaman dengan suhu ademnya.",2025-06-27T05:55:18Z,0
@maulanasaputra6839,Keren sih performance nya sadis tapi udah tua jenuh main game sekarang nyaman make iPhone😁,2025-06-27T04:57:53Z,0
@pastiok3926,Masih enakan mi 10 5g,2025-06-27T04:57:33Z,0
@syahiradonghua,waaah murah banget😂😂😂,2025-06-27T04:57:14Z,0
@m.y.b.handri5892,Auto CO setelah gadgetin ngereview. Belum afdol klo belum dengerin review dari gadgetin. Jadi makin yakin untuk milikin Poco F7 5G,2025-06-27T04:56:44Z,0
@jangkrikbos5827,Bg please review hp Tecno pova 7,2025-06-27T04:56:37Z,1
@januarsabar1680,"Baru selesai order, semoga.poco  F7 ini jadi gadget yg awet buat saya",2025-06-27T04:56:06Z,0
@mohapepn.a,gak review speakernya nih😊,2025-06-27T04:55:34Z,0
@akmalaarif,sedang nonton video ini dgn Poco F7 😊,2025-06-27T04:55:29Z,0
@Wahyuhidayat-xy2py,Bang bahas reuni coba 7 dong,2025-06-27T04:54:51Z,0
@kandyyyies,Rada nyesel dikit beli x7p. Bukan karena hpnya jelek tapi harga beda dikit ama f7 🥲,2025-06-27T04:54:26Z,0
@GunDeblis,"Betul beda dikit performance tinggi wkwk menyesal wkwk 
Ga lagi2 dah beli X series mending F series aja 🤣",2025-06-27T04:56:05Z,0
@stephanobaharudin9546,B AJA GAK ADA YG SPESIAL,2025-06-27T04:54:20Z,0
@261Production,"dulu iya gw pemuja hp gaming,,tapi makin dewasa lebih suka yg nyaman di pakai software jelas , ui nyaman simpel",2025-06-27T04:52:08Z,1
@miftakhulfarid9998,U.i poco ampas y?,2025-06-27T05:41:54Z,0
@261Production,tau sendiri lah keluarga Mi​@miftakhulfarid9998,2025-06-27T05:44:23Z,1
@CA_fiveleafclover,Asik ya nontonin 2 rival ini,2025-06-27T04:51:57Z,0
@Krisdian782,Poco F7 😮,2025-06-27T04:51:38Z,0
@zawx_adtya,review Tecno pova 7 min david 🎉❤❤,2025-06-27T04:51:29Z,3
@Masmin409,Mantaplah,2025-06-27T04:51:17Z,0
@leewalker23,Raja Iklan,2025-06-27T04:51:03Z,0
@eko5060,POCO F1 PUNYA SAYA AWET SAMPAI SEKARANG 🤣😂😂,2025-06-27T04:50:53Z,0
@sinuratbretohang7271,Ganteng kameranya ntah kapan bisa beli ini,2025-06-27T04:50:28Z,0
@bangbolle7186,Bg bahas XPAD Infinix dong...,2025-06-27T04:50:09Z,0
@ZULKARNAEN-sr,"Badingin sama Vivo v50, manang yg mana...?",2025-06-27T04:49:56Z,0
@sakirikawaii8442,bang review mainnya wuthering waves,2025-06-27T04:49:55Z,0
@cgrgemingcahgantengraketul3652,Raja gk punya L trigger😂,2025-06-27T04:49:50Z,0
@isemjeneh5961,Dari semua reviewer yg ada tetap king David yg paling ditunggu 😂🎉,2025-06-27T04:49:50Z,1
@261Production,"admin poco itu org nya ke panasan gitu ya😂

samsung aja di roasting abis""an,tapi admin samsung adem ayem aja😅😅",2025-06-27T04:49:16Z,1
@JakfarAlfarisi,"Iya,,sama spt hpnya panasss😅😅",2025-06-27T06:29:30Z,0
@MAMANFIRMANSYAH-q1v,"Nonton ini pakek poco f3 dari awal rilis masih enak aja,cuman batrai udh prnah gnti",2025-06-27T04:48:50Z,0
@nyantama5039,Bangga nya nonton video ini di POCO F3 tercintaku,2025-06-27T04:48:13Z,0
@Expada21,Info hp budget 4-5 jt yg kamera bagus,2025-06-27T04:47:57Z,0
@khoirulhuda849,Ana rega ana rupa,2025-06-27T04:47:29Z,0
@Vagabond244,"Pernah pake seri F3 dan F4 makin kesini tanpa liat review untuk serinya POCO yang ""F"" ini rekomendasi yang aman untuk kebanyakan orang sih,  valuenya makin kesini juga tetep dijaga, good job deh buat POCO 🥰👍",2025-06-27T04:47:18Z,0
@ricardopurba4272,"Yang lain ganas 🔥🔥
Mr Samsung santai 👍😉

Nunggu kejutan Samsung lagi ini 
Mana tau kluar a57 😅",2025-06-27T04:46:41Z,1
@raihanhavilah1758,"2:17 finally poco F7 make back cover glass lagi setelah dari seri Poco F2 Pro, F3, F4 terus frame nya make metal juga kayak Poco F2 Pro",2025-06-27T04:46:26Z,26
@ProGamer-y2s,"Alhamdulillah
Akhir ny upgrade dri hp Smsng a50 4/128 ke poco f7 ini.",2025-06-27T04:46:14Z,0
@Sarsal27,"iqoo paling ampas di stabilisasi video kamera depan, bahkan sekelas v50 (yg ceritanya mid range ngandelin kamera) stabilisasinya ampas semua",2025-06-27T04:45:57Z,0
@soniaw8038,Kenapa yah gapernah test pubg,2025-06-27T04:45:52Z,0
@ST4LECAKE,"hp saya back covernya pake plastik harganya 12jt, hp apakah itu??😂",2025-06-27T04:45:44Z,0
@silentchanel01,"Lagi lagi jekphone audio gak ada,, 😂😂😂😂
Nunggu seri f8/9 siapa tau ada jekphon audio nya... Smoga.",2025-06-27T04:45:33Z,0
@febribaskoro,"Masih nyaman pakai X6 Pro, kekurangan kalau overheat kadang ke log out sendiri",2025-06-27T04:45:09Z,0
@sigitlaksana5044,Pova 7 min,2025-06-27T04:44:44Z,0
@AhongEfb,"aku baru tw , sepertinya poco f7 ga mau kasih ram 8/256 karena takut performanya menurun , ntar takut di kritik wkwkw",2025-06-27T04:44:17Z,0
@xevgg,Gw yg nonton pake iqoo neo 10 = 😂,2025-06-27T04:44:12Z,0
@robileonardo3950,Senggol donggg😂,2025-06-27T04:43:55Z,0
@nmtajh,"Request game bang, misal genshin dan wuwa lancar gak begitu panas. Tolong cobain zzz",2025-06-27T04:43:49Z,0
@irfan_1361,mode bantai bantai iqoo,2025-06-27T04:43:36Z,0
@KaisarGamingYT,"Bukannya 6,5 ya",2025-06-27T04:43:34Z,1
@ToniSantoso-g5y,Coba test DF mobile bang,2025-06-27T04:43:24Z,0
@noobmaster4852,"Akhirnya muncul jg , kalo belum dibongkar total di mari serasa belum yakin mau ambil atau tidak !!!

😁😁😁",2025-06-27T04:43:09Z,0
@ukieok,Oke juga nih hp,2025-06-27T04:43:06Z,0
@Gokboruid,Masih dengan Poco F1 sang sepuh❤,2025-06-27T04:42:32Z,0
@Gokboruid,Nontonin adek-adek yang udah pada gede dan lahir😂,2025-06-27T04:43:06Z,0
@AlifLEARZYy,Tecno pova 7 bang coba bahas 😅,2025-06-27T04:42:17Z,1
@Batto-762,"Lah, kok ga review speakernya ?",2025-06-27T04:42:02Z,0
@sepenggalfilm5479,saat foto bisa nangkep objek gerak gak bang,2025-06-27T04:40:55Z,0
@N_Felss,Compare sama Iqoo yg harga nya sama bg,2025-06-27T04:40:51Z,0
@AriefGYT,"Alhamdulillah Saya pakai Realme 7 dari 2020 sampai sekarang masih lancar, ada rencana pengen ganti HP baru, masih ngumpulin Budget 😊 Infinix GT 30 PRO atau ada saran lain di bawah 4 jt?",2025-06-27T04:40:47Z,0
@damdwsb,unboxing nya ga ada kah?,2025-06-27T04:40:27Z,0
@poslajumlbb3557,min nk tanya lagi bagus infinix 30 gt ato poco 7?,2025-06-27T04:40:19Z,0
@RohmanBaghir,"telat 2hari gk ngaruhh lah? tetap di tungguin review nya.
toh samsung a56 yg kebeli 2bln lalu gk bikin kcewa.",2025-06-27T04:40:15Z,0
@Katou-sama,Gk ada iklan brok. Kayanya seri f sekarang udah tanpa iklan.,2025-06-27T04:38:40Z,0
@antoremote,"Ga sabar nih, upgrade dari poco 3 ke f 7. Barang msh otw..",2025-06-27T04:38:24Z,0
@abangkhoirul4909,"Ga pernah kecewa pakai Poco. Dari f1 dan f5 kualitas puas, harga pas. Semoga ada rezeki buat upgrade 😁",2025-06-27T04:38:01Z,0
@baakatensai,keknya logo snapdragon dibelakangnya itu yg bisa bikin Poco neken harga sampe segitu.,2025-06-27T04:37:50Z,0
@agattudemahengwiliwongko7964,Bangg yang F7 Pro gaming tess flll,2025-06-27T04:37:46Z,0
@MichaelAlexia-m6h,2 jam yang lalu😂,2025-06-27T04:37:45Z,0
@kakhearancia,Akhirnya yang ditunggu2 direview juga,2025-06-27T04:37:23Z,0
@dhoridho262,klo di bandingin sama poco f7 pro bagus mana?,2025-06-27T04:36:53Z,0
@aditepep1132,bang Tecno pova 7 bang,2025-06-27T04:36:41Z,0
@zaidannaufalll,🔥🔥🔥,2025-06-27T04:36:38Z,0
@wahidramdhani9927,Main ff lancar ga bang,2025-06-27T04:36:06Z,0
@soul_mi1862,Terus nasib Redmi Turbo 4 Pro bakal dirilis jadi apa? Katanya jadi Poco F7,2025-06-27T04:35:37Z,0
@4n0m4L1Gg,tecno pova 7 bg vortit ga dgn harga segitu?,2025-06-27T04:35:31Z,1
@juarnovandega1008,Dilabeli raja tapii waktu tes 3d Mark langsung overheat 51 derajat sampe forclose,2025-06-27T04:35:23Z,0
@AbdulHakim-Nmray3,Mudahan bisa kebeli buat bikin konten ojol,2025-06-27T04:35:17Z,0
@yusnaningsih9096,"Kak kalau untuk live sama bikin vidio itu cocoknya Vivo v50 lite apa poco f7,, tolong kasih tau solusinya kak",2025-06-27T04:35:08Z,0
@DianaDiana-m4c7f,Simpel vivo kamera poco performa,2025-06-27T07:57:20Z,0
@dekymardiansyah3302,"Kelemahan yg paling menonjol dan jadi pertimbangan antara poco dan neo 10 ya kalau di poco cuman di kapasitas battre aja dikit sama gak ada fitur bypas char ,,sedangkan di iqoo storage nya yg nangung 256,,tapi kalau se andai nya poco f7 iklan nya udah hilang permanen wah kelemahan yg saya sebut tadi gak akan jadi masalah lgsg aja sikat,,karena kebetulan udah nyaman di ekosistem poco kecuali iklan nya yg blm bisa di terima sampe skrg😂",2025-06-27T04:35:04Z,0
@_ownersiwhite,redmi turbo 4 pro itu😁,2025-06-27T04:34:45Z,0
@soul_mi1862,Kok beda Poco F7 yang ne sama yang di rumorkan. Katanya Redmi Turbo 4 bakal di rilis jadi Poco F7. 😂😂😂😂😂😂,2025-06-27T04:34:20Z,0
@soul_mi1862,Kok beda Poco F7 yang ne sama yang di rumorkan. Katanya Redmi Turbo 4 bakal di rilis jadi Poco F7. 😂😂😂😂😂😂,2025-06-27T04:33:55Z,0
@yonisahroni-e2o,"Setelah menonton video ini dari awal sampai akhir, akhirnya saya jadi beli A56. ✌",2025-06-27T04:33:02Z,0
@rolisbkl6481,Tidak bisa pake ear phone y bang,2025-06-27T04:32:38Z,0
@andarestoge,Masih dengan huawei mate 20 pro 😂😢,2025-06-27T04:32:27Z,0
@WildanRealHere,Ketika dah punya series f6 eh tiba2 update wah cepet banget ya poco update hp mah,2025-06-27T04:32:16Z,0
@andriansyahismail5141,Infinix gt 30 pro menurut kalian gimana?,2025-06-27T04:32:14Z,0
@bimawaey1395,Tecno pova 7 ultra 5g min,2025-06-27T04:31:34Z,0
@teguhyudonoadi3329,"Mengapa layarnya cuma mendapat nilai B saja bila dibandingkan dengan merk saingan lainnya?
Kekurangannya apa?
Seharusnya bagaimana?
Tertarik ingin beli si, jadi tolong dijawab",2025-06-27T04:31:24Z,0
@ranggaputru9493,Bang itu harus mode game turbo soalnya ada fitur fps unlock jadi bisa 120fps buat game yang hanya 60fps,2025-06-27T04:31:19Z,0
@MEmeuniverse-i7e,"Dah paling benar mediatek ""dimensity"" 🤡",2025-06-27T04:30:41Z,0
@ArzhiNgopreks,"Gw akuin yg ini keren sih designnya, cuma berharap pake snapdragon 8 elite wkwkw",2025-06-27T04:30:25Z,0
@francoismusic_,Video kamera belakang nya cakep bener oy😂,2025-06-27T04:29:55Z,0
@yoosanzy,"Di kala hp rilisan sekarang, gue masih pake xiaomi 12 lite 😂 , tp setelah ngeliat poco f7 wah gila, jd wishlist gue ini kayaknya",2025-06-27T04:29:27Z,0
@nasikucing5695,"O segitu aja.
Kemudian overheat terus matot 🫵🏼😂",2025-06-27T04:28:40Z,0
@cakilham6532,Infrared blaster nya di bagian mana ya ?,2025-06-27T04:28:20Z,0
@Boy-q7s6s,Bang buat video perbandingan antara hp 4-7 jutaan yang bagus kamera dan buat game berat. Di utamakan untuk game berat,2025-06-27T04:28:06Z,0
@KurniawanSubuh-oy3xk,Redmi turbo 4 pro,2025-06-27T04:27:49Z,0
@plaudpaudd601,Apa cuma gw yg blom genti hp sudah 8taun 🎉,2025-06-27T04:26:50Z,0
@anr9171,iya lo doang 😢,2025-06-27T04:28:38Z,0
@nugienoegroholic9657,"Kepikiran kalo ada seri POCO X7 COMPACT yg ga bongsor namun ttp dgn spek performance, kayaknya bakalan jadi hp all rounded kekinian",2025-06-27T04:25:56Z,0
@ys_official08,"Chipset flagship, IP68, frame metal, harga cuma 5jt an 🥶",2025-06-27T04:25:54Z,0
@himmel197,Poco f7 ini sama infinix gt 30 bagusan mana ngab bimbang gini oii,2025-06-27T04:25:47Z,0
@RaffasyaWanusuki,Tecno pova 7 bg,2025-06-27T04:25:13Z,0
@KadekYoga-gd5zz,David tolong review tecno spark go1 hp 900k😢,2025-06-27T04:25:11Z,1
@isagi_yoichi-01,"Buat bapa2 zamn now di harga 5 jutaan,,bukn fokus game,,, pilihan ad di Moto edge 60fusion, samsung a56 ,Vivo V50, xiaomi 14T, dan masih nunggu Honor 400 nongol,, 😅 lumayan allround di harganya,, game oke lah tipis2.",2025-06-27T04:24:46Z,0
@nyiknyorvictor3857,"Sipp, semangat nabung buat upgrade smartphone ke POCO F7 dari Oppo A96",2025-06-27T04:24:28Z,0
@urjarrrr,"males beli f7, nabung buat beli f8 aja lah. soalnya klo beli F7 pasti ga lama lgi f8 keluar. ini aja blm lama baru beli F6, keluar F7 jdi rada nyesel buru2 beli F6, mana harga ga jauh beda 😂",2025-06-27T04:24:18Z,0
@netizensmartdanbijak7922,"Mg bahasa juga realme Gt7 T , yg baru launching👍",2025-06-27T04:23:01Z,1
@ezrauntoro524,Motorola  masih enak Motorola edge 60 fisieon,2025-06-27T04:22:58Z,0
@dimasafian3671,tinggal tunggu aja tar juga  sama kya kasus poco x3pro 🤣,2025-06-27T04:22:41Z,0
@Doge84045,"Udh hijrah dri poco ke xiaomi gegara kebutuhan demen foto""+video cinem, disatu sisi gw ttp demen juga chipset flagship ciri khas hp performa, pas awal tahun gw dari poco f3 hijrah up ke 14tpro asli gahar all sektor, foto""+video cinem gass, ngegame ratakanan libass🗿",2025-06-27T04:22:31Z,93
@bis.Boss20,tpi sayang chipset mediatek kurang gahar buat main game emulator kaya winlator,2025-06-27T15:09:37Z,1
@mavis.vermillion.v,@bis.Boss20 tinggal ambil seri 14 nya udh jelas gahar 8 gen3😂,2025-06-27T15:37:54Z,3
@Doge84045,"​​​@bis.Boss20bukan kurang gahar tpi faktanya kaga ada developer emu yg bisa ngoptimalin mediatek gegara mediatek msih di close source ama arm, kalau incer emulator doang cari iqoo 13 atau gk red magic terbaru yg rumornya punya emulator tersendiri",2025-06-27T15:52:41Z,0
@empritafrika123,"Saya dr F3 ganti Xiaomi 14 baru
Lalu saya kasih ke istri dan saya upgrade Vivo x200 pro",2025-06-27T20:56:57Z,1
@_____1826,​@empritafrika123 orang kaya 😁,2025-06-28T00:44:37Z,0
@zabotase9147,"buat anak"" muda,, yg mulai kerja keras udah lama berubah , dulu milih performance sekarang condong camera",2025-06-27T04:22:11Z,0
@Seneng_Bareng99,Saya masi nonton pakai Poco f4 😂,2025-06-27T04:21:51Z,0
@APAPRA,Nah sekarang compare Iqoo Neo 10 vs Poco F7,2025-06-27T04:21:29Z,0
@MadaTuemu,Kali ini Poco benar2 memasak,2025-06-27T04:21:04Z,0
@jumadiakbar45,Bang nggak nge review senter lagi bang?,2025-06-27T04:20:19Z,0
@KLIWON-mc1fw,"ogitu doang, blm by fast charge. 😂😂",2025-06-27T04:19:51Z,0
@Kaburi90,"Lagi cari²  hp yg standart militer.. capek ganti lcd karena jatuh ga sengaja ke4xnya ganti lcd..😢.. infonya teman²,thx..",2025-06-27T04:19:11Z,0
@NVK-22,"Kalau kedepannya masih gk ada iklan , fix laku keras",2025-06-27T04:18:51Z,6
@arkaseptianto3914,"ttep bkal ada... yg bkin hp poco lebih murah dari kompetitor lain krn ada iklanya
klo iklanya d hpus hrga psti naik
ente coba cari di hrga segitu trus dpet value yg bnyak bget,, cba compare sma brand lain ada ga d hrga segitu dpet value yg sama",2025-06-27T05:48:26Z,2
@sarsanah,"Iklan g ngaruh buat user Xiaomi,yg brisik itu orang bukan user Xiaomi d kira kyk iklan mengganggu wkwk",2025-06-27T07:43:23Z,2
@bmmusic6690,Iklan? Gw make f5 sama f6 sampe sekarang gada iklan samsek🤔,2025-06-27T08:19:48Z,0
@arkaseptianto3914,"​@sarsanah klo gw dri awal emng dh pke xiaomi.. dari xiaomi redmi note 5 smpe skrg note 13
iklan ga mslah si krn mgkin udh terbiasa😂
tapi bisa di ilangin jga kok iklan nya.. lgi itu jga iklanya cma dri aplikasi bawaan doang",2025-06-27T08:22:12Z,0
@AryoSeto,"Gw bingung yg dibilang banyak iklan gimana sih maksudnya? kayanya selama ini pake hp xiaomi buat whatsapp, foto, game, nonton streaming sama social media ga pernah nongol iklan dari bawaan hpnya, wkwk",2025-06-27T09:22:34Z,0
@ariefcell7169,semoga bukan q manusia terakhir dibumi yg gak pweduli dengan hasil benchmarknya NOL sskalipun😂,2025-06-27T04:18:08Z,0
@rizqifauzi7426,Tecno camon 🔥,2025-06-27T04:17:55Z,0
@Gaming93-y9l,Ini di adu sama iphone 13 pun jauh menang poco f7 kemna mana .,2025-06-27T04:17:52Z,0
@aancoco9058,"F7 memang sadis sih spek dgn harganya... Ga ada lawan..
Bahkan lebih worth it F7 dibanding versi pro & ultranya..",2025-06-27T04:17:42Z,0
@YusufHamzah-xx9ue,Bang kapan riview tecno pova 7 ?,2025-06-27T04:17:04Z,1
@megaaziib,"baru aja beli poco f6 tahun ini, jadi ntar dulu deh.",2025-06-27T04:16:59Z,0
@MuhammadHarun0000,"Yg make f4-f5 aja masih santai 😅
Buat ngegame foto masih okay, gak ngedet ngedet",2025-06-27T07:45:20Z,0
@bmmusic6690,Dah mending f6 ada bypass charging nya gw make jg soalnya cuman minusnya di f6 baterainya boros bangett anj,2025-06-27T08:23:07Z,0
@fernadowijaya1457,"Baru ganti ini gantiin pemakaian 5 tahun Redmi Note 9 pro max...

Kesan pemakaian awal pakai Poco F7... SANGAT PUASSSS!!!",2025-06-27T04:16:53Z,0
@GarethBale-in9nb,Kalau hp panas tenang tinggal celup dalam air langsung dingin..,2025-06-27T04:16:43Z,0
@indravenia,"dari awal tahun 2021 sampe maret 2025 pake hp poco f2 pro. performa buat game masih lancar jaya, ga matot, ga pernah service apapun dan akhirnya sekarang cuma jadi kenangan karena dah dijual cuma laku 2,5 juta wkwkwk emang gg sih ini series poco",2025-06-27T04:16:35Z,86
@iamsyarief_h,Dulu awal beli berapa bang,2025-06-27T10:45:41Z,4
@svd355,"F2 Pro emang gahar banget, SD865 yg sangat efisien plus cooling solution nya yg bagus bener bisa ngangkat performanya sampai 100%. Bahkan kalo nekat bisa di overclock tu 865 GPU nya biar bisa sekelas 870 dan masih cukup stabil walaupun udah kerasa panasnya, pake konabess dulu wkwkwk",2025-06-27T11:10:38Z,6
@wahyubaguslelana7430,msih pakai buat main game,2025-06-29T05:37:03Z,3
@indravenia,"​@svd355betul, hp jadul tapi spek masih mumpuni di tahun ini",2025-06-29T07:19:34Z,0
@robertdavitson7350,"Wah sama, masih stay di Poco F3",2025-07-01T05:14:41Z,2
@irfandefan8437,11:39 “Aura Raja Emang Sadis” 😊,2025-06-27T04:16:15Z,485
@ImamVerald-om6iq,wow,2025-06-28T16:44:17Z,5
@oxeanic_pubg,😮,2025-06-29T05:03:08Z,4
@andika-r1z,11:38,2025-09-30T13:06:58Z,3
@ZainalPinim1990,mendin ini dari pada samsung a56😂,2025-06-27T04:16:03Z,0
@agusthus8147,"baru kali ini saya lihat review bang david g test sound musik....
apakah hpnya wow  tp B aja....",2025-06-27T04:16:00Z,0
@SonGoku-rf3qz,Seandainya di harga 3jt ... 😢,2025-06-27T04:15:00Z,0
@blackjack3986,Samsung a56 udah jadi taii inii,2025-06-27T04:14:50Z,0
@widyasentono6862,Bang Sampe Hari ini Video lu tayang Harga POCO F7 Sudah di Rp.6.5jt di POCO OFFICIAL STORE bukan 5.5jt,2025-06-27T04:14:29Z,0
@kospribadi1,Harga pasaran?,2025-06-27T04:14:11Z,0
@EkinCheung-s3c,yg tangannya berasa kecil ngegenggam hp ukuran segini pake nokia 3310 aja udh dijamin 1 tangan kegenggam dan ngetik lancar,2025-06-27T04:13:54Z,0
@riaadinata3313,Nonton pakai device poco f3,2025-06-27T04:13:04Z,0
@backtopurrrfectagain6681,"Aduh, gak sukanya layarnya lebih gede. Disakuin dicelana jadi ngeganjel, terlebih pas berkendara. Takut tiba-tiba merosot jatuh dari saku celana. 😅
Mana lebih berat pula, lebih sreg yang kayak F6. Ukurannya compact, baik pas disakuin atau pas digenggam.",2025-06-27T04:12:45Z,0
@RoniRamadani-f2j,review tecno pova 7,2025-06-27T04:12:15Z,0
@sofiantoiyan6588,"Sharp Aquos sense 9 pliss, harga udah turun jauh, 🙏",2025-06-27T04:12:09Z,2
@Hikaru-Kamiki-Oshi-No-Ko,"Akhirnya Review Yg tidak ditunggu-tunggu 
Gk Jadi Nonton Karena Gk Butuh

IQOO 10 Neo adalah Juaranya",2025-06-27T04:11:40Z,0
@haidark4911,Jagoan selalu datang belakangan,2025-06-27T04:11:38Z,0
@d_artagan9480,lama bgt bang dapit,2025-06-27T04:11:17Z,0
@Aginkcalb,"Tolong bang tambahin efootball pas tes game,tuh game pas gw mainin langsung cosplay setrika hp gw",2025-06-27T04:11:14Z,0
@LaurielAOV566,PLSS BUAT POCO SERI F BIASA JGN DIMATIIN😂,2025-06-27T04:10:52Z,0
@tranbrianna7702,yang udah pasti wd yaGa-Ruda-Hoki dong⚡,2025-06-27T04:10:43Z,0
@santiagojeremy8,Ga sia sia maen diGaruda-Hoki beneran gua wd😇,2025-06-27T04:10:42Z,0
@bradleygrimes69,GA RU DA HO KI..member baru pasti jepe💛,2025-06-27T04:10:42Z,0
@saniegaming1327,"Suka ram gede dan disain premium pilih f7..tapi suka fitur smbil neo 10 .. 
Dual chip dan btre 7000 mah.. Tapi di harga yg sama cuma dapet 8/256 gb doang 😢",2025-06-27T04:10:40Z,0
@Hikaru-Kamiki-Oshi-No-Ko,"Expected: Killer
Reality: Ampas

Dibandingin sama Iqoo 10 Neo, poco F7 babak Belur 🤕🤕🤕

Gadgetin kok sok2an main klaim kilar-killer , mulutmu banyak Iler 😂😂😂",2025-06-27T04:10:07Z,0
@MAPIW,"yang suka gadget,duh duit ini nangis 😂😂",2025-06-27T04:10:03Z,0
@Kray1212,Tecno pova 7 bg,2025-06-27T04:09:57Z,0
@trickystepzz45,"Sebagai pengguna setia Poco, yang dimana gua masih pake poco x3pro yang katanya Matot HP ini udah 4tahun jalan 5tahun Alhamdulillah masih awet sampai sekarang, tapi mungkin kini sudah saatnya upgrade ke poco F7 kemarin CO dapet di harga 5,4jt semoga yang baru ini juga bisa awet 😅",2025-06-27T04:09:54Z,8
@aiproject5586,"Ane barusan co di 5,1 gile bener",2025-06-27T06:51:22Z,0
@YONDOG,fokus ke layar nya yang ngebulat...,2025-06-27T04:09:52Z,0
@DedeRahmat,Segitu doang. Jelek banget .,2025-06-27T04:09:46Z,0
@RobotGedeg-u2g,gw yang nonton pake poco F1😂😂😂,2025-06-27T04:09:40Z,0
@IMadeWahyudiAnantha,Coba adu kameranya bang lawan samsung a56 😁,2025-06-27T04:09:22Z,0
@lvxix9686,Ini baru REAL KING 👑 😎👈,2025-06-27T04:08:58Z,0
@nandus4661,Udh bli poco x7pro 😢,2025-06-27T04:08:57Z,0
@Sura_Fishing,gpp bagus itu 🫂 cup cup cup,2025-06-27T04:10:31Z,0
@patrickstar5677,Bang review Infinix note 50x 🙏,2025-06-27T04:08:43Z,0
@alpin_e,"Masih setia dengan poco F1, pengin F7 bagusny yg apa y?",2025-06-27T04:08:03Z,0
@reygeming2658,mantep,2025-06-27T04:07:59Z,0
@SyahrulPratama-YXX,Tecno pova 7 4G bg,2025-06-27T04:07:57Z,0
@virgooo_16,Baru kali ini suka lagi lihat model poco series F. Terakhir suka model di poco f3. Masih nyaman sama poco f3 di kala gempuran hp kenceng 😅,2025-06-27T04:07:41Z,0
@im_dand16,udah jadi pengguna poco sih dari jaman x3 pro trus matot ganti ke adeknya x3 nfc buat daily oke banget sampe sekarang trus nambah poco f6 buat game ringan gabut aja.Poco mantep lah🎉,2025-06-27T04:07:15Z,1
@user-ew3bc3nw6x,kurang lama buat review nya banggg😭,2025-06-27T04:07:02Z,0
@Anonim-mj9tpj,nih yg suka ngatain poco g sadar apa Infinix gt 30 pro juga ga di limit over heat juga . standar ganda wkwkwk,2025-06-27T04:06:59Z,0
@reksatheoanggara5373,Main PUBG bang....lancar kahh,2025-06-27T04:06:48Z,0
@Samsullovepazilah.,Jadi kepengen 😂😊,2025-06-27T04:06:36Z,0
@triarichannel9316,"Coba liat spek tab ada keyboard yg Shopee jual 800-900an dg, ko bisa murah tp ram bs gede, soal nya buat anak sekolah, mohon ya bang trims",2025-06-27T04:06:35Z,0
@Dongoran17,Lgi menunggu honor 400 series 🤔,2025-06-27T04:06:26Z,0
@RavaHerdiyon,TECNO POVA 7 NGAB,2025-06-27T04:06:02Z,0
@nandaasri6422,"Bahas Nubia A36 & A56 dan Honor 400, bg",2025-06-27T04:05:53Z,0
@gilangputraperkasa4470,matot ga bang ?😅,2025-06-27T04:05:08Z,0
@TheFakesiders,"Msh megang F1, blum rusak2",2025-06-27T04:04:48Z,0
@Sura_Fishing,"admin poco suka banget pake emote ini ""😗"" hahaha  aku juga 😂😂😂

tapi adminnya g cuman satu deng tapi buat mimin yang suka pake emote ""😗""
love u 🥰
hp poco selalu di hati dan terimakasih udah nemani hari hariku",2025-06-27T04:04:47Z,0
@SajidanRasa,Bang buat konten yt hp apa yang bagus ya yg udah 4k videonya,2025-06-27T04:04:47Z,0
@rahmansanyoto229,Realme mana sanggup 512,2025-06-27T04:04:42Z,0
@NurInten-r9x,Vid kapan trcno pova 7 ultra 😅,2025-06-27T04:04:09Z,2
@hafiyzi8718,Ditunggu honor 400,2025-06-27T04:03:38Z,0
@dadanghondamobil,Tahun ini belum kesampaian beli f7 pakai kinpinix gt 30 pro dulu 😅,2025-06-27T04:03:32Z,0
@Afdhal_Aby,ada fitur dual camera gk d Poco f7?,2025-06-27T04:03:18Z,0
@yennioktafyanti2819,coba review infinix note 50s am infinix note 50x bg gadgetin,2025-06-27T04:03:01Z,0
@ajisaefudin5213,Njir POCO F7 Ultranya Kamera nya Sharingan cak 🤣🤣,2025-06-27T04:02:55Z,0
@yud90,Kapok poco matot😂,2025-06-27T04:02:53Z,0
@iswansetiadi5346,Ada info Xiaomi 15T kapan bang?,2025-06-27T04:02:52Z,0
@Sofiandiandi,"Poco Puch Man ( One Puch Man )
1 Kali Jotoz Hancur Semua Musuhnya ",2025-06-27T04:01:52Z,0
@Sapaiannn,Masih pake mi 8 lte semoga bisa ganti poco f7 😅,2025-06-27T04:01:45Z,0
@JANG_ZR,Jumaatan woii,2025-06-27T04:01:24Z,0
@Wkwkwkwkwkwj,"Pengen redmi 4 turbo. 
Kamera belakangnya bisa nyala",2025-06-27T04:01:11Z,0
@fadlan5662,lah kok gk review speaker nya bg?,2025-06-27T04:00:58Z,0
@Bhaskoro_1999,"Mesin buas, Matrial premium, layar udh FullHD+ 1,5K 120Hz bazle tipis👌kameran cakep🤳 no complain wtih that😊",2025-06-27T04:00:52Z,0
@faisalalfathony,bang coba test game nya pake game wuthering waves,2025-06-27T04:00:49Z,0
@Nazbilnazbilassaqofi2,bahas hp Tecno pova 7 bang,2025-06-27T04:00:45Z,1
@mrwoodcat,2:43 bezelnya gak simetris bang david kok ga disebut ? biasanya dibahas..,2025-06-27T04:00:36Z,12
@doriefolkstroen5454,"6jt segitu udh cakep kok bg bezel nya
ketutup 8s gen4 nya bg

ada kok brand anu.. 
bezel tebal no adaptor loh😂😂",2025-06-27T14:07:49Z,1
@ferdinand4098,Bran sungsang ya😅,2025-06-27T18:17:02Z,0
@singoranonohfp,Owh si Samsul ya... 😅,2025-06-28T03:22:30Z,0
@cangwawaf80wawan,"𝓶𝓲𝓷𝓽,𝓼𝓮𝓷 𝓫𝓪𝔂𝓪𝓴 𝓲𝓴𝓴𝓪𝓷 𝔂𝓰 𝓽𝓲𝓭𝓪𝓴 𝓼𝓾𝓴𝓪  𝓹𝓪,,,𝓵𝓭𝓫𝓪𝓻 𝓽𝓭𝓴 𝓼𝓾𝓴𝓺,",2025-07-01T11:49:10Z,0
@Junihady,review pova 7 bang,2025-06-27T04:00:11Z,2
@RealMe-i4i5r,"Ngga selera hp gede gede,ngga sekalian 80 inc aja layarnya😅",2025-06-27T03:59:57Z,0
@ekasaputra9118,harga segitu mending iphone,2025-06-27T03:59:48Z,0
@yogatrymikhaperdana5954,"Ga berlaku buat mendang mending,",2025-06-27T04:03:28Z,0
@tanpojeneng7298,"BYPASS CHARGING  KALAU BATRAI BADAK & FAST CHARGING NGEBUT GK GUNA, BATRAI HABIS  TINGGAL KE WC ATAU KE DAPUR BIKIN KOPI ABC   BATRAI UDAH PENUH LAGI,, BEDA CERITA SAMA BATRAI KECIL CHARCING 25 WATT ITU BARU BERGUNA",2025-06-27T03:59:35Z,0
@Alma-n5k3f,"Ah sial gw baru beli laptop 15jt, POCO baru rilis. Ga jadi ganti Hp dulu tahun ini hehe",2025-06-27T03:59:03Z,0
@Realme-b5f8u,Bg david minta saran dong ..lebih bagus mana xiomi 14t atau poco f7,2025-06-27T03:58:48Z,0
@TecnoHp-z9u,Tidak suka bentuk kamerannya,2025-06-27T03:58:38Z,0
