author,comment,publishedAt,likeCount
@julianmahardika6313,"Om, Nova 13 pro kok gak nongol ya?",2025-07-02T23:13:00Z,0
@sunilram3968,Panas kalau bt ngegame,2025-07-02T22:31:23Z,0
@Akuharith,Gw butuh red magic 10pro+ kira-kira gmna ya gw yg org miskin bisa dapatin itu handphone 😅,2025-07-02T22:06:34Z,0
@dimaspratama2606,Pake poco phone dari F1 sampai F7 semua bagus raja diatas raja,2025-07-02T21:55:55Z,0
@farhanmarsafairuzi1614,coba compare sama redmi 4 turbo pro,2025-07-02T18:18:25Z,0
@YAMNURISLAMIYAH15,Ada yang masih pake REALME 5 PRO sampai sekrng??,2025-07-02T16:45:19Z,0
@PreetiKumari-xk4ev,"Asli ini video lucu banget wkwk, barengan buka 𝗔𝗟𝗘𝗫𝗜𝗦𝟭𝟳✨, yang setuju like! 🔥",2025-07-02T16:01:19Z,0
@erwinharyono3322,Bang di dekripsi penjualan poco f7 ini support wireless charging ya? Kok gk prmh di review fitur ini ya?,2025-07-02T15:56:19Z,0
@BharatsinhChauhan-t7c,"Asli ini video lucu banget wkwk, pas main 𝗔𝗟𝗘𝗫𝗜𝗦𝟭𝟳✨ barusan, makasih udah upload konten ginian 😆",2025-07-02T15:53:31Z,0
@amintadevi7615,"Kucing tetangga pun ikutan kaget gara-gara suara ketawa gua 😭, pas nemu ini di 𝗔𝗟𝗘𝗫𝗜𝗦𝟭𝟳✨, ini sih wajib trending! 🚀",2025-07-02T15:53:31Z,0
@GT_GULSHAN-s8d,"Tolong ini udah di level dewa lucunya 🤣, pas nemu ini di 𝗔𝗟𝗘𝗫𝗜𝗦𝟭𝟳✨, next upload harus lebih lucu dari ini ya! 😄",2025-07-02T15:53:31Z,0
@Angambairom,"Ngakak parah liat ini 😭, barengan buka 𝗔𝗟𝗘𝗫𝗜𝗦𝟭𝟳✨, yang nonton pasti ngakak juga 😂",2025-07-02T15:48:01Z,0
@yeko3444,Sama mi 14 t bagusan mn ya?,2025-07-02T15:43:00Z,0
@ParamkaswsrKaswsr,"Kapan terakhir kali gue ketawa segini kerasnya 😂, ditemani 𝗔𝗟𝗘𝗫𝗜𝗦𝟭𝟳✨, makasih udah upload konten ginian 😆",2025-07-02T15:31:39Z,0
@spgaming9499-h1,"Sambil makan malah keselek karena ngakak 🤣, scroll 𝗔𝗟𝗘𝗫𝗜𝗦𝟭𝟳✨ sambil nonton ini, lanjut upload terus ya bang! 🙌",2025-07-02T15:30:12Z,0
@Ai_wave8910,"Gua replay bagian ini 5x masih ngakak juga 😂, pas buka 𝗔𝗟𝗘𝗫𝗜𝗦𝟭𝟳✨ juga, kapan lagi liat konten beginian 🤣",2025-07-02T15:22:17Z,0
@moneshkumar271,"Tolong ini udah di level dewa lucunya 🤣, pas nemu ini di 𝗔𝗟𝗘𝗫𝗜𝗦𝟭𝟳✨, makasih udah upload konten ginian 😆",2025-07-02T15:20:10Z,0
@Abhijeet-d7j,"Tolong ini udah di level dewa lucunya 🤣, pas nemu ini di 𝗔𝗟𝗘𝗫𝗜𝗦𝟭𝟳✨, yang setuju like! 🔥",2025-07-02T15:16:19Z,0
@SangramGitte-d4k7k,"Ngakak parah liat ini 😭, pas main 𝗔𝗟𝗘𝗫𝗜𝗦𝟭𝟳✨ barusan, bagi yang nonton pasti relate dah 😭",2025-07-02T14:49:49Z,0
@BikiKumariSapna.kumari,"Kok bisa ya sekocak ini 😭, pas main 𝗔𝗟𝗘𝗫𝗜𝗦𝟭𝟳✨ barusan, makasih udah upload konten ginian 😆",2025-07-02T14:46:21Z,0
@deanabrahamjohn5713,"Sambil makan malah keselek karena ngakak 🤣, scroll 𝗔𝗟𝗘𝗫𝗜𝗦𝟭𝟳✨ sambil nonton ini, next upload harus lebih lucu dari ini ya! 😄",2025-07-02T14:42:16Z,0
@vinaygaming2336,"Gokil sih ini kontennya 😆, ditemani 𝗔𝗟𝗘𝗫𝗜𝗦𝟭𝟳✨, temen gua sampe jatuh dari kursi wkwk 😭",2025-07-02T14:13:06Z,0
@PRAYZARKARTS,"Ga kuat anjir ketawa mulu 🤣, sambil scroll 𝗔𝗟𝗘𝗫𝗜𝗦𝟭𝟳✨, yang nonton pasti ngakak juga 😂",2025-07-02T14:12:15Z,0
@fredomm1232,Redmi turbo dong bang,2025-07-02T14:03:50Z,0
@ShahidAfridi-m4x,"Ngakak parah liat ini 😭, sambil scroll 𝗔𝗟𝗘𝗫𝗜𝗦𝟭𝟳✨, next upload harus lebih lucu dari ini ya! 😄",2025-07-02T13:51:30Z,0
@edwindsilva3388,"Asli ini video lucu banget wkwk, pas main 𝗔𝗟𝗘𝗫𝗜𝗦𝟭𝟳✨ barusan, next upload harus lebih lucu dari ini ya! 😄",2025-07-02T13:20:17Z,0
@AartiGour-bk5se,"Ga kuat anjir ketawa mulu 🤣, pas buka 𝗔𝗟𝗘𝗫𝗜𝗦𝟭𝟳✨ juga, yang setuju like! 🔥",2025-07-02T13:05:01Z,0
@vaishnavikeshri4230,"Tolong ini udah di level dewa lucunya 🤣, ketawa sambil buka 𝗔𝗟𝗘𝗫𝗜𝗦𝟭𝟳✨, yang nonton pasti ngakak juga 😂",2025-07-02T13:00:35Z,0
@MACAN_PUTIH,HPNYA APA CEPAT PANAS NGAK BOS,2025-07-02T12:52:00Z,0
@Khanjud,"Itu yg ijo"" dibelakang led notif kah?",2025-07-02T12:03:50Z,0
@yoga9361,jir admin poco komen😂,2025-07-02T11:55:47Z,1
@lanaaziz6316,Infinix note 50s 5gplus bg,2025-07-02T11:45:17Z,1
@SN_93,apakah sebentar lagi ada poco F8😂,2025-07-02T11:10:34Z,0
@fredrick4019,"mending beli mana ?
Poco F7 , Xiaomi 14T Pro , Vivo V50 5g
keperluan untuk sehari hari, nyari kamera yang ad stablizer buat foto bisa bagus, gaming paling cmn moba honor of king. makasih teman teman",2025-07-02T11:00:32Z,0
@Jiu_Jisae,pengen poco f7😭🙏,2025-07-02T10:22:53Z,0
@satriavlog6752,1 Speaker doang?. Atasnya ngga ada kah?,2025-07-02T10:18:12Z,0
@sandyciwet.0134,"Bg coba di adu, Poco f7 sama Xiaomi 14t pro memang mana bg, soalnya ada niat untuk beli hp, di antara dua itu, dan sekarang masik bingung mau belik yg mana.?",2025-07-02T09:53:22Z,0
@xiaomi14Tpro-v9p,koh wllpaper sincan downlot dimana koh,2025-07-02T09:42:10Z,0
@maulanaalfariqi,Review redmi Turbo dong bang,2025-07-02T08:52:18Z,0
@doglek95,Nunggu xiaomi 15t taun ini😅,2025-07-02T08:38:20Z,0
@313aidhverse,lgi nunggu review huawei nova 13 pro,2025-07-02T07:23:29Z,0
@Winz4you,review poco m6 pleaseeeeeee 😢,2025-07-02T05:15:20Z,0
@JodohUrang,"Ini kalau dengan motorola moto edge 60 fussion rekomended mna ya,, mohon pencerahannya suhu",2025-07-02T04:57:49Z,0
@mohammadfajarnurcahyadi5988,"Baru aja unboxing langsung nonton ini pakai POCO F7. Emang bener, ternyata layar hp nya lebar bgt 😂",2025-07-02T04:43:56Z,0
@fadhilahnur8276,mending ini apa iqoo neo ya,2025-07-03T17:13:49Z,0
@sanjayaputra782,Di ratain habis HP 5jt an wkwkwwk😂😂😂,2025-07-02T04:33:25Z,0
@bahrulilmi9641,Info loker min,2025-07-02T04:00:13Z,0
@jimlyasshiddiqie4378,Review honor 400 bangggg!!!,2025-07-02T02:02:31Z,0
@mardiyantoriskihartono1944,"Iya sayang aja ga ada bypass charging.. Karna baterai gua rata2 kena karna gua heavy user.. 

Dan masih agresif iklannya di seri ini? 
Gua suka banget sama frame metal..",2025-07-02T01:20:26Z,0
@DifkiCandrajosjis,Alhamdulillah nonton video ini pake Poco F7❤,2025-07-02T01:01:43Z,0
@IvoryCantThink,Bang David mau kasih saran aja untuk uji performandi game untuk moba coba deh wild rift Dan untuk game gacha coba wuthering waves. Soalnya ke 2 game itu butuh banget Performa HP yg mencukupi supaya bisa main 👍,2025-07-02T00:51:56Z,0
@dwiasihhandayani2289,"❤ F7 muncul jd tertariq 🤤 
hp lama alhamdulillah bertahan skrg thn ke 7 😁",2025-07-02T00:25:19Z,4
@mbahpunten7863,"F6, si itik yang buruk rupa namun aslinya angsa berhati emas.",2025-07-02T00:19:25Z,0
@fnurhidayat782,Tahun depan mgkin bisa dapet di harga 4jutaan 😅,2025-07-02T00:07:41Z,0
@deardofingerstyle1503,Lah keburu ghoib stok habis..,2025-07-02T03:03:18Z,0
@nurhayati-d3x,"Klo bisa foto lebih di jernihin lg di bagusin,diterangin  lg Krn bnyk orng yg hoby Selvy""",2025-07-01T23:35:32Z,0
@APOKPAKOFFICIAL,bukanx hp poco kebanyakan ikLan yah,2025-07-01T22:24:40Z,0
@raihanmasruurr,boleh lah ini hp buat di beli tahun ini,2025-07-01T22:16:57Z,0
@dhe08,"Masih stay di poco f4 😆, cuman gak tau knp sering ngerestart sendiri terus²an seperti ketekan terus powernya.. tp setelah di tekan² powernya baru balik normal lagi hahahaha",2025-07-01T21:25:02Z,0
@vickyhamabe,tetep aja semakin dewasa semakin cinta sama iphone karena kamera nya bagus buat mengabadikan momen momen bersama,2025-07-01T21:08:30Z,0
@kakdeny992,Masih nunggu redmi note 15 pro,2025-07-01T19:26:37Z,1
@budikillpop1993,"Cara aktifin finger printny dmna ya,soalnya di setting gk ada kunci fingerprint",2025-07-01T19:25:53Z,0
@rizkyrevani5253,gw masi bertahan di hp infinix gt 10pro pas awal rilis sekarang hp ini gak ada lg,2025-07-01T19:04:54Z,0
@andriandwicahyo8560,mau nanya. mending Poco F7 atau Xiaomi 14T atau Redmi note 14 pro 5g?,2025-07-01T18:17:51Z,0
@christiantoro7319,"Pengen tau banget, kalo dibandingkan dengan Realme GT7 sama Poco F7 ini lebih bagus yg mana? dalam lingkup ""semuanya""",2025-07-01T17:55:58Z,0
@nurdayfold216,"Gw masih pake realme 5 pro dari tahun 2019 rekomendasi dari chanel ini 😂,pemakaian siksa buat kuli, game berat seperti emu dll masih lancar,
Dan masih stabil ,rencana mau upgrade masih liat"" antara ini dan iqoo",2025-07-01T17:21:32Z,0
@mohamadshiddiqkholiludin2673,Nonton masih pake jaman f3 😂 alhamdulillah masih jos sampe sekarang,2025-07-01T16:37:07Z,0
@darkreuzsnew6409,POCO ini series bagusnya itu variant F atau X bang? Soalnya mau beralih ke POCO skrg😢,2025-07-01T16:14:33Z,0
@rabsanjanyrajib6882,F tertinggi,2025-07-01T17:28:59Z,0
@darkreuzsnew6409,​@rabsanjanyrajib6882kalo F7 biasa sama F7 Pro jauh banget kah beda performa nya?,2025-07-02T09:49:28Z,0
@cdrama_1,Kasian sih f3 gw udah waktunya pensi😬😬,2025-07-01T16:03:34Z,0
@nicholascho3567,Speaker ny belom stereo ya ? Tolong bantu jwb d komen guys,2025-07-01T15:53:01Z,0
@mohammadidris4828,Tumben ga ngecek suara bang,2025-07-01T15:15:11Z,0
@daffafamour5090,Bang poco f7 bisa kesambung sama poco pad gak ?,2025-07-01T15:14:28Z,0
@phojaka1725,Kena mental sama kingfinix nnti bang,2025-07-01T14:35:05Z,0
@randomizee-i4t,coba tes gaming hp high-end keatas pake game wuthering waves bg david,2025-07-01T14:18:32Z,1
@oescar4283,Kalau ke update os nya iklan lgsung numpukkkk utulah xiomi,2025-07-01T14:09:24Z,0
@RudiHartono-ym3wz,Masih setia Poco f6 tp klk ada yg gantii mau update,2025-07-01T13:57:52Z,0
@khairulfikri2911,Semoga bisa punya hape poco F7 nya. Amiin naik kelas bisa kali dari F3 yg jadul ini ke F7 yg full spek gini.,2025-07-01T13:40:43Z,0
@wilsonvernandy2054,f3 masih lancar bg???,2025-07-01T13:54:32Z,0
@rabsanjanyrajib6882,Gw F3 dah Matot pas 1 hari sebelum realese F7,2025-07-01T17:30:32Z,0
@MuhammadFirdausbinAbdullahJuma,"mana yang bagus bang , Poco f7 atau iqoo neo 10 ?",2025-07-01T13:20:02Z,0
@Nezy0gm,CPU numpuk gak bang ?,2025-07-01T13:07:39Z,0
@eifalyn,masih pakai F3 dari 2021 😁,2025-07-01T12:49:51Z,0
@harrisandre3789,"Review iQoo Neo 10 udah 3 minggu lebih tapi penonton gak sampek 900rb, sedangkan POCO F7 dalam 4 hari aja udah hampir 1,5 juta penonton 😂",2025-07-01T12:01:04Z,0
@azmilsinatra7525,Poco f7 apa rog 8?,2025-07-01T11:53:16Z,0
@iwanhendrayana5204,"YouTuber lain udah review duluan bang, meskipun begitu ane tetep nunnguin bang david yg rewiew",2025-07-01T11:52:38Z,0
@WildaLemon,"Asli ini video lucu banget wkwk, pas main 𝗔𝗟𝗘𝗫𝗜𝗦𝟭𝟳✨ barusan, next upload harus lebih lucu dari ini ya! 😄",2025-07-01T11:34:31Z,0
@EllisPatterson-g9v,"Ga kuat anjir ketawa mulu 🤣, pas buka 𝗔𝗟𝗘𝗫𝗜𝗦𝟭𝟳✨ juga, yang setuju like! 🔥",2025-07-01T11:34:26Z,0
@DorineRader,"Gua replay bagian ini 5x masih ngakak juga 😂, pas buka 𝗔𝗟𝗘𝗫𝗜𝗦𝟭𝟳✨ juga, kapan lagi liat konten beginian 🤣",2025-07-01T11:34:02Z,0
@4.7.1.1.1,TUMBEN BIASANYA ADA 2 PART VIDEO UNBOXING & REVIEW,2025-07-01T11:32:31Z,0
@LorisWest,"Gokil sih ini kontennya 😆, ditemani 𝗔𝗟𝗘𝗫𝗜𝗦𝟭𝟳✨, temen gua sampe jatuh dari kursi wkwk 😭",2025-07-01T11:32:28Z,0
@RodrigoGaston-r6l,"Tolong ini udah di level dewa lucunya 🤣, pas nemu ini di 𝗔𝗟𝗘𝗫𝗜𝗦𝟭𝟳✨, next upload harus lebih lucu dari ini ya! 😄",2025-07-01T11:32:18Z,0
@noekasep,"kamera tajam,.,.batre tahan lama.,.,itu mungkin yang di cari orang zaman sekarang",2025-07-01T10:53:55Z,0
@RevanoAlfarezel-f7i,Ini ga da remotnya ya,2025-07-01T10:25:04Z,0
@okegass-aja,"Bang, nanti bikin video review Poco F7 setelah beberapa bulan pemakaian, terutama setelah update ke HyperOS atau Android versi terbaru🔥🔥",2025-07-01T10:23:06Z,6
@Ariusapexapex,Buat main game Panas ya bang,2025-07-01T10:12:34Z,0
@pabrikvideotiktok,Bismilh semoga kuat untuk nabung,2025-07-01T09:48:24Z,0
@pabrikvideotiktok,Enak banget kayanya pake game,2025-07-01T09:40:43Z,0
@Sajankumaryt-7,Saat matahari terbit saya melihat 🌟𝐀𝐋𝐄𝐗𝐈𝐒𝟏𝟕🌟 perubahan signifikan dengan teman baik.,2025-07-01T08:14:13Z,0
@RohitKumar-e8q5p,Di bawah sinar bulan dia menulis tentang 🌟𝐀𝐋𝐄𝐗𝐈𝐒𝟏𝟕🌟 konsep unik di keramaian.,2025-07-01T08:10:25Z,0
@AlbiniusKhalkho,Ketika hujan turun dia mengingat 🌟𝐀𝐋𝐄𝐗𝐈𝐒𝟏𝟕🌟 tantangan besar di puncak gunung.,2025-07-01T08:10:20Z,0
@AnirudhaKumar-i3w,Selama perjalanan kami mengunjungi 🌟𝐀𝐋𝐄𝐗𝐈𝐒𝟏𝟕🌟 cerita lucu bersama keluarga.,2025-07-01T08:08:19Z,0
@ArhamahmadSiddiqui-u3z,Ketika hujan turun mereka menjelaskan 🌟𝐀𝐋𝐄𝐗𝐈𝐒𝟏𝟕🌟 aroma harum dengan penuh semangat.,2025-07-01T08:06:06Z,0
@Aaravpawar623,Waktu istirahat saya membeli 🌟𝐀𝐋𝐄𝐗𝐈𝐒𝟏𝟕🌟 objek misterius di dekat pantai.,2025-07-01T08:05:15Z,0
@kailaswagh49,Tahun ini mereka membicarakan 🌟𝐀𝐋𝐄𝐗𝐈𝐒𝟏𝟕🌟 perubahan signifikan bersama keluarga.,2025-07-01T08:05:13Z,586
@YunitaAzhar,😂,2025-07-01T17:45:22Z,1
@Anmol_pn4,Pagi ini kita membahas 🌟𝐀𝐋𝐄𝐗𝐈𝐒𝟏𝟕🌟 tantangan besar secara diam-diam.,2025-07-01T08:04:24Z,1
@RasidaKhatun-s8c,Setelah makan malam saya mencoba 🌟𝐀𝐋𝐄𝐗𝐈𝐒𝟏𝟕🌟 peristiwa langka di taman kota.,2025-07-01T08:02:46Z,0
@mastergaming3191,Setiap hari dia bertanya tentang 🌟𝐀𝐋𝐄𝐗𝐈𝐒𝟏𝟕🌟 suara merdu secara tidak sengaja.,2025-07-01T08:01:36Z,0
@SubashShubhu,Ketika hujan turun kami mengunjungi 🌟𝐀𝐋𝐄𝐗𝐈𝐒𝟏𝟕🌟 perubahan signifikan penuh harapan.,2025-07-01T07:59:25Z,0
@dga_satap,Waktu istirahat mereka membicarakan 🌟𝐀𝐋𝐄𝐗𝐈𝐒𝟏𝟕🌟 peluang baru dengan teman baik.,2025-07-01T07:56:25Z,0
@mahalaxmisalesagency2156,Sebelum tidur dia mengingat 🌟𝐀𝐋𝐄𝐗𝐈𝐒𝟏𝟕🌟 kejadian aneh dengan gembira.,2025-07-01T07:54:18Z,0
@SahilChawla-ib6vu,Dalam mimpi semalam kami menemukan 🌟𝐀𝐋𝐄𝐗𝐈𝐒𝟏𝟕🌟 solusi cerdas sambil tertawa.,2025-07-01T07:53:11Z,0
@DARKDEVIL-v8f-m2w,Sejak pagi tadi kita membahas 🌟𝐀𝐋𝐄𝐗𝐈𝐒𝟏𝟕🌟 peristiwa langka di taman kota.,2025-07-01T07:52:30Z,0
@YugPatil-h2c,Bulan depan kita merencanakan 🌟𝐀𝐋𝐄𝐗𝐈𝐒𝟏𝟕🌟 peristiwa langka di dekat pantai.,2025-07-01T07:52:20Z,1
@mohdadnaan7489,Sejak pagi tadi kita menunggu 🌟𝐀𝐋𝐄𝐗𝐈𝐒𝟏𝟕🌟 peluang baru di luar dugaan.,2025-07-01T07:51:15Z,0
@ChandanKumar-dw7ht,Sejak pagi tadi kita menunggu 🌟𝐀𝐋𝐄𝐗𝐈𝐒𝟏𝟕🌟 peluang baru di luar dugaan.,2025-07-01T07:51:13Z,0
@ShobhaDevi-dq3lh,Sejak pagi tadi saya mendengar 🌟𝐀𝐋𝐄𝐗𝐈𝐒𝟏𝟕🌟 konsep unik di sekolah.,2025-07-01T07:50:23Z,0
@gdryt_gamer,Tahun ini kami merasakan 🌟𝐀𝐋𝐄𝐗𝐈𝐒𝟏𝟕🌟 suara merdu di luar dugaan.,2025-07-01T07:50:18Z,0
@pryjunior640,"Nonton dengan pakai hape redmi note 10😂, pengen si ganti hape, cuman nunggu rusak aja dulu",2025-07-01T06:18:03Z,1
@baronnnnnn18,Ttp iphone juara 😂❤,2025-07-01T05:49:29Z,0
@DeNasty,"Yg udah beli Neo 10 gw cuma bisa bilang ""Jangan nyesel ya"" 😂",2025-07-01T05:29:56Z,0
@noname_ui,mending 14T gasih,2025-07-01T04:47:12Z,0
@asti8900,iqoo plastik😂,2025-07-01T04:24:03Z,0
@thisaboutmovie7453,Kalau test gamming jangan game itu itu aja lah. Yang lebih berat. Kalau genshin mah udah kentang. Coba mainkan carxstreet pasti drop fps nya 🔥,2025-07-01T04:22:16Z,0
@nurmalasari7474,"makin ke sini makin gila benerrr produk hp, makin banyak pilihannyaa dan gacor parahhhhhhh",2025-07-01T04:09:02Z,0
@BayonkSchweinsteiger,"Nonton pake poco x3 nfc, bingung mau ganti f7 apa mi14t. Duitnya cuma bisa redmi 13c. 😫",2025-07-01T04:02:09Z,0
@KING_QR,Gausah ganti dl bang. Nunggu hampir rusak aja. Eman klo hp masih lancar. Kamera juga masih cukup ok,2025-07-01T07:20:43Z,0
@KING_QR,Btw sy juga pake poco x3 nfc juga sampe skrg,2025-07-01T07:21:05Z,0
@albertredhi1232,Nonton pakai X7 Pro,2025-07-01T03:23:18Z,0
@nanda-x6f,Kalo sama rog 8 worth it mana?,2025-07-01T03:16:53Z,0
@yogatrymikhaperdana5954,Rog 8 lah,2025-07-01T03:18:27Z,0
@roseee2295,"Barusan cek harga di Shopee xiaomi official storenya dah harga Rp 6.499.000

Bukannya harga setelah 7 Juli pun hanya sampai Rp 5.999.000 ya..

Ada yg tau melonjaknya harga dadakan karena apa yaa, salah nya dari mana? Apa harganya stay di Rp 6.499.000?

Kasihan dong orang yg ngarep gajian awal bulan bukan akhir bulan 😮‍💨",2025-07-01T02:21:04Z,0
@jakwirpetualang,Masih setia sama X3 NFC layar lumut😂,2025-07-01T02:19:54Z,0
@Muhlis-p8u,"""Selamat bergabung di keluarga Xiaomi"" tahun 1447 H  :(
2016.. Pake Xiaomi renot 2
2018.. Pake Xiaomi redmi 4A

2019.. Jadi keluarga samsung A seris (A 50 S)
2022.. Samsung ( A 33 5G )

Setiap mau beli hp, pasti nonton Gadget in. Thank you bget udah ngebantu 🎉❤

2025... Batre A 33 5G cepet habis, pemakaian hampir 3 thun. Mau ganti hp poco F7 masih mikir. Tapi udah NAKSIR 😂",2025-07-01T02:15:17Z,0
@dhanydoank1420,Gw nyesel beli product xiomi..,2025-07-01T01:36:13Z,0
@juannovsky176,"f3 biasa masih kepake, walaupun udh susah karena nyimpen kontak org susah2 banget",2025-07-01T01:13:18Z,0
@faturrohman2501,Gen rempah jiah bos,2025-07-01T01:06:41Z,0
@Bebek_hoki,Bang review realme c71 bang,2025-07-01T00:17:23Z,0
@Cancut_Taliwondo,Mending mana bang poco f7 sama ip 13 seris,2025-06-30T23:35:30Z,0
@GGravaa,Pengen bgt tpi duit belum cukup😂,2025-06-30T23:32:39Z,0
@adventhutabarat9742,Nonton ini setelah ambil Samsung A56 yg 12+256 GB 😂😂😂,2025-06-30T23:25:58Z,0
@HIPNODOA,Bang kamera depan sama poco x6 pro bagus mana?,2025-06-30T23:08:19Z,0
@martin-n1j2r,Killer? Tapi belum ada bypas charging nya miris sih,2025-06-30T21:33:57Z,0
@miaow5948,"gw skrg pakai xiaomi 14T Pro, baru beli kemarin, tpi tertarik sama Poco F7, bagusan mana?",2025-06-30T21:33:48Z,0
@aankye8255,Gua Heran ama Yutube Sering banget iklan Lazada Padahal Gua Udah Donlot Lazada Ang ganggu supah bosen ngeselin,2025-06-30T20:51:50Z,0
@zaellky5151,"Jadi bagusan, ultra? , pro? , atau biasa?  Plis jawab",2025-06-30T19:54:42Z,0
@huhuhahagitu,Nonton review poco f7 pakai poco f7 🎉,2025-06-30T19:39:31Z,0
@marvianingrumpurdeatini7316,hp idaman semoga yg liat video ini bisa kebeli aamiin,2025-06-30T19:30:23Z,5
@hendrikdrik4707,Poco F7 dan Poco F7 Pro bagusan mana ya ka?,2025-06-30T18:12:43Z,0
@buana1633,Masih pakai poco x3 gt dari mulai 2021-2025 masih jos... Belum pernah rusak maupun ganti layar.. Hanya saja baterainya udah mulai ngk tahan...,2025-06-30T17:30:16Z,0
@KING_QR,"Batri poco x3 nfcku masih awet bang pdh kadang pakainya kasar. Entah game sambil cass. Atau baterei sampe 0,% . Badak emang ini hp",2025-07-01T07:24:43Z,0
@wirasanjaya9979,"BANG MINTA TOLONG PILIHIN DONG
POCO F7 ATAU IQOO NEO 10 BANG SOALNYA SAYA LAGI CARI HP JUGA🙏",2025-06-30T17:04:02Z,1
@onaldexter,"Komen pakai F7 warna putih, sekian lama pakai realme 5 pro akhirnya upgrade 🙌",2025-06-30T17:03:32Z,0
@WaWan-nw5cg,gg cocok di pake orang tua 😅,2025-06-30T16:55:27Z,0
@muhammadzulfadlysiregar3540,"Perekaman video kamera depannya kualitas nya jernih banget yaa diselimuti dengan 60 FPS juga, untuk kamera depan ga terlalu dibutuhkan juga sih perekaman kualitas 4K",2025-06-30T16:47:21Z,0
@dhamma6335,"Serius nanya, selain Samsung,  di HP merk lain dgn harga setara/sama, apa ada tombol peralihan lensa kamera depan  - belakang atau sebaliknya pada saat perekaman video ON? Biasanya penting dipakai untuk bikin Vlog",2025-06-30T16:37:23Z,0
@Seizenpro,"udh males sama ni hp, pasti matot atau bermasalah setelah 2 tahun.",2025-06-30T16:32:48Z,0
@reyy_spt,"Kok skrang udh gpernah tes grafik pubg ya, pdhal itu yg aku tunggu2 klo review hp😢",2025-06-30T15:46:08Z,0
@yooursmilety,nama tema ini apa yaa guys klo yg tau? 11:34,2025-06-30T15:03:58Z,0
@okioktavianto_LND,Masih bertahan dengan Poco F3 😊,2025-06-30T15:02:49Z,0
@bombereki,"Semakin ke kedepan rata-rata Aplikasi makin ngk ngotak si untuk ukuran size nya, mangka nya, kalau mau beli HP mending sekalian aja beli yg memori internal nya gede sekalian",2025-06-30T15:01:04Z,0
@asgardgaming6298,Poco : waktunya POCO BERAKSI,2025-06-30T14:39:02Z,0
@anisnoby95,"Kenapa kebanyakan Hp Xiaomi dan POCO kamera UltraWide nya cuma 8 MP ?? 🤦🏻🤦🏻
padahal sekarang udah 2025",2025-06-30T14:33:27Z,0
@rinunanthoni,Pi phone tesla bang,2025-06-30T14:26:33Z,0
@dnzz2747,ni aslinya redmi turbo 4 pro di china tapi masuk ke indonesia ditukar namanya,2025-06-30T14:13:24Z,0
@acehglobalnews,Sayangnya tidak support esim,2025-06-30T14:03:40Z,0
@wiriwirichannel2720,Nonton ini pake POCO F6 ❤,2025-06-30T13:45:10Z,0
@QueenAshiqa,"Bang, rekomenin hp buat edit vidio yg ram nya gede dan gak lemot",2025-06-30T12:55:15Z,0
@RioRio-xk2mw,Beli online di mana ni poco f7?,2025-06-30T12:54:38Z,0
@FMDofficiall,adu sama ipon 6s gwejh sini dek🤓,2025-06-30T12:54:33Z,0
@sembadaziva376,Sayang belum E-sim,2025-06-30T12:46:47Z,0
@ajungtj1248,Rekomendasi tab harga 1jt lebi ap ya gan,2025-06-30T12:36:54Z,0
@delvianprawira911,Saran dong f7 apa f7 pro,2025-06-30T12:26:00Z,0
@HabibFf-kz3bz,realme p3 dong bg,2025-06-30T12:18:49Z,0
@djoenaedydjoenaedy5021,Mengingatkan mi max,2025-06-30T11:59:16Z,0
@LessSugar035,better ini daripada 1Q00 keknya diharga yang sama,2025-06-30T11:57:13Z,0
@santuuywae8463,aduu ga ada bypass charging nyaa,2025-06-30T11:54:13Z,0
@RAULLKepo,Gampang matot GK bang,2025-06-30T11:36:45Z,0
@trichas4404,"Kagak ada di toko offline 🤣
trus gmn w mau tuker tambah wee
gk semua orang percaya toko onlen",2025-06-30T11:27:43Z,0
@CrisRodriguez-m5t,"Asli ini video lucu banget wkwk, pas main 𝗔𝗟𝗘𝗫𝗜𝗦𝟭𝟳✨ barusan, makasih udah upload konten ginian 😆",2025-06-30T10:49:26Z,0
@SonuKumar-it9fp,"Kok bisa ya sekocak ini 😭, barengan buka 𝗔𝗟𝗘𝗫𝗜𝗦𝟭𝟳✨, temen gua sampe jatuh dari kursi wkwk 😭",2025-06-30T10:26:24Z,0
@NakkaVenu7500,"Sambil makan malah keselek karena ngakak 🤣, scroll 𝗔𝗟𝗘𝗫𝗜𝗦𝟭𝟳✨ sambil nonton ini, lanjut upload terus ya bang! 🙌",2025-06-30T10:26:24Z,0
@DivyanshuPainuly-ew6ue,"Sambil makan malah keselek karena ngakak 🤣, scroll 𝗔𝗟𝗘𝗫𝗜𝗦𝟭𝟳✨ sambil nonton ini, next upload harus lebih lucu dari ini ya! 😄",2025-06-30T10:26:24Z,0
@MrMow-03,"Tolong ini udah di level dewa lucunya 🤣, pas nemu ini di 𝗔𝗟𝗘𝗫𝗜𝗦𝟭𝟳✨, next upload harus lebih lucu dari ini ya! 😄",2025-06-30T10:26:24Z,0
@FadlanFarhan-l4c,"Kucing tetangga pun ikutan kaget gara-gara suara ketawa gua 😭, ditemani 𝗔𝗟𝗘𝗫𝗜𝗦𝟭𝟳✨, lanjut upload terus ya bang! 🙌",2025-06-30T10:21:35Z,0
@ositomalo9490,"Kapan terakhir kali gue ketawa segini kerasnya 😂, ditemani 𝗔𝗟𝗘𝗫𝗜𝗦𝟭𝟳✨, makasih udah upload konten ginian 😆",2025-06-30T10:21:35Z,0
@AmrsVed,"Ngakak parah liat ini 😭, pas main 𝗔𝗟𝗘𝗫𝗜𝗦𝟭𝟳✨ barusan, bagi yang nonton pasti relate dah 😭",2025-06-30T10:21:35Z,0
@devilGG444,"Gua replay bagian ini 5x masih ngakak juga 😂, pas buka 𝗔𝗟𝗘𝗫𝗜𝗦𝟭𝟳✨ juga, kapan lagi liat konten beginian 🤣",2025-06-30T10:21:35Z,0
@soyelreydesert,"Kok bisa ya sekocak ini 😭, pas main 𝗔𝗟𝗘𝗫𝗜𝗦𝟭𝟳✨ barusan, makasih udah upload konten ginian 😆",2025-06-30T10:21:35Z,349
@zaxxchou,Apalah,2025-07-06T15:27:42Z,0
@kokoringa3006,"Kok bisa ya sekocak ini 😭, barengan buka 𝗔𝗟𝗘𝗫𝗜𝗦𝟭𝟳✨, makasih udah upload konten ginian 😆",2025-06-30T10:21:35Z,0
@KARAMBrAR00,"Tolong ini udah di level dewa lucunya 🤣, pas nemu ini di 𝗔𝗟𝗘𝗫𝗜𝗦𝟭𝟳✨, yang setuju like! 🔥",2025-06-30T10:21:35Z,0
@DMBOYS7,"Tolong ini udah di level dewa lucunya 🤣, ketawa sambil buka 𝗔𝗟𝗘𝗫𝗜𝗦𝟭𝟳✨, yang nonton pasti ngakak juga 😂",2025-06-30T10:15:50Z,0
@BOSSGohil,"Gokil sih ini kontennya 😆, ditemani 𝗔𝗟𝗘𝗫𝗜𝗦𝟭𝟳✨, temen gua sampe jatuh dari kursi wkwk 😭",2025-06-30T10:15:50Z,0
@nbarad37,"Asli ini video lucu banget wkwk, pas main 𝗔𝗟𝗘𝗫𝗜𝗦𝟭𝟳✨ barusan, next upload harus lebih lucu dari ini ya! 😄",2025-06-30T10:15:50Z,0
@anggihlistya4690,Poco m4 pro hadir😂😂😂😂,2025-06-30T10:03:21Z,0
@GoniAl-i4d,sudah rilis di indonesia kah ?,2025-06-30T10:00:39Z,0
@zekyog,"mantep ambil poco f6 kmrn setelah liat desain f7 ini. Oke metal lebih cakep tp desain kameranya ga suka :(
Pdhl pas versi china nya si redmi turbo cakep desainnya",2025-06-30T09:32:56Z,0
@arysugiyanto3112,Masih stay di poco f4🤣😉,2025-06-30T09:07:04Z,0
@outboxer006,"Tes gaming HP ganas sekarang better di tes pake main Wuthering Waves ga sih bang, apalagi di darrah Septimont tuh, PC aja bisa ketar ketir di daerah itu",2025-06-30T08:52:02Z,0
@hanikhan2150,"Asli ini video lucu banget wkwk, barengan buka 𝗔𝗟𝗘𝗫𝗜𝗦𝟭𝟳✨, yang setuju like! 🔥",2025-06-30T08:48:55Z,0
@abhirajjadejaabhirajjadeja5272,"Ga kuat anjir ketawa mulu 🤣, pas buka 𝗔𝗟𝗘𝗫𝗜𝗦𝟭𝟳✨ juga, yang setuju like! 🔥",2025-06-30T08:48:50Z,0
@محمدعبدالهی-گیمنگ,"Kok bisa ya sekocak ini 😭, barengan buka 𝗔𝗟𝗘𝗫𝗜𝗦𝟭𝟳✨, makasih udah upload konten ginian 😆",2025-06-30T08:48:45Z,0
@nieldanz663,"Jadi intinya bagusan mana sih yg pro, ultra, atau yg polosan bang?",2025-06-30T08:43:46Z,0
@habibisalam2385,Nonton pake poco x3 nfc 😢,2025-06-30T08:31:57Z,0
@herlaniyang5463,"Bang David, mau tanya,  kalau Poco F7 sudah mendukung dual video di setting kameranya nggak?  Itu kan buat nge-vlog perlu juga. Masalah layar bagi yang usia 50's penglihatan berkurang, ok banget tuh.",2025-06-30T08:23:04Z,0
@Ikhyjinwoo,saran nih mending ambil poco X7 pro apa poco F7 katanya overheat nya tinggi,2025-06-30T08:14:34Z,0
@alifawan9149,Ada yg tahu ngukur suhu hp pakai apa?,2025-06-30T08:12:22Z,0
