author,comment,publishedAt,likeCount
@adminmichat7306,Engga ada lubang cukukan henset,2026-01-18T14:34:48Z,0
@ramonzamora4195,Alhamdulillah lagi nonton pake poco f7. Walaupun kredit 😁,2026-01-18T14:07:16Z,0
@BroCide-w6o,"Alhamdulillah mungkin ini keberuntungan saya, dapat hp ini di harga 4.7 seken pemakaian 3 bulan 👌",2026-01-16T11:44:26Z,0
@fransnainggolan7980,"abis itu update OS baru mulai lemot dan overheat kayak F5 saya, mau rombak root biar ganti ose balikin ke miui, sampai skarang gak diapproved, jadi takut mau ambil xiaomi, maaf bukan menjelekkan brand ini.",2026-01-15T19:31:18Z,0
@yehezkielmatlyan2970,ad yang ram 256 gak?,2026-01-15T15:30:24Z,0
@Humanpa,pakai snapdragon aja naganya belum bisa ngamuk bagaimana ini xiaomi,2026-01-15T08:29:42Z,0
@bangverry89,auto beli ni😁,2026-01-14T05:04:45Z,0
@robbynoerikhsan7230,"Alhamdulilah udah beli, cuma salah warna aja, pengen warna putih dptnya item",2026-01-13T02:25:23Z,0
@azis.saputraisnaini,"mending beli ini, apa ada lagi ga ya nanti keluaran baru abis lebaran...",2026-01-12T06:07:53Z,0
@IndriYani-sr1nk,"Aku ngiler hp ini karna doi udh beli😂udah liat dan merasakan langsung😂 gila ya ni hp, spek ajib, biasanya kamera kureng, tpi kmren ku coba gilaaa, Alus bangett jujurrr mau itu foto atau video, kamera depan atau belakang pun ajib bgt gilaaaa Alus bgttt entah itu dari kehalusan gerakan penangkapan warna dan detail nya gila sih❤",2026-01-11T13:24:32Z,0
@ekylemon6510,Kalau sama ip 13 mending mana ka,2026-01-11T14:55:16Z,0
@joannugroho3146,"sekarang udh 7,400jt bjir",2026-01-09T17:54:25Z,0
@the_solo_karina3248,Woi seriusan poco kameranya sebagua itu??? 😮 ini gak ngigo kan poconya? 😂,2026-01-09T14:56:58Z,0
@robihhasim2005,nonton ini pake poco f7 Alhamdulillah,2026-01-08T12:59:10Z,0
@rio11-g2p,"hp impian alhamdulillah uda ke sampean .
thanks to Allah 🤲",2026-01-07T19:48:29Z,0
@K59j_a11,"Di ROM region id banyak iklan nya, ganti ke rom global iklan ilang semua, itu yg gw alami",2026-01-06T18:35:35Z,0
@pertapamalam7427,Butuh hape dgn performa video dan game sebaik dg buget serendah  mungkin apa ad yg lebih murah dri ini dgn performa yg mumpuni.,2026-01-06T04:44:15Z,0
@Theerwin468,"saya baru beli poco f7 baru 3 hari, belum dipudate masih di versi 2.0.100 padahal udah ada update ke 204 tapi nanti aja deh updatenya 😅😊",2026-01-06T04:22:56Z,1
@SamsungM32-o5e,Gua nunggu chpset nya dipakai buat tab xiaominya😂.. bisa jadi suhu dan fpsnya lebih stabil kalo buat maen genshin😂,2026-01-06T02:24:47Z,0
@oecupgenit3222,berat,2026-01-05T20:07:15Z,0
@stfsatriogimangs2044,Nonton pake poco f7,2026-01-05T14:26:28Z,1
@an-san4477,Alhamdulillah udah bisa beli,2026-01-05T06:05:15Z,1
@erniorlandopizzamarketer4672,"Alhamdulillaah... 
Kalo di awal tahun gini kena berapa kaak?? 
Jujur, saya juga ngincer. Tapi masih nabuung...😊😊😊",2026-01-05T09:44:47Z,1
@an-san4477,"Alhamdulillah kak. beli di 12.12 kemrin saya dapat 5,1.
kalau kemarin saya liat sekitar tgl 25-30 di 5,5. hampir 5,6",2026-01-05T11:33:22Z,0
@market_higgs,​@an-san4477secound ya,2026-01-07T09:51:13Z,0
@MuhammadRafi-gl1ji,"Mending ambil ini atau Yg Pro bang? Atau seri lain?? Gua mau baca nonton main gane lancar, kamera jarang cmn kalo ada momen paling jepret sekali""? Itupun jarang kayak 1% kemungkinan😅 jadi pilih rekomendasi mana ya bang?",2026-01-04T14:38:58Z,0
@iko24434,"trauma sama poco, dulu x3 pro matot tiba-tiba",2026-01-01T06:35:41Z,0
@iko24434,penggunaan 2tahun.. di servis kata konternya udah masanya mokad,2026-01-01T06:36:15Z,0
@eky3321,​@iko24434bedain dlu seri f sama x,2026-01-03T01:03:25Z,0
@RafifTammam,smooth ga untuk dokumentasi videonya bang?? gaada ultrawide nya berarti ya kalo 4k 60fps?,2025-12-31T16:19:50Z,0
@market_higgs,"Hp ini panas bgt walapun gak buat game udh terasa panasnya
Di saya kurang cocok cuma kepake semingu lalu jual lagi
Bikin gak nyaman hp kalau mudah panas
Buat scrol2 sosmed doang udh angetnya kerasa bgt",2025-12-28T18:56:09Z,1
@FUNREKA-h4s,Mono speaker ya bang,2025-12-28T13:45:15Z,0
@kidskiller6440,"Bg, hp POCO F3 ku rusak. Mau beli F7 tp lg gak ad uang, lg banyak pengeluaran Natal dan mau nyambut tahun baru... Give awayin POCO F7 dong bg hehe",2025-12-28T11:34:15Z,1
@skakhunter8034,Kerja,2026-01-16T00:38:58Z,0
@ahmadirfan1377,"Mantau pake Poco F2 Pro pemakaian udah 6 tahun, semoga bisa beli ini Poco F7 Pro untuk ganti di tahun 2026",2025-12-28T02:07:05Z,0
@bondansaid3285,Bang review Redmi 4 Turbo bang,2025-12-26T19:22:51Z,0
@Viand555,Nonton ini pake poco x3 nfc,2025-12-26T05:47:54Z,0
@YanStwn-n2d,Nonton pake f7 baru beli kemarin ❤,2025-12-25T09:11:30Z,0
@EkaYuliana-h4r5c,F7 atau fx pro 5g bg,2025-12-25T11:14:50Z,0
@market_higgs,Anget gak bg klau cuma buat scrol2 sosmed aja,2025-12-28T05:26:02Z,0
@Eindora6690,beli bung sebelum 2026 auto naik itu wkwk,2025-12-23T19:54:35Z,1
@Miwaotori,Nonton pakek poco f7 😋,2025-12-23T07:46:09Z,0
@jazreen6687,poco f7 or poco x7 pro??,2025-12-21T13:23:44Z,1
@adhikeyboard5916,Nonton pake poco x3 nfc😁,2025-12-21T12:12:05Z,0
@udeel,Poco f7 pakai hyperOS juga?,2025-12-21T11:54:28Z,0
@nenglilie,Aku yakin semua yg pingin Beli Hp pasti nonton bang David. Kayak aku.. hehe scrol²l cari yg cocok dn yg menurut bang David bagus.,2025-12-20T13:55:08Z,3
@JohansyahJohan-g4b,Dari sekian merk HP camera yg gua andalin cuma V40-60,2025-12-20T12:44:52Z,0
@who_ayu,"Kenapa kamera saya sangat over sharpen ya, kalau Selfie pori pori semua extra tajam?",2025-12-20T04:08:05Z,0
@araleeeeeeee,Ini udh ada NFC blm ya?,2025-12-19T01:06:49Z,0
@AlunAira,Bang rifyu poco m 7 4g,2025-12-18T12:13:03Z,1
@haeatsugiati803,Di toko biasa ada gak sih? apa harus online.,2025-12-18T05:01:45Z,0
@tehpanasmanis5662,"Udah nanya ke temen yg internal ""offline store"" Harga rata2 dimarkup ratusan ribu. Saran ttp ke online",2025-12-20T18:12:46Z,0
@PianoK-p8s,Kalo bg David udah review tetap hp bagus buat dubeli,2025-12-17T13:24:07Z,0
@ArfanggoYugo,"Bang, gua baru beli pocof7, bayangan sama cas, udah cek IMEI ke situr resmi xiaomi dan legit, kena harga 4,3 wajar ga bang? Minus kotak cecer",2025-12-16T11:51:56Z,0
@LINTANG6661,Ngeri 🥶🥶,2025-12-16T11:35:40Z,0
@cheryautobsd,user f5 nyimak 😅,2025-12-16T10:37:27Z,0
@gigawatts6640,Mending yg pro atau ultra ya??,2025-12-15T15:10:00Z,0
@market_higgs,Ultra,2026-01-05T05:22:11Z,0
@ETHFoundation-x9m,"Alhamdulillah, udh bisa komen pake poco f7🎉🎉",2025-12-15T10:28:41Z,0
@stradn,Menurut kalian nih hp worth di harga berapa?,2025-12-14T17:18:25Z,0
@Creepyk-i3u,Nonton ini pake poco f7 😸,2025-12-14T14:14:11Z,0
@ElraElra-j1z,hp ini gampang panas tapi dinginnya juga cepet,2025-12-14T06:48:39Z,0
@Dafahalg,Karna frame nya metal gegara metal itu cepet panas buat buang panasnya,2025-12-14T08:43:19Z,0
@zinhell,masih kedut2 harga segitu wwkkwkwkwkk,2025-12-13T13:38:05Z,0
@achmadaryriwayanto,kalo nggak mau kedutan ke Samsung A56 aja 😅,2025-12-14T09:56:12Z,0
@daffanaufal8276,ini belum bisa pake pb magsafe ya ? krn belum support wireless charge ?,2025-12-13T09:45:41Z,0
@achmadaryriwayanto,mana bisa 😅,2025-12-13T22:22:16Z,0
@fashafirmansyah9349,"Udah puluhan kali nonton video ini, semoga bisa ke beli hp ini di tahun depan",2025-12-13T04:31:24Z,0
@achmadaryriwayanto,sabar.... sabar.... gak usah ngespam 😅,2025-12-13T22:22:43Z,0
@fashafirmansyah9349,"Udah puluhan kali nonton video ini, semoga bisa ke beli hp ini di tahun depan",2025-12-13T04:30:51Z,1
@rijkimaulana-d4s,aminn,2025-12-14T01:11:42Z,0
@kiwangoharjo7914,Kayaknya kelupaan review kualitas suara speakernya ya?,2025-12-12T10:25:18Z,0
@alijackron1114,"Kira-kira secara Kamera & Video , lebih bagus X7 Pro apa F7 ya . . ?",2025-12-12T03:13:25Z,0
@nizarfadli4260,Poco ini masih ad iklannya gk ya,2025-12-11T11:21:02Z,0
@indochanelcpt,Tidak ada bang,2025-12-11T18:23:43Z,0
@JohanArdian-yo4dj,bang david mending poco f7 biasa apa yang pro bang david? bingung soalnya mau ngambil yang mana,2025-12-11T07:23:22Z,0
@ariefgunawan9725,Ambil mesin tik aja Bang,2025-12-13T09:18:59Z,0
@JohanArdian-yo4dj,gitar aja pak daripada ngelucu,2025-12-13T14:29:47Z,0
@JohanArdian-yo4dj,orang nanya bener malah di jawab kaya gitu,2025-12-13T14:30:02Z,0
@JohanArdian-yo4dj,cringe,2025-12-13T14:30:08Z,0
@achmadaryriwayanto,​@JohanArdian-yo4djsilahkan aja ke F7 Pro,2025-12-14T09:56:50Z,0
@JohanArdian-yo4dj,bang david mending poco f7 polosan apa yang pro? bingung nie bang mau ngambil yang mana,2025-12-11T06:42:19Z,0
@pad_gaming,Apa cuma saya aja yang gatau apa itu game gensine😂,2025-12-11T01:26:06Z,1
@davebenayawalujo6692,Iyasi lo doang kayaknya,2025-12-13T08:02:33Z,0
@pad_gaming,​@davebenayawalujo6692dari dulu cma main game genre sport sih,2025-12-13T08:05:31Z,1
@achmadaryriwayanto,"lo nggak sendiri, gw malah males main Genshin apalagi Wuwa karena nggak tau cara mainnya 😅 lah bisanya cuman MLBB, EA FC Mobile sama eFootball hehehe",2025-12-13T22:24:01Z,1
@pad_gaming,​@achmadaryriwayantoitu perang atau petualangan bg,2025-12-14T01:10:43Z,0
@achmadaryriwayanto,"​@pad_gaming MLBB itu Mobile Legends, yang kedua terakhir itu game bola semua 😅",2025-12-14T01:18:57Z,0
@indus3music,jelas kamera nya bagus soal nya cipset nya gahar abis,2025-12-10T19:48:22Z,0
@RudiErshi,Baru kebeli,2025-12-09T23:57:58Z,0
@NdUhYuuHuY,Harga brpa bang?,2025-12-10T03:21:44Z,0
@muhammadrizqyalffajri8379,Kebeli Poco F7 gara gara si david,2025-12-09T16:14:11Z,0
@Irulcahgjesedunia,"Masih takut untuk saat ini buat beli hp lewat online, karena banyak kasus penipuan oleh oknum yang nggak bertanggung jawab, tapi sayangnya Poco f7 cuma di jual lewat online 😢😢",2025-12-09T09:45:37Z,2
@sangpenakutofficial1602,Beli official store nya. Saya beli hp redmi official 2kali Alhamdulillah aman,2025-12-10T01:36:56Z,0
@AlIMAMSAKTI,Bang izin ambil video nya 🙏,2025-12-09T09:33:49Z,0
@pepyucomm,"Saya mulai pakai di awal Agustus 2025 hingga saat ini masih tetap menggunakannya berkat refrensi dari chanel ini
Thanks bro
Poco F7 👍⭐⭐⭐⭐⭐👍",2025-12-09T05:55:44Z,1
@Nicomarcisio,"feel megangnya enak ga bang pas rec vidio/main game? kata orang orang bobotnya berat+agak tebel, sama sering overheat ga bg pas main? niat mau beli pas januari 2026",2025-12-09T14:37:08Z,0
@pepyucomm,"​​​​@Nicomarcisiomain game sperti HONOR OF KING ,PUBG,FF,MOBILE LEGEND,FULL rata kanan nyaman..untuk pegang 1 tangan sangat ok bagi jari2nya panjang...klo sperti saya yg jari2nya sedikit pendek rada sulit juga,harus pegang 2 tangan...
Untuk bobotnya memang rada berat karna bodynya sperti besi😊
Soal ketebalan 11-12 sama dengan iphone
Untuk overheat sih relatif ya...tergantung game yg dimainkan + sinyal juga sangat berpengaruh...agar lebih nyaman saat bermain game berat...lebih baik pakai kipas pendingin...
Feel merekam...motret untuk 1 tangan rada sulit karna unitnya gede...bagi yg tangannya gede & jari2 panjang sperti David it's all ok
Saya biasa merekam pakai 2 tangan mode landscape😊",2025-12-09T15:00:11Z,0
@Nicomarcisio,"​@pepyucommsipp, thankyou banget bangg riviewnya, makin yakinn saya beli f7 pas januari",2025-12-09T15:29:50Z,0
@KuswoyoSikuswoyo,Bro lupa kalo 5g,2025-12-05T14:13:34Z,1
@dayanaiyana0901,Untuk jangka panjang mending Poco F7 ato Samsung A56 5g ? 🙏,2025-12-05T02:32:59Z,2
@lmaokanglmao,"Tergantung Kak, Kalo Camera/Update Software Samsung Kalo Game Poco",2025-12-08T12:31:43Z,1
@bernadusnovaldoedoks3534,siapin dulu. duitnya,2025-12-10T10:30:34Z,0
@randimahage6042,"Liat aja ram mana lebih gede
Gk bohong kedepan nya aplikasi pada rakus makan ram

Dulu ram 4gb udah wah, sekarang mangap mangap

Gitu seterusnya",2025-12-10T12:29:38Z,1
@dayanaiyana0901,​@lmaokanglmao Oke terimakasih jwban nya 🙏,2025-12-10T14:11:37Z,1
@dayanaiyana0901,"​@bernadusnovaldoedoks3534Alhamdulilah sdh ada, mangkanya ini tnya² dulu sebelum beli 😊",2025-12-10T14:12:36Z,0
@Rumahantu-t9f,Bagi satu pocof,2025-12-05T02:24:11Z,0
@achmadaryriwayanto,"kerja dong, doi juga kerja kalee 😅",2025-12-13T22:25:14Z,0
@henrycofebtian6003,Ada audio jacknya gak sih ini?,2025-12-04T09:27:03Z,0
@stayonad1147,"Target Thun 2026, karna hp dah rmulai mnta ganti😂",2025-12-03T18:19:05Z,2
@crazylazy1397,Sekarang aja bang takutnya tahun depan harganya naik gara gara RAM makin mahal,2025-12-15T05:28:23Z,0
@mzamrozzy,dah mulai naik HP harus beli skrg,2025-12-25T05:17:29Z,0
@Yb0114,👍👍,2025-12-03T13:56:51Z,0
@PutraPutra-ku3tp,"Bingung cok,saya pengen cari hp yang gaming,ramnya gede,dan kameranya bagus,😭",2025-12-03T13:48:29Z,0
@arifinerlanggaofficial9340,tunggu x8pro aja,2025-12-05T08:29:39Z,0
@Alchan23,Bagi wallpaperr sinchannya bg,2025-12-03T10:47:18Z,0
@Mojang_tampan,"Seberat apapun genshin tapi akan tetap kalah jika melawan Minecraft vibrant visual + prizma visual/vanila reforged rata kanan,dan buang banyak item di satu tempat,satu lagi summon banyak mob di dekat(apalagi wither) 🗿",2025-12-02T14:42:22Z,3
@firdalaw9335,Akhirnya bisa komen pake poco f7 🫢🥳,2025-12-01T00:34:26Z,0
@sangpenakutofficial1602,Gimana bang sekarang masih enak ga?,2025-12-10T01:37:43Z,0
@alldysyaputra3555,Otw beli ini mah gassss,2025-11-30T05:44:08Z,0
@indahpuspitasari2637,"Udah nyimakk lagi. Karna udah 5taun, th 2020 beli Poco x3nfc. Mau cari2 buat beli th depan.",2025-11-29T04:42:02Z,0
@AmRiKzz3,gmn skrng udah ganti? kebetulan saya juga poco x3 nfc masi liat2 yang bener2 cocok buat upgrade,2025-12-30T13:22:59Z,0
@indahpuspitasari2637,​@AmRiKzz3belum Nemu yang srek kak.,2025-12-30T13:27:57Z,0
@ewanfit2360,Gw ganti hp karna rusak atau hilang ...sekarang mau Minang Poco f7 ...,2025-11-28T01:55:54Z,0
@vinsenukel6180,Buat main Game Bagusan poco f7 atau poco x7pro,2025-11-27T10:20:44Z,0
@azharkarlina9840,"Dan akhir nya saya beli poco 7 ini😊
Puasa seperti judul nya sang raja telah kembali",2025-11-27T06:46:41Z,2
@rsk_rmdn29,Alhamdulillah skarang udh bisa komen pake hp POCO F7,2025-11-26T07:05:50Z,1
@drianoconner855,Sama bang baru 1 hari😅,2025-11-26T11:50:24Z,0
@arif.joestar,Sama dong kita,2025-11-26T14:11:59Z,0
@arif.joestar,​@drianoconner855sama jg baru 1hari😂,2025-11-26T14:12:08Z,0
@drianoconner855,​@arif.joestar gimna bang day 1 pake f7,2025-11-26T14:21:45Z,0
@nadiahanifah6707,​@arif.joestarbuat hasil foto dan video gmna kak? Batre boros ga kak?,2025-11-28T11:20:30Z,0
@farhanxyz6900,"Udah CO di toko oren, semoga aman dan mendarat dengan selamat",2025-11-26T05:05:07Z,0
@andigoFama-n8x,"Riview yang jadi makin yakin gw buat beli ini hp huhuhu, kerennn 🔥🔥🔥🔥",2025-11-26T02:59:40Z,10
@GEpApj,HAAAH... GA SALAH GW KALO NYARI HP KE CHANNEL LU BG... MAKASI BG... F7 NI KETEMU JUGA DARI LINK LU...,2025-11-25T23:12:16Z,0
@ajengaini5436,Saran Dong Bang David Kalau mau Yang Gaming + Kamera bagus mendingan ambil poco x7 pro 5g apa poco f7 ya,2025-11-25T16:00:43Z,0
@radzig,"f7 ama iqoo z10r worth it mana ya abang abang, lg bingung ni😢",2025-11-25T05:39:33Z,0
@GRENMAR_YT,Bang David enak hp Poco f7 apa IQOO Neo 10 untuk gaming dan daily,2025-11-24T14:19:51Z,0
@arigosanchi9585,"Gan mau tanya,apa spearkernya stabil",2025-11-24T13:15:39Z,0
@janesulistiani4146,"Satu hari yg lalu gw abis ngejual IP 14 pro gw yg penuh kenangan , jual krna terpaksa , ada kebutuhan ekonomi, akhirnya sebagai gantinya gw beli Poco f7, lumayan masih ada kembalian beberapa juta dari ngejual IP 14 pro gw ,  gmn ya jelasinnya, sedih banget ngelepas hp gw yg penuh dgn kenangan itu, dan udh sangat nyaman dan terbiasa banget make hp lama gw, gw blm terbiasa make Android Poco f7 ini, kadang masih keingat dan kangen sama IP yg udh gw jual 😢",2025-11-24T10:41:06Z,1
@MulMolMusic,Jangan sedih kak,2025-11-24T23:36:46Z,0
@Direct-Handler,Cantik. Dah pesen tadi.,2025-11-23T06:31:03Z,0
@romy_hb1909,"Nunggu buat libas yg lain
Tp duit konsumen sudah terlanjur dibeliin hp lain 😂😂",2025-11-22T12:05:46Z,0
@romaztapaz2232,"Pingin beli Poco bang sebenernya😢, cmn karena saya tinggal di jepang,dimana HP Poco tidak diset dgn felica chip, saya jdinya beli Samsung",2025-11-22T01:10:22Z,1
@youtubekangmaskoko,Jadi buat kamera bagusan f7 atau x7peo,2025-11-21T13:50:17Z,0
@deasypratama2570,jadi kalau menurut gw ya bang (menurut gw) kalau kamera x7pro kalau game F7,2025-11-22T08:24:50Z,0
@synergy_fc,KING,2025-11-21T09:59:42Z,0
@Gadis-Mbako,"terimakasih poco 🥰, puas banget pakek F7 dengan uang yang pas aja.",2025-11-21T06:04:57Z,1
@ismailwafi212belalangmanjah,Kk udah beli😊,2025-11-21T14:31:37Z,0
@Gadis-Mbako,​@ismailwafi212belalangmanjah iyaaa udah 1 bulan jalan,2025-11-22T04:02:21Z,0
@Nicomarcisio,"feel megangnya enak ga bang pas rec vidio/main game? kata orang orang bobotnya berat+agak tebel, sama sering overheat ga bg pas main? niat mau beli pas januari 2026",2025-12-09T14:38:55Z,0
@bhurias,Loh itu kok speakernya mono bukan stereo?🤔,2025-11-20T18:29:17Z,0
@nocomment1010,Stereo,2025-11-22T02:08:15Z,0
@gibranfaqih6123,"Mau  beli ini belum kesampaian 

Mogo2 cpt dpt rejeki utk beli hp ini. 

Hp ini lebih dr cukup.",2025-11-20T13:19:03Z,0
@SantaiDonk-u3y,Saya suka layar lebar besar..,2025-11-20T05:35:53Z,1
@SantaiDonk-u3y,"Mati asus rog.
Pantas turun harga 55jt
Asus 
Pembaruan pun 2 tahun",2025-11-20T05:33:55Z,0
@Baper-cabut,Nunggu f8 ah,2025-11-19T17:52:22Z,0
@HIDUP_KARENA_ALLAH,Gw masih trauma sma android yg kalau udah 3-5 tahun pemakaian mulai lemot ngadet2😔,2025-11-17T07:21:13Z,1
@MuhammmadTristan,9:48 lagi fokus mikirin beli apa kagak malah ada penampakan 😰,2025-11-16T06:14:57Z,0
@irman8572,"Udah beli,akhirnya ganti juga setelah 6 tahun pake realmi 3 pro",2025-11-15T16:06:50Z,0
@PancaSaputra-w7c,Lebih wort it poco f7 apa oppo reno 14f ya,2025-11-14T12:15:06Z,0
@boboho8354,sampai sekarang masih pakek poco m3 pro soalnya hpnya masih bagus dan awet meski dipakai main game trus 😂,2025-11-14T12:06:15Z,1
@Aankrnwn,Buat maen pubg lancar gk ya,2025-11-14T00:54:26Z,0
@Argihermawan,3 tahun lalu beli hp sesuai recommended dari bang david  ya itu realme 10pro 5g Alhamdulillah masih sehat ini hp sekarang ingin ganti hp karna hp ini mau di kasih ke ade saya,2025-11-13T10:37:51Z,0
@denafofficial2,info type internalnya dong,2025-11-13T06:56:53Z,0
@PutriyuliaAndini,makk mau ini😭,2025-11-13T05:18:44Z,0
@ghilbyRijallana-m1r,Wkwkw ambil iqo neo 10 aja breee,2025-11-13T13:38:57Z,0
@undersky_official,Mau beli besok 😊,2025-11-12T18:09:14Z,0
@brianwahyumaulana4060,Kak David coba boxing REDMI TURBO 4 TITISAN POCO F7,2025-11-11T13:16:34Z,0
@WDPCKR-vi4md,"Udh kebeli poco f7 gue dpt promo 11.11 dr toko ijo so far enak sih hp nya, apalagi internalnya gede banget, sm pindah2 aplikasi cepet lalu build qualitynya solid...",2025-11-10T16:29:48Z,0
@tipskehidupankita,Brp harganya bang,2025-11-10T20:15:33Z,0
@WDPCKR-vi4md,"​@tipskehidupankitagw dpt di 5,4 bang",2025-11-14T14:11:37Z,0
@Presidencraft.,5 jutaan mending f7 apa ip seken ya 😭😭bingung,2025-11-10T13:43:29Z,1
@daisumma,Ya f7 lah😭,2025-11-10T14:01:34Z,0
@Presidencraft.,"​@daisummaok bg, langsung fix nih, tapi paling klo duitnya udh ready f8 dah rilis😭",2025-11-10T14:03:29Z,0
@andikajulianto8730,"Poco f7, belum stereo yah speakernya.??",2025-11-10T08:42:44Z,0
@gabrielasormin3369,"Gak usah beli unit ini. Baru aja kemarin mati total dan kudu nginep 1 minggu nunggu stok mesin baru datang, dan setelah aku, ada 1 pengunjung lagi yang datang dengan keluhan yang sama. Produk bapuk!!! Kecewa bgt!",2025-11-10T05:51:56Z,1
@12didipurnomo69,Rill kah bang,2025-11-11T07:44:35Z,0
@Snsb666,nyimak yang dari awal rilis ampe sekarang aman2 aja 😊,2025-11-11T11:10:12Z,0
@gabrielasormin3369,Rilllllllllll,2025-11-12T12:10:47Z,0
@LaraSagita-c7k,Poco f7 apa samsung A56 ko? Bingung bangett...,2025-11-10T00:52:35Z,0
@mogami-san4012,"Pengen banget tapi IQOO Z7 5G ku baru setahun digunakan 🥲
Jadi dilema buat beli atau tidak",2025-11-09T16:14:34Z,0
@haryadidarmawan2158,"Hp saya sekarang Xiaomi 11t, tapi sekarang udah boros batre nya😂, karna sering bgt ngecas sambil maen game.",2025-11-09T05:49:41Z,0
@muhammadalvifakhrudin3736,Untuk update sofwarenya brp lama ya? Info nya dong,2025-11-09T01:05:19Z,0
@MrBe4nn,"lahh,,review speakernya mana??",2025-11-08T07:13:48Z,0
@invinciblepeople1663,Lagi CO hp ini,2025-11-08T06:31:34Z,0
@raflinharun1078,Nonton pakai f7❤❤,2025-11-08T03:38:20Z,0
@pepenk_alfia_0905,"Bagus sie ini 
Cuman panas nya itu loh 😢😅",2025-11-07T05:14:34Z,0
@onesimusaconglie3790,Nonton pakai hp poco M5,2025-11-06T23:40:29Z,0
@timekeeper9,Perekaman videonya bagus banget. Stabil,2025-11-06T15:43:11Z,0
@cecepsholahuddin8061,"hp saya masih Infinix hot 11s nfc, itupun sudah di servis berkali kali, dan skrng tetap rusak... saya ingin beli hp baru, seperti poco f7 tpi selalu tidak bisa karna ekonomi, semoga nanti saya bisa beli hp baru secepatnya... bismillah",2025-11-06T09:10:31Z,0
@hafasa,Pingin dah,2025-11-06T09:05:17Z,0
@1.maderesawibawa_tl369,Mending poco F7 atau X7 pro ya,2025-11-06T00:07:29Z,0
@mukidi708,"Gara"" bang david saya beli hp ini mantap bener terimakasih bang david",2025-11-04T12:03:56Z,1
@Synin01,"Semoga bisa kebeli jg tahun depan 😂 , kalau ga ada f8 wkwkwk",2025-11-04T20:27:16Z,0
@Nicomarcisio,"feel megangnya enak ga bang pas rec vidio/main game? kata orang orang bobotnya berat+agak tebel, sama sering overheat ga bg pas main? niat mau beli pas januari 2026",2025-12-09T14:39:49Z,0
@cmr9928,"Bagus desain nya

Mirip Iphone",2025-11-04T11:55:49Z,0
@Lanz.kulkul,Nih hp masih worth it untuk 2 tahun mendatang gak?,2025-11-04T10:15:55Z,0
@gebytbg2858,"Setelah sy bandingkan A56 5G dan Poco F7 5G..mmng LBH oke utk jangka pnjang,bedanya Samsung berani kasi update OS 7 thn",2025-11-03T15:34:53Z,0
@AerisDanielle,Yang ini ada iklannya gak HPnya?,2025-11-03T13:39:06Z,0
@petroenggine8314,Semoga bisa upgrade dari realme xt 🙏,2025-11-03T12:03:36Z,0
@aniimetv1,"Paling kapok beli Infinix,buat game Battery kya mau meledak😂",2025-11-03T03:55:36Z,0
@leonotuslopen2897,Kamera untuk foto dan vidio bagus mana ya antara poco f7 sama xiaomi redmi note 10 pro?,2025-11-02T11:26:43Z,0
@ujangamida6509,Coba saran dong saya punya dua pilihan  buat beli hp pertama saya jatuh cinta sama samsung a56 di sisi lain kaya pengen poco f7..jadi mendingan poco f7 atau samsung a56 ya...,2025-11-02T03:58:56Z,0
@nieldanz663,"Bang HP yg abis lu review, lu kemana in bang? Jual lagi atau di simpan sendiri bang?",2025-11-01T16:32:37Z,0
@Sofyan_Darwis92,Kadang disponsori/sipinjemin sm brandy.,2025-11-02T03:39:09Z,0
@irivanicfp,Ini hp ada iklan gak ?,2025-10-31T15:51:56Z,0
@rizkirahma495,"Tes nya main wuwa bang, apa itu genshit",2025-10-31T12:39:51Z,0
@rizkirahma495,"Saya sudah xiaomi dari tahun 2018, dari note 4 pro, sekarang mi 12T, rencana mau upgrade ke poco f7",2025-10-31T12:37:56Z,0
@ciptadarmawan3128,"Jadi rekomend mana bang, mending F7, F7 Pro apa F7 Ultra? Diliat dari ke-worthitan harga",2025-10-31T02:41:08Z,0
@AleeshaOshin,Buset garis antena nya banyak banget😂,2025-10-30T16:31:12Z,0
@rudisaputra2910,Anabul Lover🐱,2025-10-30T09:49:42Z,0
@dimasrajinngaji,itu bener harga nya 6 jutaan?,2025-10-30T07:46:38Z,0
@RobertHansehkgj,Pake m4pro ngiler Parah lihat f7,2025-10-29T17:31:15Z,0
@Rezzaharya,"Gw nonton ini pake poco f7  wkwkwk 
Penasaran lagi pdhl udh liat dulu",2025-10-29T15:12:31Z,0
@dapaaawe,Beli dimn bg,2025-11-06T00:39:35Z,1
@Rezzaharya,​@dapaaaweditemen bang dpt 5.8,2025-11-06T01:00:14Z,0
@bobcut2022,​@Rezzaharyabarunya 5.5 tuh,2025-11-30T09:49:53Z,0
@Rezzaharya,58 anjir,2025-11-30T11:37:59Z,0
@mzamrozzy,​@bobcut2022dah naik 6 juta,2025-12-25T05:30:27Z,0
@samsonbakri8275,Mendi poco f7 apa samsung s24 fe bang,2025-10-29T12:51:22Z,0
@takhisinata,"Dr jaman redmi note 4 sampe skrg msh setia sm xiaomi, skrg msh pake redmi note 11, pgn cari referensi hp baru sih, msh bingung antara poco f7, reno 14, atau redmi note 14 pro",2025-10-29T07:12:21Z,1
@ferlyanawhn8826,Info bang jd pick yg mana wkwk,2025-10-31T04:41:45Z,0
@takhisinata,​@ferlyanawhn8826masih bingung bang..akakkakakka takut nyesel krna ga sesuai ekspektasi..,2025-11-28T09:46:27Z,0
@Evie.istiana,Mending mana sih poco f7 samsung a56 atau vivo v60?,2025-10-28T09:15:09Z,0
@johnysamara1845,Mending.......,2025-10-27T22:30:39Z,0
@antasenablitar,"Ane pake poco m4 pro 😅:
- Jatuh uda ratusan x
- baterai nya super awet
- game lancar",2025-10-27T15:39:12Z,1
@RobertHansehkgj,"Sama m4pro user 
Tahan banting 😂",2025-10-29T17:25:38Z,0
@prayernugraha,itu samsung apa guys di detik 0:51,2025-10-27T13:40:43Z,0
@Satya-y9v,A56,2025-11-04T21:21:28Z,0
@RahmaIpaliyaa,Dari ip 12 mau gantii poco f7😊❤,2025-10-27T06:22:40Z,1
@WarungElpe,Mnding f7 apa x7 pro ya bang,2025-10-27T03:47:23Z,0
@Tabibito原神,Punyaku udh d jual dgn harga 1 juta... Damn,2025-10-27T01:25:37Z,1
@ArsyaFabian-w7q,Komburr. Dammm,2025-10-30T04:26:56Z,0
@Adriansyahid_,"meskipun beneran tahan air tapi kok ngeri"" sedep ya kalo cobain langsung di celupin ke air wkwk",2025-10-26T14:49:50Z,0
@FahryyV1,semoga tahun depan kebeli 😇,2025-10-26T13:58:51Z,0
@BowoPra-z5g,Alhamdulillah. Nonton ini 3bulan lalu. Hari ini 26-10-2025 kebeli pocof7. 🥲😊,2025-10-26T13:10:35Z,1
@Rifaldi_Yt,Idaman sih ini,2025-10-26T07:51:51Z,0
@MaMa-pv9je,"bismillah tahun dpan bisa kbeli, biar g pinjem hp k mm trus",2025-10-25T11:08:34Z,0
@Sapryy2005,sama bro,2025-10-25T13:45:58Z,0
@lAmaterasu2,Sayang udah beli Poco versi  X6 pro,2025-10-25T08:47:14Z,0
@BODREXX-t8d,"Klo untuk konten kreator,, lebih bagus mana bg.. Poco f7 pro atau Poco x7 pro",2025-10-25T02:12:55Z,0
@raiga5-6-42,Lebih worth beli f7 pro atau f7 ultra ?,2025-10-24T10:16:02Z,0
@dodypratama7288,ok juga buat jadi hp ke2😂,2025-10-24T09:06:58Z,0
@Dudung_Hs14,"udah 3 tahun pakai poco m4 pro sekarang bingung mau ganti hp pilihan nya antara iqoo neo 10 / poco x7 pro / poco f7 saran nya dong sepuh gadgetin hp buat harian,main game (ml sama roblox) suka foto juga ambil yang mana mending an?",2025-10-24T07:15:15Z,0
@skakhunter8034,"Kalau suka foto tentu poco x7 pro sih, tapi untuk game berat antara iqoo sama f7, kalau kamera iqoo nggak recommended.",2026-01-16T00:46:39Z,0
@reynotheng8280,Main Wuthering lancar gk ya bg? 😊,2025-10-24T05:04:58Z,0
