author,comment,publishedAt,likeCount
@sopiansauri4381,"Yup, udh gk pernah ngelirik poco, jalan 3 tahun langsung bootlop itu Poco, ilang semua data gw
Skrg pake iqoo neo 9 16/512
Bwt jangka panjang yg pasti2 aja, kyk samsung, vivo, iqoo",2025-06-27T16:10:02Z,0
@NolieDjasmie,"Ngak sabar pingin nyoba ini hp, udah check out kmren..tp masih nunggu 1 minggu karna masih kerja luar kota 😅😅",2025-06-27T15:59:19Z,1
@irfankasyafani8515,Keren sih HP menurut gua😍,2025-06-27T15:58:19Z,0
@arendimarta6308,Tim yg baru mampu beli Poco X7 😅,2025-06-27T15:56:36Z,1
@EdyCypert,Tolong dong buat brand2 hp. kabel chargernya jangan warna putih soalnya cepet kotor..,2025-06-27T15:55:32Z,0
@zanFariz,Buat main wuwa bisa playable ga ya di set medium+,2025-06-27T15:55:23Z,0
@nasyakamila974,"Tecno Pova 7 yang baru keluar 25 june 2025, Kak David",2025-06-27T15:54:55Z,0
@ravimuhammadazhar8595,ngilerrrrr f7 sekeren ini,2025-06-27T15:53:03Z,0
@cehawewehendrywahyuwidodo1824,Ama ROG Phone 9 FE bagusan mana ya ?,2025-06-27T15:51:36Z,0
@edgarjuntak,kan beda spec dan harga sih. beda kelas juga. oalah.,2025-06-27T15:52:54Z,0
@cehawewehendrywahyuwidodo1824,"Paham kak , tinggal jelasin bagusan mana soalnya F7 udh pake snapdragon 8 gen4 (bicara dengan nada lembut)​@edgarjuntak",2025-06-29T03:16:26Z,0
@MuhammadRifkhan-c5w,Bang spell tecno pova 7,2025-06-27T15:49:54Z,0
@mavis.vermillion.v,ngiler klo sm poco f7 ini fix nabung dulu kamera dpt spek badax😭 buat nyandingin ip xsku dari 2020 yg udah kepanasan buat ng game😂,2025-06-27T15:46:05Z,0
@djdomirmx,poco f4 nyimak 😊,2025-06-27T15:46:01Z,0
@windows9t488,"dari sini gua rasain kamera apapun tpi ada embel"" dari fotograp macam leica zeis g mate selain itu kerasa b aja meskipun kamera bagus",2025-06-27T15:45:13Z,0
@AbdulRohim-i2q2z,Alhamdulillah Udah bersyukur banget walaupun dapet adiknya poco x7 pro di harga 4.7😊😊,2025-06-27T15:43:47Z,0
@ilestone09,"Nunggu redmi turbo, eh kok poco F7 yg muncul",2025-06-27T15:43:19Z,0
@SenaSetiaji,👍👍👍,2025-06-27T15:41:53Z,0
@ipungtok8518,tecno camon 40 pro 5g atau redmi note 13 pro 5g mana yang rekomen,2025-06-27T15:40:40Z,0
@sukajar4822,real me c75 bang,2025-06-27T15:40:35Z,0
@viewreviewajalah,Dari dulu juga layarnya poco biasa aja kgak ada yg bagus..kecuali f5 pro klo g salah pake layar oled tapi itu juga inter dan china doank kgak masuk indo,2025-06-27T15:38:48Z,0
@CharlesBaker-e2p,"헣헨헟헔헨헪헜헡 gak ngajak ribut, tapi bikin betah",2025-06-27T15:38:13Z,0
@Schwinister69,gokil,2025-06-27T15:36:16Z,0
@orangZozi,Bg Tecno Pova 7,2025-06-27T15:35:39Z,0
@pheluphei,Kagak by pass charging 😔😔,2025-06-27T15:33:59Z,0
@Syahrul-ls1ku,"rim yang nonton doang, gk beli😂",2025-06-27T15:33:50Z,0
@ronirdk,Saya saja masih pake poco F1 sampe sekarang😢,2025-06-27T15:33:19Z,0
@muchhasriwijaya8470,Semoga yang nonton vidio ini bisa beli HP baru 🙏🙏,2025-06-27T15:31:42Z,0
@Dokterpedia,"Gw ganti hp 5 tahun sekali, karena lebih ke penggunaan bukan ikut trend atau gaya gayaan,kalo kalian?",2025-06-27T15:31:29Z,0
@ahapzhu,Sama aku pakai sampai rusak baru ganti,2025-06-27T15:32:44Z,0
@edgarjuntak,"aku beli hp untuk gaya2an kak.
sekali setahun ganti.",2025-06-27T15:53:51Z,0
@oditya_sriadi7388,"Poco F1 ku aja msh awet hingga skrg, 
Aku beli lagi poco f7 ini tuk Gantiin Poco F1 nya yg nantinya dihadiin buat ank yg br msuk SMP. Sungguh sngat menghemat budget pengeluarankan🙏",2025-06-28T12:37:26Z,0
@onnosembrenget7439,"Spesifikasinya memang mantap buat gaming dan scrolling sosial media, tapi pas masuk Indonesia tampilan belakangnya alay bet dah pas awal rilis, keren ada RGB di bulatan kameranya plus tampilannya elegan banget. Oh iya nama hp nya Redmi Turbo 4 5G, terus di rebranding menjadi foco f7",2025-06-27T15:28:29Z,0
@andrianleosaputra9062,"Alhamdulillah sudah beli Poco F7 Pro bang, dan beneran gokil bgt hpnya, good job Poco Indonesia",2025-06-27T15:25:53Z,0
@BoyzAquatic,Seperti kata orang orang cinta gak harus memiliki kan😍😍dr awal gw pake xiomi redmi 4X redmi note 5 sampe terakhir redmi note 10 gak pernah nyesel dan selalu puas pake hp brand xiaomi harga murah tapi kualitasnya bukan kaleng2🔥🔥,2025-06-27T15:24:43Z,14
@liaaulia2667,Wah kita sama bang pecinta Brand Xiaomi 😂 skrg masih pake renot 11 😅,2025-06-28T14:19:40Z,0
@BoyzAquatic,​@liaaulia2667iy mbak xiami udh paling the best sih gak mau lagi pake brand merk Laen😁,2025-06-28T15:24:09Z,0
@aprilday6893,spek hampir mirip sama poco f6  cuma beda di chipset dan tampilan serta baterai,2025-06-27T15:24:31Z,0
@Advento21,Episode selalunya nyobain barang aneh,2025-06-27T15:23:24Z,0
@vansfans2225,"Dari segi kamera biasa aja masih bagusan xiaomi, realme. Kalok dipake buat main game bagus siih tapi klok di pake agak lamaan puanas pool foco ni. Kalok kalian cari buat main game mending iqoo  sih, karna panas nya merata.",2025-06-27T15:22:25Z,0
@BoyzAquatic,Mantap xiaomi hp merk laen lewattt🤣🤣,2025-06-27T15:21:22Z,0
@rifefera,Tecno pova 7 bang,2025-06-27T15:20:54Z,0
@aganpehulxd2411,apakah akan jadi gorengan ni hp ?,2025-06-27T15:19:10Z,0
@biruamer4764,kalo nanya pake tanda tanya,2025-06-29T16:29:17Z,0
@Official_ArgaOmpu24,Udh ke deluan jagat review bang udh di review sama mereka bang,2025-06-27T15:18:25Z,0
@rizkynt,Intinya gue mau beli buat di siksa maen game. Supaya S 25 ultra gue pokus di pakai aja.,2025-06-27T15:18:04Z,0
@tukangtahubulathd,Ada esim gk sih,2025-06-27T15:16:40Z,0
@edgarjuntak,ga ada bg,2025-06-27T15:54:34Z,0
@biruamer4764,kalo nanya pake tanda tanya,2025-06-29T16:25:17Z,0
@KinanBana,𝐌𝐚𝐬𝐢𝐡 𝐛𝐞𝐫𝐭𝐚𝐡𝐚𝐧 𝐝𝐞𝐧𝐠𝐚𝐧 𝐯𝐢𝐯𝐨 𝐳𝟏 𝐩𝐫𝐨❤,2025-06-27T15:14:21Z,0
@aguskurniawanto-l1q,"Bang david tolong info nya bang saya pake hp itel s23 plus sudah 3 tahun, dan sekarang baru nemu kerusakan hilang signal dari kartu provider tapi slot simcard bisa ngebaca kartu bang, saya minta tolong untuk info service atau apakah betul jenis itel s23 plus emai nya di blokir oleh bea cukai. Terimakasih bang david saya mohon bisa di bantu dan di jawab oleh bang david.",2025-06-27T15:13:59Z,0
@edgarjuntak,mampir aja ke service centre itel dikota mu bang.,2025-06-27T15:55:16Z,0
@msaaagi1606,Mending Ini atau 14t?????,2025-06-27T15:13:49Z,1
@edgarjuntak,mending f7,2025-06-27T15:55:25Z,0
@biruamer4764,biasa aja kali tanda tanya nya,2025-06-29T16:19:34Z,0
@danijabrik1232,Klo mw blili hp.... Cek rivieww bang david dulu ah😊😊,2025-06-27T15:10:48Z,0
@upi8561,coba bahas Tecno pova 7 bg,2025-06-27T15:09:18Z,0
@YayolPemalang,bang coba review poco m7 pro 5g,2025-06-27T15:08:29Z,1
@kelvin.6951,poco f7 ini klo uplod story ttp ngeblur gk? 😅,2025-06-27T15:08:26Z,0
@TOYIBVERSE-y3h,Bang review TECNO POVA 7,2025-06-27T15:07:27Z,0
@Zanakh,"maaf bg mau tanya, untuk perbandingan redmi 13x vs redmi 14c better yang mana",2025-06-27T15:05:29Z,0
@sylphy94,kaga test wuwa 😂😂,2025-06-27T15:05:23Z,0
@SkyZaaa,"Udah ada poco f7 aja, dan gua masih poco m3 dari 2021🗿",2025-06-27T15:05:14Z,0
@BuayaDarat21,Bang review nova 13 pro dong,2025-06-27T15:05:02Z,0
@Pakupayungcok,AI nya gmn tuh,2025-06-27T15:04:15Z,0
@biruamer4764,kalo nanya pake tanda tanya,2025-06-29T16:27:24Z,0
@ombakbiru89,Nah ini bebas iklan,2025-06-27T15:03:39Z,0
@Ivandysatria27,Info hp dengan kamera bagus terbaik di harga 5-7 juta donk bang,2025-06-27T15:03:19Z,0
@Cluenzy,Kayaknya udah harus upgrade memang dari Poco F1 ini wkwkwk,2025-06-27T14:59:29Z,0
@MerliSusanti-o4r,Bang review infinix xpad gt dong,2025-06-27T14:59:23Z,0
@48.HARENDYP.MANURUNG,poco f7 vs xiaomi redmi note 13 pro 5g better mana ya?,2025-06-27T14:58:06Z,0
@theprayuda8538,"Gilaaa sih ini hp dengan harga segitu wow banget, btw gw sering ke cp tp ga pernah ktmu bang david ya😂",2025-06-27T14:57:30Z,0
@HeroBlnd,My rival🗿,2025-06-27T14:55:33Z,0
@friendku5x502,mau beli trauma dengan kualitas poco layar lumut dan baterai mudah kembung😢menyedihkan,2025-06-27T14:55:04Z,0
@Paman_Gobber,Cuma 1 kekurangannya ga ada bypass charger,2025-06-27T14:54:26Z,0
@Duaha-je7ii,Redmi turbo 4 pro,2025-06-27T14:52:32Z,0
@azmiazharbriliana5798,"Demi allah. Poco f7 baru smpe kelar mindahin data. , test kamera langsung blank layar gua hitam, di restar power telen cuma getar ga ada logonya..  Din pencet layar masih geter cuma ga ada tampilannya aja anj*** , gua langsung telpon sho**e  di suruh balikin dana",2025-06-27T14:51:39Z,0
@biruamer4764,udah tau poco ahlinya matot tapi masih aja dibeli,2025-06-29T16:34:54Z,0
@leolejo4891,"Saya menonton ini menggunakan poco X3 gt, dan sangat puas, skrg kluar lgi yg mantap ini, lsg masuk referensi buat tahun dpn.👍🙏☺️",2025-06-27T14:49:53Z,0
@koyangsilver1287,Gak sabar nunggu bg david review huawei nova 13 pro... belum bisa tertarik sama hp kalau belum di review bg david,2025-06-27T14:49:31Z,0
@kingvcork3461,"Maksudnya gimana ya? Ga ngerti soal urutan poco f7? Sebelumnya yang F7pro saya udah kebeli dan sekarang review f7, maaf ga terlalu ngerti 🙂",2025-06-27T14:49:04Z,0
@nurarisyaalmahira5716,"Kualitas perekaman nya 4k 60fps, internal 512. Jujur agak nyesek sekaligus nyesal ambil Motorola 60 fusion. Kenapa lama kali munculnya F7 ini 😭😭😭",2025-06-27T14:47:58Z,0
@tommywijaya5941,Kamera nya mantul,2025-06-27T14:47:26Z,0
@ianpentagram4373,"F5 udah, F6 udah apakah saatnya nambah koleksi F7 menarik menarik 😂",2025-06-27T14:45:46Z,0
@donniandrean9407,Poco f3 sekarang berapa ya kalau di jual sekarang,2025-06-27T14:43:47Z,0
@zilongadept7188,review tecno pova 7 bang,2025-06-27T14:43:06Z,0
@ockymoze,F7 atau s24 fe?,2025-06-27T14:42:28Z,0
@kevinkwok6855,Ni tuh masih blm support esim ya? Saya butuh banget esimnya buat nyimpen nomor luar,2025-06-27T14:41:41Z,0
@MGmeong,Gw udah pake samsung s24+. Tapi tertarik banget beli ini buat hp kedua. Astaga godaan banget,2025-06-27T14:41:27Z,1
@g3nre711,Hah.. tumben ga review speaker nya bg,2025-06-27T14:40:34Z,0
@thisisnotinfinite,Bang nonton squid game season 3,2025-06-27T14:40:22Z,0
@rickyhd21,"Gua nyari hp android,tapi body iphone, kemarin ada di oppo x8,tapi harganya 2 dijit😂. eh ini muncul, langsung jatuh cinta doong, kaum UMR semoga bisa kebeli ya.😅",2025-06-27T14:40:05Z,0
@biruamer4764,beli aja itel noh model kamera boba 2 jutaan,2025-06-29T17:10:14Z,0
@Keenan2021,foco vs iqoo lagi duel di grup fesnuk 😅😅😅,2025-06-27T14:39:14Z,0
@kerenabis3497,gak stereo ya,2025-06-27T14:39:09Z,0
@biruamer4764,makasih infonya,2025-06-29T16:31:26Z,0
@tfk4604,"maaf bang di sponsori hoyo ga? 
kalo ga boleh coba wuthering wave soal nya lagi nyari buat main wuwa",2025-06-27T14:38:48Z,0
@mtsn4kampar448,"bang, saran dong, hp yg cocok buat main Game Dragon Nest: Rebirth of Legend",2025-06-27T14:38:44Z,0
@TreZz11-ld3tb,Bg review  tecno pova 7,2025-06-27T14:38:38Z,0
@eddykof8958,Xiaomi memang jadi salah satu brand yg jago mendesain HP cakep,2025-06-27T14:38:27Z,0
@syarifmsofficial1394,"Chipset oke tapi makin Tua Kita juga butuh kamera yang bagus.. 

Alhamdulillah sampai sekarang masih tenang dengan memilih Infinix GT 20 Pro dengan spesifikasi gaming dapat dgn cipset Dimensity 8100 penyimpanan juga udh 12gb/256gb banyak, kamera juga udah oke kamera belakanh 108mp depan 32mp dan baterai 5000mah",2025-06-27T14:33:17Z,2
@rizqiahmadghozali5668,"King is back kah, gelo Poco let him cook",2025-06-27T14:32:49Z,0
@fysh5489,Poco gilaa cook,2025-06-27T14:31:05Z,0
@Tamtam_try,Udah CO kemarin buat gantiin poco F1 yang dipakai sampai sekarang 😂,2025-06-27T14:31:04Z,0
@pend-i1b,Bang DAVID Tolong review TECNO POVA 7 bang.,2025-06-27T14:30:58Z,0
@Pieter7ful,"klo Poco bikin tab, itu tab killer juga ga sih?",2025-06-27T14:28:41Z,0
@ali-y1q2q,Kayanya bukan hp nya deh yg salah tapi game ganshin nya yg broken harus di ilangin review game itu ganti ke game kaya PUBG atau game yg lebih banyak peminatnya,2025-06-27T14:28:27Z,0
@akthermake1049,Plislah kukira udh mentok di x7 pro skrng f7 lageee,2025-06-27T14:26:13Z,0
@younglie19,Kalo bang David yg bilang.. jadi ga ada keraguan..,2025-06-27T14:25:22Z,0
@imonha3064,AOD 10 detik apa nyala terus?,2025-06-27T14:25:11Z,0
@FahriNaufal-yl3em,pova 7 coba bang,2025-06-27T14:24:36Z,0
@akunqq334,Tim Pemuja Performa Gaming ✅,2025-06-27T14:24:23Z,0
@bobbygunarso121,Itu klo pas panas dicelupin air beberapa detik biar dingin gitu boleh kah?,2025-06-27T14:23:45Z,0
@hojacu4781,"Di fb pada debat di grup, antara f7 sm iqoo wkwkwk, sampe kata2an, tau pd beli apa kaga haha",2025-06-27T14:21:48Z,0
@stefanusviktor1900,"bang, saya kaum mendang mending, mau minang hp xiaomi/poco takut bloatware xiaomi hyperOS yang sering terjadi, karena banyak review pengguna yang bilang kayak gitu,, Ada masukan/saran bang? thanks before",2025-06-27T14:20:35Z,0
@MasJack30,Tim putih keren bgttt,2025-06-27T14:20:24Z,0
@asnawatyasna6656,Masih setia di 11t😅,2025-06-27T14:20:11Z,0
@jahboykribo3038,oke gass bli ini sung,2025-06-27T14:19:54Z,0
@fatmawaty5942,"Akhirnya, dah muncul review nya, bolak balik YouTube cmn nunggu postingan ini😂😂",2025-06-27T14:19:32Z,0
@Acchane,Kali ini poco benar benar membuat aku tertarik,2025-06-27T14:19:28Z,0
@himura05,raja kok banyak iklan 😢,2025-06-27T14:18:18Z,0
@Yoman-i8y,Bang bahas Tecno Pova 7,2025-06-27T14:17:45Z,0
@zandra19,"Seri Snapdragon yg pake ""S"" dibelakangnya itu masih belum optimal",2025-06-27T14:17:00Z,1
@ArsyaddMuhammad,Pova 7 kapan,2025-06-27T14:16:31Z,0
@biruamer4764,kalo nanya pake tanda tanya,2025-06-29T16:39:21Z,0
@CantasNala,riview infinix smart 10 bang,2025-06-27T14:15:59Z,0
@ShafaElectric,"poco f7 b aja, bagus aja.👍",2025-06-27T14:14:46Z,0
@RRsports7,Nunggu second 😂,2025-06-27T14:14:37Z,0
@masndo_29,ga semua orang beli hp karna genshin impact😓,2025-06-27T14:11:29Z,0
@adjiherlana2593,"Keluh kesah pake f6 versi gw
Hp ketindihan pas ketiduran di kasur busa bangun² pas bgt ada di bawah punggung eh framenya langsung bengkok bejirrrr ( padahal pas pake poco f1 sering bgt ketindihan aman² aja )
Gasengaja nyenggol benda keras eh sudut framenya langsung penyok (padahal ga keras² amat, tapi mungkin karna sudut framenya hampir kotak jd gampang mleyot)
Sbg opreker dari jaman redmi note generasi pertama sampe terakhir oprek poco f1, skrng pas pake f6 berasa ngebatin bjirrrr ama performanya yg limit parah, mau di oprek males bgt harus war ubl nya, syg juga msh garansi (dulu sih gw tiap gonta ganti hp udh lebih dari 10x slalu pake xiaomi baru/second gas langsung oprek bodo amat garansi, semenjak banyak isu matot jd agak was was kena apes, emang sih klo kena apes tinggal claim ke sc nya, cuma gw gamau ribet ngabisin waktu buat mondar mandir ke sc,jd gw nunggu garansi abis dulu baru oprek)",2025-06-27T14:10:56Z,0
@rizkierwindo5100,"Masih pake yg F3, moga2 bisa up ke yang F7",2025-06-27T14:08:44Z,0
@novabento7128,Masih f4 semoga juga bisa upgrade ke f7,2025-06-27T17:25:02Z,0
@ibrahimmajiibantarjati2536,Gnshit naik turun gmnaa wuwa.. very high psti ngeleg jg 😢,2025-06-27T14:06:28Z,0
@abayyoo4252,Aod Poco busuk mending gk usah pake 😵 sayang banget gk bisa kyk Samsung atw yg lainnya. Sya pake f5 liat f7 aodnya sama dong 😂😂,2025-06-27T14:04:54Z,0
@thadesr,8:21 kayak iklan bukan sih yg bagian bawahnya?,2025-06-27T14:04:52Z,2
@goo4776,itu video di mi music,2025-06-28T15:00:19Z,0
@windiseptiani6828,Bg coba infinix hot 60i,2025-06-27T14:04:49Z,0
@MuhammadAfnurazis,solusinya iqoo turunin harga😂,2025-06-27T14:01:16Z,2
@MuhammadAfnurazis,lansung ketar ketir,2025-06-27T14:01:25Z,0
@JamOke-n3c,Bahas tecnho pova 7 bg plis mau beli rekomen GK nih,2025-06-27T14:00:53Z,0
@WahYu-b5u1b,Review speaker Bluetooth lagi bg,2025-06-27T14:00:11Z,1
@Codot7260,ha,2025-06-27T13:59:42Z,0
@DavidKurniawan69,Kalau matot gimana,2025-06-27T13:59:37Z,0
@biruamer4764,kalo nanya pake tanda tanya,2025-06-29T16:28:58Z,0
@trimaryanto8810,hp ya kurang suka,2025-06-27T13:57:55Z,0
@bocilaci2837,Kamera depan ngebug gak,2025-06-27T13:57:47Z,0
@erickchristover4480,Nonton video ini pakek poco f7😙,2025-06-27T13:57:08Z,0
@KroBot-py4zp,"buat kamera yg bagus yg utamanya doang, karna hpnya bullky lagi menyesuaikan tangan karna biasa make hp compact wkwkw",2025-06-27T13:56:21Z,0
@teguhsanjayaofficial4888,Cuma bisa nonton mke realme 11 pro,2025-06-27T13:54:39Z,0
@Okegabut,Pova 7 bang,2025-06-27T13:53:31Z,1
@jaluronline237,"8:33 orng poco:""hmmm..ide bagus""",2025-06-27T13:52:52Z,0
@mathscovery,aku setia dengan poco f3,2025-06-27T13:52:45Z,0
@setanto5888,hhhmmm,2025-06-27T13:52:14Z,0
@goonrider9141,mau ambil iqoo neo 10 eh denger ini harga mirip mirip dapat 512gb mikir lagi,2025-06-27T13:52:11Z,0
@Kazexseele,5:41 sokes mavuika nih,2025-06-27T13:51:22Z,2
@kinoasay1070,Bang huawei nova 13 riview,2025-06-27T13:50:04Z,0
@MifahUddin,Semoga bulan depan kebeli🤲🤲🤲,2025-06-27T13:49:26Z,0
@Garasi225,Tim yang nonton update an doang😂,2025-06-27T13:49:07Z,0
@bubuchi2827,udh beli cuma blm sampe 😂,2025-06-27T13:48:47Z,0
@Tamtam_try,Sama.. mana gak sabar pula buat hands on 😆,2025-06-27T14:32:49Z,0
@dodikdarmawan5978,Reno 14 udah bisa di review kah 😅?,2025-06-27T13:47:44Z,0
@Prikitiww-i5t,poco baterainya mudah melembung dan ngeblank mesinnya.,2025-06-27T13:47:20Z,0
@AsokaTuban,Pova 7 bang,2025-06-27T13:46:54Z,0
@sasukeuchiha5639,"Nonton pake poco F6 , so 2tahun lagi mungkin baru update",2025-06-27T13:46:04Z,0
@BangEgan01,Tecno pova 7 bang🔥🔥🚀,2025-06-27T13:45:46Z,0
@sanscuygaming,Snapdragon 🔥,2025-06-27T13:45:39Z,0
@KAZZ969,Bang david coba hp realme c71 bang david,2025-06-27T13:43:43Z,0
@Ohim2408-ls4hs,review speker nya ketinggalankah bg,2025-06-27T13:41:57Z,0
@ansharamanah1142,"Boleh dong bang kalau tes gaming masukin delta force, game berat juga tuh",2025-06-27T13:41:09Z,0
@Otomotif1997,Baru juga beli Poco x7 malah ngiler f7 . Duh racuuun racun....,2025-06-27T13:40:27Z,2
@pasirdipinggirlaut,Gadgetin doang yg gua tunggu reviewnya,2025-06-27T13:40:23Z,1
@RidhoKurniawan-o2i,Bnyak omong bnyak gaya,2025-06-27T13:39:31Z,0
@dhiky,Mending x7pro atau f7 ?,2025-06-27T13:38:34Z,0
@cllaycreator8002,"Terakhir beli hp vivo z1pro sampe sekarang. 
Selebihnya cuma nonton aja blm bisa kebeli 😂",2025-06-27T13:37:41Z,0
@odpofficial,Enaak penjelasan bang dapit gak bosenin..❤,2025-06-27T13:37:25Z,6
@muhammadtaufik941,Klw sama dengan Samsung a56 bagusan mn ?,2025-06-27T13:35:50Z,0
@aridahse6153,Bang bahas Tecno pova 7,2025-06-27T13:35:30Z,0
@rangawam7059,KING POCO IS BACK,2025-06-27T13:33:07Z,0
@SharonJones-i8b,"Baru nyalain YouTube, langsung nemu ini. Keren banget bro — PULAU-WIN approve ",2025-06-27T13:31:31Z,0
@riantrchannel204,"Hp popok emang juara, tapi aku sih lebih suka OPPO sih karna sparepartnya lebih tahan 👍🏻",2025-06-27T13:31:18Z,0
@marjannike6393,"Kocak f7 game arena brekout ga bisa maen rata kanan, sedangkan kn yg di bawahnya x7 pro bisa",2025-06-27T13:28:21Z,0
@sixfeetlynx,Calon goib jg ni 🗿,2025-06-27T13:28:04Z,0
@carandra67,"bolehlah ini buat ganti device main genshin, itu udah lancar sih mnurut ku",2025-06-27T13:27:44Z,2
@Shoferplus,nfc?,2025-06-27T13:27:37Z,0
@MuhammadIrfansyah-n8y,malah gantengan f7 d banding yg ultra😅,2025-06-27T13:24:29Z,0
@WahyuOdeng13,f6 😢,2025-06-27T13:23:33Z,0
@prodazqren2421,"Bro klo bisa tes gamenya pake game State of Survival, jangan ML sm Genshin trs. Biar keliatan kemampuan hpnya sebatas mana",2025-06-27T13:23:30Z,0
@GaMe-e7q8s,Tecno pova 7 udah launc bang,2025-06-27T13:22:52Z,0
@dwicoc8935,Bang infinix note 50x 5g dong,2025-06-27T13:21:12Z,0
@abdulkamil6454,"Alhamdulillah masih awet yang sya pake skrg Poco F2 Pro, semoga ada rejeki bisa beli adek""nya.",2025-06-27T13:20:25Z,2
@dimaswisnuerlangga,Poco X7 Pro punya gw juga ga ada iklannya sejak awal setting handheld..,2025-06-27T13:20:24Z,0
@yayan.axe.,tekni pova 7 bang lawanin ama Infinix GT 30 pro,2025-06-27T13:19:47Z,0
@ilhamanwar952,semoga hp ini stoknya melimpah,2025-06-27T13:18:32Z,0
@bujang2137,"sang raja datang,dikelas harganya.",2025-06-27T13:18:30Z,0
@rezaardiansyah3736,Mening ini atau motorola edge 60 fusion?,2025-06-27T13:17:02Z,0
@Pembantai_zionis_pesek,itu si Iqbal makin gendut aja 🤣,2025-06-27T13:16:05Z,0
@ojolgaul7480,Bang riview tecno pova 7 ultra dong,2025-06-27T13:15:49Z,0
@juanbastian4465,Unboxing tecno pova 7 bang,2025-06-27T13:14:46Z,0
@sambilngopi4734,"MENYEBALKAN,, GATGETIN KINI TELAT TERUS",2025-06-27T13:14:11Z,0
@mohamadiqbal1311,Bang David  jangan-jangan maskot nya Central park yaa 🤣 tiap review HP di situ mulu,2025-06-27T13:14:01Z,1
@umamyanglain,"ngerii cok, sial hp poco x3 nfc gw masih bisa survive jadi mikir lagi buat upgrade 😂",2025-06-27T13:13:49Z,1
@jeszy17,Di xiaomi store bisa trade in gk guys ?,2025-06-27T13:13:22Z,0
@Akbary-t8w,"Gw kepikiran negara yang lagi perang 
Dunia apakah sudah tua 
Dan apakah mau kiamat",2025-06-27T13:12:42Z,0
@BgKodur,Mantap,2025-06-27T13:12:40Z,0
@Jefryyy-p2r,Bang coba Riview pova 7,2025-06-27T13:12:34Z,0
@HarsaAdventure,Agak jiter 4k 60fsnya,2025-06-27T13:12:26Z,0
@thomaswatterson9375,Woah itu suhu bisa rata gitu,2025-06-27T13:12:12Z,0
@maxguneers8077,Baru beli mi14t eh malah muncul Poco f7 anying bner xiaomi,2025-06-27T13:10:55Z,0
@ChristopherWilliamSimanjun,"Hi, guys. I am comeback again! Thanks for the video content",2025-06-27T13:10:35Z,0
@denahmad9122,bang poco m7 pro  dong,2025-06-27T13:08:57Z,0
@TaopikHidayat-k8r,Pova,2025-06-27T13:08:24Z,0
@solikintel,Tadi malem nyari fidio ini gak ada padahal perasaan kemaren udah ada cuma nonton ya blom Kelar,2025-06-27T13:08:11Z,0
@anjasthirty,Tumben Speaker tidak dibahas bang??,2025-06-27T13:07:54Z,0
@Hilman_Alfarizi_,Yang masih jatuh cinta sama Vivo V40 ?,2025-06-27T13:07:14Z,0
@just_wanz06,"Masih bingung.. Mau ambil iqoo 10 neo apa poco f7.. Mau dibuat kuliah, main game pubg enak, genshin medium-high 60 fps. Dan game fps lainnya..minta sarannya ya",2025-06-27T13:06:03Z,0
@rafaajah27,"Maunya gimana bang?
Kalau budget mentok di 5,5jt-an pilih poco f7 aja, kalau ada budget lebih, mungkin bisa pilih iqoo neo 10, mengingat baterainya sedikit lebih besar dan nge-charge nya lebih cepat, kalau soal performa di iqoo neo 10 ga usah ditanya karena memang kencang buat gaming. dan perlu dingat karena chipset ini masih baru di kedua hp ini, masih ada berberapa game yang kurang maksimal/optimal, jadi tinggal tunggu update dari software atau gamenya bisa jadi lebih smooth.
Jadi intinya sesuai kebutuhan aja sih bang, kedua hp ini sama-sama bagus kok. Ada plus minusnya, mengingat kedua hp ini berada dikelas midrange. Tergantung maunya yang mana",2025-06-27T17:37:16Z,0
@MuhammadRasford10,Baru beli dpt 5.199.000 😂,2025-06-27T13:05:48Z,0
@NicoleJohnston-w8p,"lagi scroll random, eh nyangkut di P͟͟U͟͟L͟͟A͟͟U͟͟W͟͟I͟͟N͟͟?",2025-06-27T13:05:40Z,0
@rabelsaputraa,"jujur agak kecewa sama desain nya, kirain bakalan sama kayak turbo 4",2025-06-27T13:04:42Z,0
@shanxtutorial9569,Bang review Meizu 21 bang 🎉,2025-06-27T13:04:01Z,0
@liesnawtliesnawt,Tecno pova 7 bg,2025-06-27T13:03:15Z,0
@imamzsantose7497,Bismillah semoga kebeli ganti ss a34 😅,2025-06-27T13:02:20Z,0
@kerypict,Wen yh,2025-06-27T13:02:18Z,0
@JeremyRuiz-y8j,"Sering gue replay konten kayak gini, gak bosen-bosen  – bareng PULAU-WIN",2025-06-27T13:00:14Z,0
@yudisupriana5101,ada fitur baypas charging nya? bantu min,2025-06-27T12:57:21Z,0
@66234,"Harusnya aku belinya poco f7, tapi udah keduluan beli yang x7 pro 😢😭",2025-06-27T12:56:08Z,0
@66234,9:48 mana matamu!!!,2025-06-27T12:55:06Z,0
@niputusukayati3100,Tunggu versi redmi note 15 pro+,2025-06-27T12:53:59Z,0
@danikurniawan7517,🔥,2025-06-27T12:53:04Z,0
@daengboank924,Oke awal bulan kitaa gas kan... Up dari Poco F4 ==> Poco F7 😉,2025-06-27T12:51:12Z,0
@datusimbe9983,speakernya ke skip bang?,2025-06-27T12:50:47Z,0
@achmadsetiyono,"Bang bukannya emang kalo buat ngecas ke HP lain pake kabel itu semuanya bisa ya? Soalnya saya dari dulu pake redmi juga bisa² aja meskipun pake seri note 

Saya coba pake USB + OTG itu bisa buat ngecas soalnya 

Mnurutku sih bisa semua bang, bukannya itu udah support tapi emang dari dulu support deh HP generasi² sebelumnya",2025-06-27T12:50:37Z,0
@Irsadul-o8c,bang riview Infinix smart 10 plus,2025-06-27T12:50:00Z,1
@66234,"Infinix seri smart udah pasti banyak kurengnya bang, alias (ga guna)",2025-06-27T12:57:29Z,0
@Farisss11,"Storage 256 aja belon standar di dua jutaan
Storage 512 juga belon standar di 4 sampe 5 jutaan
Padahal makin kesini storage gede makin penting, moga² kedepannya makin gede lah standar storage di hp",2025-06-27T12:49:41Z,1
@tomatombb6561,6:30 salfok cakep wallpaper sinchan nya,2025-06-27T12:45:57Z,24
@DragonestDrwaenCxavoroisza,"Kek nya Launcher, di hyper os 2 gk liat ad font lock screen gt..",2025-06-28T12:31:16Z,0
@jajikibo6969,Adakah yg tau caranya. Info dong,2025-07-12T18:36:00Z,0
@akuultramen1466,"Jadi kesimpulannya, mending Poco F7 biasa, Pro, atau Ultra?",2025-06-27T12:45:41Z,0
@RAY-cq2st,sempurna ini hp,2025-06-27T12:45:19Z,0
@otsukaku,Kapan unboxing nya bang,2025-06-27T12:43:40Z,0
@MuhammadAkbar-dc2ub,Poco punya program tukar tambah kaya xiaomi gak bang? Aku punya poco f4 pengen upgrade,2025-06-27T12:43:28Z,0
@dayhari,jadiin gelang aja biar banyak,2025-06-27T12:43:22Z,0
@Zasktiktok,bang kapan pova 7,2025-06-27T12:43:21Z,0
@ipanahmaddjira8014,"Tecno pova 7 
Rekomendasi",2025-06-27T12:42:18Z,0
@kangagumchanel5570,Masih suka matot gak nih poco yang terbaru???,2025-06-27T12:41:35Z,0
@nothing_true,"*Sebagai pecinta hp ngotak, skip layar yg sudutnya terlalu membulat karena ngecrop gambar/video mengurangi estetika gambar/video utuh 😅*",2025-06-27T12:41:17Z,0
@abdulmgaming,poco x6 nyimak 😅,2025-06-27T12:41:04Z,0
@ichsanbudiono3376,mntap,2025-06-27T12:40:45Z,0
@SVR.S,"Gk ada lagi Mendang-Mending di Keluarga Mi , Sesuaikan kebutuhan & Budget ( Peforma tinggi pilih poco, Kamera 'foto' bagus tp minim budget pilih Redmi , Mau All rounder ya pilih Xiaomi )",2025-06-27T12:40:22Z,0
@isaruna497,"gue udah 7 tahun blum ganti hp, belum koid",2025-06-27T12:39:35Z,0
@hendragemini3455,"Masih stay di poco x3 pro.Dah masuk 4 thn lbh, aman2 aja.Kuncinya, sering2 tiap hari bersihkan sampah2..",2025-06-27T12:39:25Z,0
